hotel_name,hotel_score,hotel_reviews,hotel_lat,hotel_lon,hotel_url,hotel_description
"L'île d'Olive, appartement entier 2 à 4 personnes terrasse 25 m2 Besançon, proche CV, Micropolis et CHU",9.3,43 reviews,47.23667980,6.00761260,https://www.booking.com/hotel/fr/appartement-tres-calme-a-besancon-pour-2-personnes-avec-grande-terrasse.en-gb.html?aid=304142&label=gen173nr-1FCAEoggI46AdIM1gEaE2IAQGYAQm4AQrIAQXYAQHoAQH4AQOIAgGoAgO4Aq6tn6oGwAIB0gIkNTM2YzM5MGItZWM3MS00NDgzLWJkYTctZjlkODZjYzY3MjAz2AIG4AIB&ucfs=1&arphpl=1&group_adults=2&req_adults=2&no_rooms=1&group_children=0&req_children=0&hpos=15&hapos=15&sr_order=bayesian_review_score&srpvid=06267dd759f901e9&srepoch=1699206832&from=searchresults#hotelTmpl,"Offering free WiFi and free private parking, L'île d'Olive, appartement entier 2 à 4 personnes terrasse 25 m2 Besançon, proche CV, Micropolis et CHU is situated in Besançon, just 1.8 km from Besancon Viotte Train Station. The apartment, set in a building dating from 1998, is 3.1 km from Micropolis and 3.4 km from Besançon-Mouillère train station.

The apartment consists of 1 separate bedroom, 1 bathroom and a living room.

The apartment offers a terrace. Hiking can be enjoyed nearby.

Besançon Franche-Comté TGV train station is 12 km from L'île d'Olive, appartement entier 2 à 4 personnes terrasse 25 m2 Besançon, proche CV, Micropolis et CHU, while Time museum of Besançon is 1.9 km from the property. The nearest airport is Dole-Jura Airport, 58 km from the accommodation."
Hôtel AKENA BESANCON,8.5,"2,510 reviews",47.23547525,5.90008540,https://www.booking.com/hotel/fr/akena-besancon.en-gb.html?aid=304142&label=gen173nr-1FCAEoggI46AdIM1gEaE2IAQGYAQm4AQrIAQXYAQHoAQH4AQOIAgGoAgO4Aq6tn6oGwAIB0gIkNTM2YzM5MGItZWM3MS00NDgzLWJkYTctZjlkODZjYzY3MjAz2AIG4AIB&ucfs=1&arphpl=1&group_adults=2&req_adults=2&no_rooms=1&group_children=0&req_children=0&hpos=25&hapos=25&sr_order=bayesian_review_score&srpvid=06267dd759f901e9&srepoch=1699206832&from_sustainable_property_sr=1&from=searchresults#hotelTmpl,"Situated in Besançon, 10 km from Micropolis, Hôtel AKENA BESANCON features accommodation with a terrace, free private parking, a restaurant and a bar. This 3-star hotel offers a 24-hour front desk and free WiFi. The property is non-smoking and is set 16 km from Besancon Viotte Train Station.

At the hotel, the rooms are fitted with a desk, a flat-screen TV, a private bathroom, bed linen and towels. All rooms at Hôtel AKENA BESANCON have air conditioning and a wardrobe.

Guests at the accommodation can enjoy a buffet breakfast.

Besançon-Mouillère train station is 17 km from Hôtel AKENA BESANCON, while Besançon Franche-Comté TGV train station is 17 km from the property. The nearest airport is Dole-Jura Airport, 48 km from the hotel."
"- Le Patio - Calme, Chaleureux, Unique",8.9,31 reviews,47.25740480,6.01461190,https://www.booking.com/hotel/fr/le-patio-besancon.en-gb.html?aid=304142&label=gen173nr-1FCAEoggI46AdIM1gEaE2IAQGYAQm4AQrIAQXYAQHoAQH4AQOIAgGoAgO4Aq6tn6oGwAIB0gIkNTM2YzM5MGItZWM3MS00NDgzLWJkYTctZjlkODZjYzY3MjAz2AIG4AIB&ucfs=1&arphpl=1&group_adults=2&req_adults=2&no_rooms=1&group_children=0&req_children=0&hpos=24&hapos=24&sr_order=bayesian_review_score&srpvid=06267dd759f901e9&srepoch=1699206832&from_sustainable_property_sr=1&from=searchresults#hotelTmpl,"Featuring garden views, - Le Patio - Calme, Chaleureux, Unique offers accommodation with a patio and a coffee machine, around 1.4 km from Besancon Viotte Train Station. This property offers access to a terrace, free private parking and free WiFi.

This apartment comes with 1 bedroom, a kitchen with a dishwasher and a microwave, a flat-screen TV, a seating area and 1 bathroom equipped with a shower. Towels and bed linen are featured in the apartment.

Guests can relax in the garden at the property.

Besançon-Mouillère train station is 3.5 km from the apartment, while Micropolis is 7.6 km away. The nearest airport is Dole-Jura Airport, 61 km from - Le Patio - Calme, Chaleureux, Unique."
Le petit Bisontin - Fast WIFI - Parking gratuit,8.2,13 reviews,47.24290400,6.02103350,https://www.booking.com/hotel/fr/le-petit-bisontin-fast-wifi-parking-gratuit.en-gb.html?aid=304142&label=gen173nr-1FCAEoggI46AdIM1gEaE2IAQGYAQm4AQrIAQXYAQHoAQH4AQOIAgGoAgO4Aq6tn6oGwAIB0gIkNTM2YzM5MGItZWM3MS00NDgzLWJkYTctZjlkODZjYzY3MjAz2AIG4AIB&ucfs=1&arphpl=1&group_adults=2&req_adults=2&no_rooms=1&group_children=0&req_children=0&hpos=20&hapos=20&sr_order=bayesian_review_score&srpvid=06267dd759f901e9&srepoch=1699206832&from=searchresults#hotelTmpl,"Le petit Bisontin - Fast WIFI - Parking gratuit is set in Besançon, 500 metres from Besancon Viotte Train Station, 1.2 km from Besançon-Mouillère train station, and 4.9 km from Micropolis. This apartment is 12 km from Besançon Franche-Comté TGV train station and 4.5 km from Besançon Vesoul University.

The apartment has 1 bedroom, a flat-screen TV and a fully equipped kitchen that provides guests with an oven, a fridge, a washing machine and a stovetop. Towels and bed linen are offered in the apartment.

Popular points of interest near the apartment include Saint-Jean Cathedral Besançon, Time museum of Besançon and Museum of Fine Arts and Archaeology of Besancon. The nearest airport is Dole-Jura Airport, 62 km from Le petit Bisontin - Fast WIFI - Parking gratuit."
Villa duo,8.9,65 reviews,47.26024400,5.98891800,https://www.booking.com/hotel/fr/villa-duo.en-gb.html?aid=304142&label=gen173nr-1FCAEoggI46AdIM1gEaE2IAQGYAQm4AQrIAQXYAQHoAQH4AQOIAgGoAgO4Aq6tn6oGwAIB0gIkNTM2YzM5MGItZWM3MS00NDgzLWJkYTctZjlkODZjYzY3MjAz2AIG4AIB&ucfs=1&arphpl=1&group_adults=2&req_adults=2&no_rooms=1&group_children=0&req_children=0&hpos=22&hapos=22&sr_order=bayesian_review_score&srpvid=06267dd759f901e9&srepoch=1699206832&from=searchresults#hotelTmpl,"Situated in Besançon, 4.1 km from Besancon Viotte Train Station, Villa duo features accommodation with a garden, free private parking, a terrace and a restaurant. Featuring a bar, the property is located within 5.2 km of Besançon-Mouillère train station. Besançon Vesoul University is 1.9 km away and Time museum of Besançon is 5 km from the hotel.

The rooms in the hotel are fitted with a kettle. At Villa duo, rooms come with air conditioning and a flat-screen TV.

Guests at the accommodation can enjoy a continental breakfast.

Micropolis is 5.8 km from Villa duo, while Besançon Franche-Comté TGV train station is 11 km from the property. The nearest airport is Dole-Jura Airport, 61 km from the hotel."
Appart'Hôtel Saint Exupery,8.1,38 reviews,47.25654205,6.02800190,https://www.booking.com/hotel/fr/saint-exupery.en-gb.html?aid=304142&label=gen173nr-1FCAEoggI46AdIM1gEaE2IAQGYAQm4AQrIAQXYAQHoAQH4AQOIAgGoAgO4Aq6tn6oGwAIB0gIkNTM2YzM5MGItZWM3MS00NDgzLWJkYTctZjlkODZjYzY3MjAz2AIG4AIB&ucfs=1&arphpl=1&group_adults=2&req_adults=2&no_rooms=1&group_children=0&req_children=0&hpos=21&hapos=21&sr_order=bayesian_review_score&srpvid=06267dd759f901e9&srepoch=1699206832&from=searchresults#hotelTmpl,"Situated in Besançon in the Franche-Comté region, Appart'Hôtel Saint Exupery has a balcony. This property offers access to a terrace, free private parking and free WiFi.

Offering 1 bedroom and 1 bathroom with a bath, this apartment features a flat-screen TV.

Besancon Viotte Train Station is 1.3 km from the apartment, while Besançon-Mouillère train station is 2.7 km from the property. The nearest airport is Dole-Jura Airport, 62 km from Appart'Hôtel Saint Exupery."
Logis Hôtel Victor Hugo & Spa,8.4,703 reviews,47.24741871,6.02364331,https://www.booking.com/hotel/fr/logis-de-france-florel.en-gb.html?aid=304142&label=gen173nr-1FCAEoggI46AdIM1gEaE2IAQGYAQm4AQrIAQXYAQHoAQH4AQOIAgGoAgO4Aq6tn6oGwAIB0gIkNTM2YzM5MGItZWM3MS00NDgzLWJkYTctZjlkODZjYzY3MjAz2AIG4AIB&ucfs=1&arphpl=1&group_adults=2&req_adults=2&no_rooms=1&group_children=0&req_children=0&hpos=23&hapos=23&sr_order=bayesian_review_score&srpvid=06267dd759f901e9&srepoch=1699206832&from=searchresults#hotelTmpl,"Logis Hôtel Victor Hugo & Spa offers accommodation 50 metres from Viotte train station and just 15 minutes' walking distance from the historic city centre of Besançon. Many rooms open onto an inner garden.

All the rooms come with ensuite facilities, satellite TV, a telephone and free WiFi access.

To get off to a good start you can enjoy your breakfast before heading out to experience the capital of the Franche-Comté region.

Several adjustable equipped meeting rooms are available onsite and can accommodate groups of up to 45 people.

Other onsite services available to guests aged 12 and above include a fitness room, a heated outdoor pool, a sauna, 2 hot tubs, a hammam, a sensorial shower and a relaxation room . Massages using Equatoria products.

Secure private parking is featured onsite."
Appartement - jacuzzi et sauna - Pour deux,8.7,74 reviews,47.25391770,6.01621490,https://www.booking.com/hotel/fr/appartement-jacuzzi-et-sauna-pour-deux.en-gb.html?aid=304142&label=gen173nr-1FCAEoggI46AdIM1gEaE2IAQGYAQm4AQrIAQXYAQHoAQH4AQOIAgGoAgO4Aq6tn6oGwAIB0gIkNTM2YzM5MGItZWM3MS00NDgzLWJkYTctZjlkODZjYzY3MjAz2AIG4AIB&ucfs=1&arphpl=1&group_adults=2&req_adults=2&no_rooms=1&group_children=0&req_children=0&hpos=18&hapos=18&sr_order=bayesian_review_score&srpvid=06267dd759f901e9&srepoch=1699206832&from=searchresults#hotelTmpl,"Featuring a sauna, Appartement - jacuzzi et sauna - Pour deux is located in Besançon. This apartment is less than 1 km from Besancon Viotte Train Station and 3 km from Besançon-Mouillère train station.

The apartment comes with 1 bedroom, a flat-screen TV with streaming services and a fully equipped kitchen that provides guests with a microwave and a fridge. Towels and bed linen are featured in the apartment.

Micropolis is 5.7 km from the apartment, while Besançon Franche-Comté TGV train station is 10 km away. The nearest airport is Dole-Jura Airport, 61 km from Appartement - jacuzzi et sauna - Pour deux."
Villa duo,8.9,60 reviews,47.26024400,5.98891800,https://www.booking.com/hotel/fr/villa-duo-besancon1.en-gb.html?aid=304142&label=gen173nr-1FCAEoggI46AdIM1gEaE2IAQGYAQm4AQrIAQXYAQHoAQH4AQOIAgGoAgO4Aq6tn6oGwAIB0gIkNTM2YzM5MGItZWM3MS00NDgzLWJkYTctZjlkODZjYzY3MjAz2AIG4AIB&ucfs=1&arphpl=1&group_adults=2&req_adults=2&no_rooms=1&group_children=0&req_children=0&hpos=19&hapos=19&sr_order=bayesian_review_score&srpvid=06267dd759f901e9&srepoch=1699206832&from=searchresults#hotelTmpl,"Set in Besançon, 4.1 km from Besancon Viotte Train Station, Villa duo offers accommodation with a garden, free private parking, a terrace and a restaurant. Offering a bar, the property is located within 5.2 km of Besançon-Mouillère train station. Besançon Vesoul University is 1.9 km away and Time museum of Besançon is 5 km from the hotel.

The units in the hotel are equipped with a flat-screen TV.

A continental breakfast is available every morning at Villa duo.

Micropolis is 5.8 km from the accommodation, while Besançon Franche-Comté TGV train station is 11 km away. The nearest airport is Dole-Jura Airport, 61 km from Villa duo."
"Le Chasnot, proche gare et centre ville",8.6,64 reviews,47.24733250,6.02750230,https://www.booking.com/hotel/fr/le-chasnot-proche-gare-et-centre-ville.en-gb.html?aid=304142&label=gen173nr-1FCAEoggI46AdIM1gEaE2IAQGYAQm4AQrIAQXYAQHoAQH4AQOIAgGoAgO4Aq6tn6oGwAIB0gIkNTM2YzM5MGItZWM3MS00NDgzLWJkYTctZjlkODZjYzY3MjAz2AIG4AIB&ucfs=1&arphpl=1&group_adults=2&req_adults=2&no_rooms=1&group_children=0&req_children=0&hpos=17&hapos=17&sr_order=bayesian_review_score&srpvid=06267dd759f901e9&srepoch=1699206832&from=searchresults#hotelTmpl,"Le Chasnot, proche gare et centre ville is situated in Besançon, 1 km from Besançon-Mouillère train station, 5.3 km from Micropolis, as well as 11 km from Besançon Franche-Comté TGV train station. The accommodation is 500 metres from Besancon Viotte Train Station, and guests benefit from complimentary WiFi and private parking available on site.

The 2-bedroom apartment features a living room with a flat-screen TV, a fully equipped kitchen with dishwasher and oven, and 2 bathrooms with a hair dryer. Towels and bed linen are available in the apartment.

Popular points of interest near the apartment include Saint-Jean Cathedral Besançon, Time museum of Besançon and Museum of Fine Arts and Archaeology of Besancon. The nearest airport is Dole-Jura Airport, 62 km from Le Chasnot, proche gare et centre ville."
