hotel_name,hotel_score,hotel_reviews,hotel_lat,hotel_lon,hotel_url,hotel_description
VUE SPECTACULAIRE - LA VERRIERE - CENTRE-VILLE - Home-One,7.6,38 reviews,47.23887820,6.02550190,https://www.booking.com/hotel/fr/la-verriere-besancon.en-gb.html?aid=304142&label=gen173nr-1FCAEoggI46AdIM1gEaE2IAQGYAQm4AQrIAQXYAQHoAQH4AQOIAgGoAgO4AoGrn6oGwAIB0gIkOTY3ZjJjMDctMWE3My00NWMxLTk4MjgtMGM1Y2M2NjgyN2M02AIG4AIB&ucfs=1&arphpl=1&group_adults=2&req_adults=2&no_rooms=1&group_children=0&req_children=0&hpos=22&hapos=47&sr_order=bayesian_review_score&srpvid=29067d411c1f001f&srepoch=1699206531&from=searchresults#hotelTmpl,"Ideally situated in the centre of Besançon, VUE SPECTACULAIRE - LA VERRIERE - CENTRE-VILLE - Home-One is within a short distance of Besançon-Mouillère train station and Besancon Viotte Train Station. This apartment is 5.7 km from Micropolis and 12 km from Besançon Franche-Comté TGV train station.

With free WiFi, this 2-bedroom apartment features a flat-screen TV, a washing machine and a kitchen with an oven and microwave.

Popular points of interest near the apartment include Saint-Jean Cathedral Besançon, Time museum of Besançon and Museum of Fine Arts and Archaeology of Besancon. The nearest airport is Dole-Jura Airport, 63 km from VUE SPECTACULAIRE - LA VERRIERE - CENTRE-VILLE - Home-One."
Les Fabuleux appartements du Coeur de ville - Place Victor Hugo,8.2,65 reviews,47.23501264,6.02944083,https://www.booking.com/hotel/fr/face-a-victor-besancon.en-gb.html?aid=304142&label=gen173nr-1FCAEoggI46AdIM1gEaE2IAQGYAQm4AQrIAQXYAQHoAQH4AQOIAgGoAgO4AoGrn6oGwAIB0gIkOTY3ZjJjMDctMWE3My00NWMxLTk4MjgtMGM1Y2M2NjgyN2M02AIG4AIB&ucfs=1&arphpl=1&group_adults=2&req_adults=2&no_rooms=1&group_children=0&req_children=0&hpos=20&hapos=45&sr_order=bayesian_review_score&srpvid=29067d411c1f001f&srepoch=1699206531&from_sustainable_property_sr=1&from=searchresults#hotelTmpl,"Les Fabuleux appartements du Coeur de ville - Place Victor Hugo provides accommodation within 200 metres of the centre of Besançon, with free WiFi, and a kitchen with a dishwasher, an oven and a microwave.

All units include a private bathroom and have air conditioning, a flat-screen TV and a fridge. A stovetop and kitchenware are also provided, as well as a coffee machine and a kettle.

If you would like to discover the area, cycling, fishing and hiking are possible in the surroundings.

Popular points of interest near the apartment include Besançon-Mouillère train station, Besancon Viotte Train Station and Saint-Jean Cathedral Besançon. The nearest airport is Dole-Jura Airport, 64 km from Les Fabuleux appartements du Coeur de ville - Place Victor Hugo."
Maison duo,9.1,30 reviews,47.26021404,5.98891880,https://www.booking.com/hotel/fr/maison-duo.en-gb.html?aid=304142&label=gen173nr-1FCAEoggI46AdIM1gEaE2IAQGYAQm4AQrIAQXYAQHoAQH4AQOIAgGoAgO4AoGrn6oGwAIB0gIkOTY3ZjJjMDctMWE3My00NWMxLTk4MjgtMGM1Y2M2NjgyN2M02AIG4AIB&ucfs=1&arphpl=1&group_adults=2&req_adults=2&no_rooms=1&group_children=0&req_children=0&hpos=19&hapos=44&sr_order=bayesian_review_score&srpvid=29067d411c1f001f&srepoch=1699206531&from=searchresults#hotelTmpl,"Offering a garden and garden view, Maison duo is set in Besançon, 4.1 km from Besancon Viotte Train Station and 5.2 km from Besançon-Mouillère train station. This property offers a pool with a view, free WiFi and free private parking.

The holiday home is fitted with 2 bedrooms, 1 bathroom, bed linen, towels, a flat-screen TV, a dining area, a fully equipped kitchen, and a terrace with pool views.

Micropolis is 5.8 km from the holiday home, while Besançon Franche-Comté TGV train station is 11 km away. The nearest airport is Dole-Jura Airport, 61 km from Maison duo."
Hotel Vauban,8.4,363 reviews,47.23986296,6.02139884,https://www.booking.com/hotel/fr/vauban-besancon.en-gb.html?aid=304142&label=gen173nr-1FCAEoggI46AdIM1gEaE2IAQGYAQm4AQrIAQXYAQHoAQH4AQOIAgGoAgO4AoGrn6oGwAIB0gIkOTY3ZjJjMDctMWE3My00NWMxLTk4MjgtMGM1Y2M2NjgyN2M02AIG4AIB&ucfs=1&arphpl=1&group_adults=2&req_adults=2&no_rooms=1&group_children=0&req_children=0&hpos=18&hapos=43&sr_order=bayesian_review_score&srpvid=29067d411c1f001f&srepoch=1699206531&from_sustainable_property_sr=1&from=searchresults#hotelTmpl,"Located in Besançon, Hotel Vauban a 2-minute walk from the Museum of Fine Arts and an 18-minute walk from the Citadel of Besançon. It offers free internet access, a 24-hour front desk and a terrace.

Serviced by a lift, all the soundproofed rooms feature a flat-screen TV, a minibar and a telephone. The bathroom is complete with free toiletries, a hairdryer and a bath or shower.

Both a continental and a buffet breakfast are served every morning at Hotel Vauban.  The property has 2 restaurants: an Italian and traditional meals are served.

Some rooms are suitable for guests with reduced mobility. The hotel is a 5-minute drive from Besançon Train Station and a 15-minute walk from the Madeleine Church."
APPARTEMENT CENTRE HISTORIQUE,8.3,96 reviews,47.23432450,6.02773470,https://www.booking.com/hotel/fr/appartement-centre-historique-besancon.en-gb.html?aid=304142&label=gen173nr-1FCAEoggI46AdIM1gEaE2IAQGYAQm4AQrIAQXYAQHoAQH4AQOIAgGoAgO4AoGrn6oGwAIB0gIkOTY3ZjJjMDctMWE3My00NWMxLTk4MjgtMGM1Y2M2NjgyN2M02AIG4AIB&ucfs=1&arphpl=1&group_adults=2&req_adults=2&no_rooms=1&group_children=0&req_children=0&hpos=16&hapos=41&sr_order=bayesian_review_score&srpvid=29067d411c1f001f&srepoch=1699206531&from=searchresults#hotelTmpl,"Located in the centre of Besançon, just 1.2 km from Besançon-Mouillère train station and 1.9 km from Besancon Viotte Train Station, APPARTEMENT CENTRE HISTORIQUE provides accommodation with inner courtyard views and free WiFi. It is set 5.2 km from Micropolis and offers a shared kitchen.

The apartment consists of 3 bedrooms, a living room, a fully equipped kitchen with an oven and a coffee machine, and 1 bathroom with a bath. Towels and bed linen are provided in the apartment.

A car rental service is available at the apartment.

Popular points of interest near APPARTEMENT CENTRE HISTORIQUE include Saint-Jean Cathedral Besançon, Time museum of Besançon and Museum of Fine Arts and Archaeology of Besancon. The nearest airport is Dole-Jura Airport, 64 km from the accommodation."
hotel_name,hotel_score,hotel_reviews,hotel_lat,hotel_lon,hotel_url,hotel_description
Chambre d'Hôtes La Villa Molina,9.3,206 reviews,47.25044475,6.02088064,https://www.booking.com/hotel/fr/la-villa-molina.en-gb.html?aid=304142&label=gen173nr-1FCAEoggI46AdIM1gEaE2IAQGYAQm4AQrIAQXYAQHoAQH4AQOIAgGoAgO4Aq6tn6oGwAIB0gIkNTM2YzM5MGItZWM3MS00NDgzLWJkYTctZjlkODZjYzY3MjAz2AIG4AIB&ucfs=1&arphpl=1&group_adults=2&req_adults=2&no_rooms=1&group_children=0&req_children=0&hpos=4&hapos=4&sr_order=bayesian_review_score&srpvid=06267dd759f901e9&srepoch=1699206832&from=searchresults#hotelTmpl,"Set in a tree-lined garden with a shaded terrace, this French villa is located a 5-minute walk from Viotte Train Station. A continental breakfast is served daily and the guest room offers a garden view.

Decorated in a modern style, the guest room features antique furnishings. An LCD TV with a DVD player is provided and there is a choice of films on offer. Free Wi-Fi access is also included at La Villa Molina.

The property is just a 3-minute walk from the tramway, which gives easy access to Besançon city centre and Micropolis Exhibition Centre. Besançon Museum of Fine Arts is 1.6 km from this guest house and the historic centre is just a 15-minute walk away. Free private parking is available on site."
L’appart[é] BLACK superbe appartement pop !,8.9,101 reviews,47.24874380,6.02874180,https://www.booking.com/hotel/fr/appart-e-black-superbe-appartement-pop.en-gb.html?aid=304142&label=gen173nr-1FCAEoggI46AdIM1gEaE2IAQGYAQm4AQrIAQXYAQHoAQH4AQOIAgGoAgO4Aq6tn6oGwAIB0gIkNTM2YzM5MGItZWM3MS00NDgzLWJkYTctZjlkODZjYzY3MjAz2AIG4AIB&ucfs=1&arphpl=1&group_adults=2&req_adults=2&no_rooms=1&group_children=0&req_children=0&hpos=7&hapos=7&sr_order=bayesian_review_score&srpvid=06267dd759f901e9&srepoch=1699206832&from=searchresults#hotelTmpl,"Boasting a spa bath, L’appart[é] BLACK superbe appartement pop! is set in Besançon. The air-conditioned accommodation is 600 metres from Besancon Viotte Train Station, and guests benefit from complimentary WiFi and private parking available on site.

The apartment has 1 bedroom, a flat-screen TV with streaming services, an equipped kitchen with a microwave and a fridge, and 1 bathroom with a hot tub. Towels and bed linen are offered in the apartment.

At the apartment guests are welcome to take advantage of a hot tub.

Popular points of interest near L’appart[é] BLACK superbe appartement pop! include Besançon-Mouillère train station, Time museum of Besançon and Museum of Fine Arts and Archaeology of Besancon. The nearest airport is Dole-Jura Airport, 62 km from the accommodation."
ATELIER DES REVES - au coeur de Besancon - 88 m2,9.3,100 reviews,47.23966980,6.03430430,https://www.booking.com/hotel/fr/atelier-des-reves-au-coeur-de-besancon.en-gb.html?aid=304142&label=gen173nr-1FCAEoggI46AdIM1gEaE2IAQGYAQm4AQrIAQXYAQHoAQH4AQOIAgGoAgO4Aq6tn6oGwAIB0gIkNTM2YzM5MGItZWM3MS00NDgzLWJkYTctZjlkODZjYzY3MjAz2AIG4AIB&ucfs=1&arphpl=1&group_adults=2&req_adults=2&no_rooms=1&group_children=0&req_children=0&hpos=1&hapos=1&sr_order=bayesian_review_score&srpvid=06267dd759f901e9&srepoch=1699206832&from_sustainable_property_sr=1&from=searchresults#hotelTmpl,"Set in Besançon, 100 metres from Besançon-Mouillère train station and 1.5 km from Besancon Viotte Train Station, ATELIER DES REVES - au coeur de Besancon - 88 m2 offers air conditioning. It has city views and free WiFithroughout the property.

The apartment with a terrace and garden views features 2 bedrooms, a living room, a flat-screen TV, an equipped kitchen with a dishwasher and an oven, and 2 bathrooms with a walk-in shower. Towels and bed linen are featured in the apartment.

A bicycle rental service is available at the apartment, while fishing can be enjoyed nearby.

Popular points of interest near ATELIER DES REVES - au coeur de Besancon - 88 m2 include Saint-Jean Cathedral Besançon, Time museum of Besançon and Museum of Fine Arts and Archaeology of Besancon. The nearest airport is Dole-Jura Airport, 64 km from the accommodation."
Les Terrasses de La Malcombe,9.3,98 reviews,47.22448610,5.98300771,https://www.booking.com/hotel/fr/les-terrasses-de-la-malcombe.en-gb.html?aid=304142&label=gen173nr-1FCAEoggI46AdIM1gEaE2IAQGYAQm4AQrIAQXYAQHoAQH4AQOIAgGoAgO4Aq6tn6oGwAIB0gIkNTM2YzM5MGItZWM3MS00NDgzLWJkYTctZjlkODZjYzY3MjAz2AIG4AIB&ucfs=1&arphpl=1&group_adults=2&req_adults=2&no_rooms=1&group_children=0&req_children=0&hpos=6&hapos=6&sr_order=bayesian_review_score&srpvid=06267dd759f901e9&srepoch=1699206832&from=searchresults#hotelTmpl,"Featuring inner courtyard views, Les Terrasses de La Malcombe provides accommodation with a balcony and a coffee machine, around 500 metres from Micropolis. It features a garden, barbecue facilities, garden views and free WiFithroughout the property.

The apartment comes with 1 bedroom, 1 bathroom, bed linen, towels, a flat-screen TV with cable channels, a dining area, a fully equipped kitchen, and a terrace with mountain views.

The reception at the apartment can provide tips on the area.

Both a bicycle rental service and a car rental service are available at Les Terrasses de La Malcombe, while cycling can be enjoyed nearby.

Besancon Viotte Train Station is 4.7 km from the accommodation, while Besançon-Mouillère train station is 5.8 km away. The nearest airport is Dole-Jura Airport, 56 km from Les Terrasses de La Malcombe."
Le New York Bisontin,9.4,112 reviews,47.24818544,6.01924119,https://www.booking.com/hotel/fr/le-new-york-bisontin.en-gb.html?aid=304142&label=gen173nr-1FCAEoggI46AdIM1gEaE2IAQGYAQm4AQrIAQXYAQHoAQH4AQOIAgGoAgO4Aq6tn6oGwAIB0gIkNTM2YzM5MGItZWM3MS00NDgzLWJkYTctZjlkODZjYzY3MjAz2AIG4AIB&ucfs=1&arphpl=1&group_adults=2&req_adults=2&no_rooms=1&group_children=0&req_children=0&hpos=5&hapos=5&sr_order=bayesian_review_score&srpvid=06267dd759f901e9&srepoch=1699206832&from=searchresults#hotelTmpl,"Situated in Besançon and only 500 metres from Besancon Viotte Train Station, Le New York Bisontin features accommodation with quiet street views, free WiFi and free private parking. This apartment is 4.9 km from Micropolis and 11 km from Besançon Franche-Comté TGV train station.

The apartment has 1 bedroom, a flat-screen TV with satellite channels, an equipped kitchen with a dishwasher and a microwave, a washing machine, and 1 bathroom with a shower. Towels and bed linen are available in the apartment.

A car rental service is available at the apartment.

Popular points of interest near Le New York Bisontin include Besançon-Mouillère train station, Time museum of Besançon and Museum of Fine Arts and Archaeology of Besancon. The nearest airport is Dole-Jura Airport, 62 km from the accommodation."
LA DOLCEVITA SPA Chambre privative,9.1,60 reviews,47.24066844,6.01868773,https://www.booking.com/hotel/fr/by-nad-spa.en-gb.html?aid=304142&label=gen173nr-1FCAEoggI46AdIM1gEaE2IAQGYAQm4AQrIAQXYAQHoAQH4AQOIAgGoAgO4Aq6tn6oGwAIB0gIkNTM2YzM5MGItZWM3MS00NDgzLWJkYTctZjlkODZjYzY3MjAz2AIG4AIB&ucfs=1&arphpl=1&group_adults=2&req_adults=2&no_rooms=1&group_children=0&req_children=0&hpos=8&hapos=8&sr_order=bayesian_review_score&srpvid=06267dd759f901e9&srepoch=1699206832&from_sustainable_property_sr=1&from=searchresults#hotelTmpl,"Featuring a spa bath, LA DOLCEVITA SPA Chambre privative is set in Besançon. It features a shared lounge, inner courtyard views and free WiFithroughout the property.

This air-conditioned bed and breakfast comes with a kitchenette, a seating area, a dining area and a cable flat-screen TV. Towels and bed linen are featured in the bed and breakfast.

At the bed and breakfast guests are welcome to take advantage of a hot tub and spa facilities.

Popular points of interest near LA DOLCEVITA SPA Chambre privative include Besancon Viotte Train Station, Besançon-Mouillère train station and Time museum of Besançon. The nearest airport is Dole-Jura Airport, 62 km from the accommodation."
L'adresse à Besançon,9.6,168 reviews,47.24736834,6.03148374,https://www.booking.com/hotel/fr/l-39-adresse-a-besancon.en-gb.html?aid=304142&label=gen173nr-1FCAEoggI46AdIM1gEaE2IAQGYAQm4AQrIAQXYAQHoAQH4AQOIAgGoAgO4Aq6tn6oGwAIB0gIkNTM2YzM5MGItZWM3MS00NDgzLWJkYTctZjlkODZjYzY3MjAz2AIG4AIB&ucfs=1&arphpl=1&group_adults=2&req_adults=2&no_rooms=1&group_children=0&req_children=0&hpos=3&hapos=3&sr_order=bayesian_review_score&srpvid=06267dd759f901e9&srepoch=1699206832&from_sustainable_property_sr=1&from=searchresults#hotelTmpl,"Boasting inner courtyard views, L'adresse à Besançon features accommodation with a balcony and a coffee machine, around less than 1 km from Besancon Viotte Train Station. It is situated 1.1 km from Besançon-Mouillère train station and provides full-day security.

The apartment with a terrace and garden views has 1 bedroom, a living room, a flat-screen TV, an equipped kitchen with a dishwasher and an oven, and 1 bathroom with a walk-in shower. Featuring free private parking, this 4-star apartment also features free WiFithroughout the property.

The apartment offers a picnic area. A outdoor play equipment is also available at L'adresse à Besançon, while guests can also relax in the garden.

Popular points of interest near the accommodation include Saint-Jean Cathedral Besançon, Time museum of Besançon and Museum of Fine Arts and Archaeology of Besancon. The nearest airport is Dole-Jura Airport, 63 km from L'adresse à Besançon."
Besac Urban Lodge,9.4,73 reviews,47.26812150,6.04163520,https://www.booking.com/hotel/fr/besac-urban-lodge.en-gb.html?aid=304142&label=gen173nr-1FCAEoggI46AdIM1gEaE2IAQGYAQm4AQrIAQXYAQHoAQH4AQOIAgGoAgO4Aq6tn6oGwAIB0gIkNTM2YzM5MGItZWM3MS00NDgzLWJkYTctZjlkODZjYzY3MjAz2AIG4AIB&ucfs=1&arphpl=1&group_adults=2&req_adults=2&no_rooms=1&group_children=0&req_children=0&hpos=2&hapos=2&sr_order=bayesian_review_score&srpvid=06267dd759f901e9&srepoch=1699206832&from_sustainable_property_sr=1&from=searchresults#hotelTmpl,"Set just 3.6 km from Besancon Viotte Train Station, Besac Urban Lodge offers accommodation in Besançon with access to a garden, a shared lounge, as well as a shared kitchen. This property offers access to a terrace, free private parking and free WiFi.

The apartment is fitted with 2 bedrooms, a flat-screen TV and a fully equipped kitchen that provides guests with an oven, a microwave, a washing machine, a toaster and a fridge. Towels and bed linen are offered in the apartment.

The apartment offers a picnic area.

Besançon-Mouillère train station is 4.5 km from Besac Urban Lodge, while Micropolis is 8 km from the property. The nearest airport is Dole-Jura Airport, 63 km from the accommodation."
LE 46 : Superbe appartement jacuzzi,9.1,56 reviews,47.23446060,6.00970580,https://www.booking.com/hotel/fr/le-46-superbe-appartement-jacuzzi.en-gb.html?aid=304142&label=gen173nr-1FCAEoggI46AdIM1gEaE2IAQGYAQm4AQrIAQXYAQHoAQH4AQOIAgGoAgO4Aq6tn6oGwAIB0gIkNTM2YzM5MGItZWM3MS00NDgzLWJkYTctZjlkODZjYzY3MjAz2AIG4AIB&ucfs=1&arphpl=1&group_adults=2&req_adults=2&no_rooms=1&group_children=0&req_children=0&hpos=11&hapos=11&sr_order=bayesian_review_score&srpvid=06267dd759f901e9&srepoch=1699206832&from=searchresults#hotelTmpl,"Situated 2.9 km from Micropolis, LE 46: Superbe appartement jacuzzi features accommodation in Besançon with access to a hot tub. Set 1.9 km from Besancon Viotte Train Station, the property offers a spa and wellness centre and free private parking.

This apartment is fitted with 1 bedroom, a kitchenette with a microwave and a fridge, a flat-screen TV, a seating area and 1 bathroom fitted with a hot tub.

Popular points of interest near the apartment include Time museum of Besançon, Museum of Fine Arts and Archaeology of Besancon and Saint-Jean Cathedral Besançon. The nearest airport is Dole-Jura Airport, 58 km from LE 46: Superbe appartement jacuzzi."
Centre ville historique - calme - les mots bleus,9.3,64 reviews,47.23339100,6.02831360,https://www.booking.com/hotel/fr/centre-ville-historique-calme-les-mots-bleus.en-gb.html?aid=304142&label=gen173nr-1FCAEoggI46AdIM1gEaE2IAQGYAQm4AQrIAQXYAQHoAQH4AQOIAgGoAgO4Aq6tn6oGwAIB0gIkNTM2YzM5MGItZWM3MS00NDgzLWJkYTctZjlkODZjYzY3MjAz2AIG4AIB&ucfs=1&arphpl=1&group_adults=2&req_adults=2&no_rooms=1&group_children=0&req_children=0&hpos=9&hapos=9&sr_order=bayesian_review_score&srpvid=06267dd759f901e9&srepoch=1699206832&from=searchresults#hotelTmpl,"Situated in the centre of Besançon, just 1.2 km from Besançon-Mouillère train station and 2 km from Besancon Viotte Train Station, Centre ville historique - calme - les mots bleus features accommodation with quiet street views and free WiFi. It is located 4.9 km from Micropolis and provides a 24-hour front desk.

The 1-bedroom apartment features a living room with a flat-screen TV, a fully equipped kitchen with dishwasher and microwave, and 1 bathroom with a hair dryer. Towels and bed linen are available in the apartment.

Popular points of interest near the apartment include Time museum of Besançon, Saint-Jean Cathedral Besançon and Museum of Fine Arts and Archaeology of Besancon. The nearest airport is Dole-Jura Airport, 60 km from Centre ville historique - calme - les mots bleus."
Appartement avec sauna au pied de la citadelle,8.9,109 reviews,47.23384430,6.02879220,https://www.booking.com/hotel/fr/appartement-au-pied-de-la-citadelle-avec-sauna.en-gb.html?aid=304142&label=gen173nr-1FCAEoggI46AdIM1gEaE2IAQGYAQm4AQrIAQXYAQHoAQH4AQOIAgGoAgO4Aq6tn6oGwAIB0gIkNTM2YzM5MGItZWM3MS00NDgzLWJkYTctZjlkODZjYzY3MjAz2AIG4AIB&ucfs=1&arphpl=1&group_adults=2&req_adults=2&no_rooms=1&group_children=0&req_children=0&hpos=14&hapos=14&sr_order=bayesian_review_score&srpvid=06267dd759f901e9&srepoch=1699206832&from=searchresults#hotelTmpl,"Boasting a sauna, Appartement avec sauna au pied de la citadelle is situated right in the heart of Besançon. The apartment has access to a restaurant and free WiFithroughout the property.

This apartment features 1 bedroom, a kitchen with a dishwasher and an oven, a TV, a seating area and 1 bathroom fitted with a shower. Towels and bed linen are available in the apartment.

At the apartment guests are welcome to take advantage of a sauna.

Popular points of interest near Appartement avec sauna au pied de la citadelle include Besançon-Mouillère train station, Besancon Viotte Train Station and Time museum of Besançon. The nearest airport is Dole-Jura Airport, 60 km from the accommodation."
L’appart[é] Gold,8.9,84 reviews,47.24874380,6.02874180,https://www.booking.com/hotel/fr/appart-e-gold.en-gb.html?aid=304142&label=gen173nr-1FCAEoggI46AdIM1gEaE2IAQGYAQm4AQrIAQXYAQHoAQH4AQOIAgGoAgO4Aq6tn6oGwAIB0gIkNTM2YzM5MGItZWM3MS00NDgzLWJkYTctZjlkODZjYzY3MjAz2AIG4AIB&ucfs=1&arphpl=1&group_adults=2&req_adults=2&no_rooms=1&group_children=0&req_children=0&hpos=10&hapos=10&sr_order=bayesian_review_score&srpvid=06267dd759f901e9&srepoch=1699206832&from=searchresults#hotelTmpl,"Situated in Besançon, 600 metres from Besancon Viotte Train Station and 1.2 km from Besançon-Mouillère train station, L’appart[é] Gold offers free WiFi and air conditioning. This apartment is 5.5 km from Micropolis and 12 km from Besançon Franche-Comté TGV train station.

The apartment is located on the ground floor and has 1 bedroom, a flat-screen TV with streaming services and a fully equipped kitchen that provides guests with a microwave and a fridge. Towels and bed linen are offered in the apartment.

The apartment offers a hot tub.

Saint-Jean Cathedral Besançon is 2.3 km from L’appart[é] Gold, while Time museum of Besançon is 1.7 km from the property. The nearest airport is Dole-Jura Airport, 62 km from the accommodation."
"Appartement très calme, terrasse & jardin en ville",9.0,57 reviews,47.23962506,6.01017403,https://www.booking.com/hotel/fr/appartement-tres-calme-terrasse-amp-jardin-en-ville.en-gb.html?aid=304142&label=gen173nr-1FCAEoggI46AdIM1gEaE2IAQGYAQm4AQrIAQXYAQHoAQH4AQOIAgGoAgO4Aq6tn6oGwAIB0gIkNTM2YzM5MGItZWM3MS00NDgzLWJkYTctZjlkODZjYzY3MjAz2AIG4AIB&ucfs=1&arphpl=1&group_adults=2&req_adults=2&no_rooms=1&group_children=0&req_children=0&hpos=16&hapos=16&sr_order=bayesian_review_score&srpvid=06267dd759f901e9&srepoch=1699206832&from=searchresults#hotelTmpl,"Featuring garden views, Appartement très calme, terrasse & jardin en ville features accommodation with a patio and a coffee machine, around 1.4 km from Besancon Viotte Train Station. This property offers access to a terrace, free private parking and free WiFi.

Boasting a Nintendo Wii, the apartment has a kitchen with a dishwasher, an oven and a toaster, a living room with a seating area and a dining area, 2 bedrooms, and 1 bathroom with a bath and a shower. A flat-screen TV with streaming services and a game console are available.

The apartment offers a picnic area. Guests can also relax in the garden.

Popular points of interest near Appartement très calme, terrasse & jardin en ville include Time museum of Besançon, Museum of Fine Arts and Archaeology of Besancon and Saint-Jean Cathedral Besançon. The nearest airport is Dole-Jura Airport, 59 km from the accommodation."
Hôtel Restaurant Spa Le Sauvage,8.7,"1,138 reviews",47.23171767,6.02759153,https://www.booking.com/hotel/fr/ho-tel-le-sauvage-besanasson.en-gb.html?aid=304142&label=gen173nr-1FCAEoggI46AdIM1gEaE2IAQGYAQm4AQrIAQXYAQHoAQH4AQOIAgGoAgO4Aq6tn6oGwAIB0gIkNTM2YzM5MGItZWM3MS00NDgzLWJkYTctZjlkODZjYzY3MjAz2AIG4AIB&ucfs=1&arphpl=1&group_adults=2&req_adults=2&no_rooms=1&group_children=0&req_children=0&hpos=13&hapos=13&sr_order=bayesian_review_score&srpvid=06267dd759f901e9&srepoch=1699206832&from_sustainable_property_sr=1&from=searchresults#hotelTmpl,"Hôtel Restaurant Spa Le Sauvage, formerly the Clarisses Monestary, is located in the historic district of Besançon, 500 metres from the citadel's ancient walls. It offers views of the tree-lined park, the medieval walls, the city and the Doubs Valley.

All of the rooms feature parquet flooring and a private bathroom with a bath or shower. They also have a flat-screen TV, telephone and a desk. Some rooms offer a view on the garden and on the city.

Breakfast is served every morning in the dining area, on the terrace or can be brought to your guest room upon request. You can also relax on the west-facing terrace with a drink from the bar. Guest can access the spa upon reservation and for an additional fee.

Hôtel Restaurant Spa Le Sauvage is a 10-minute walk from the Musée du Temps and just 2 km from Besancon Viotte Train Station. Shops and restaurants can be found within a 10-minute walk. Private parking is available at a surcharge and free WiFi internet access is provided."
Résidence Charles Quint,8.7,154 reviews,47.23347773,6.03081581,https://www.booking.com/hotel/fr/ra-c-sidence-charles-quint.en-gb.html?aid=304142&label=gen173nr-1FCAEoggI46AdIM1gEaE2IAQGYAQm4AQrIAQXYAQHoAQH4AQOIAgGoAgO4Aq6tn6oGwAIB0gIkNTM2YzM5MGItZWM3MS00NDgzLWJkYTctZjlkODZjYzY3MjAz2AIG4AIB&ucfs=1&arphpl=1&group_adults=2&req_adults=2&no_rooms=1&group_children=0&req_children=0&hpos=12&hapos=12&sr_order=bayesian_review_score&srpvid=06267dd759f901e9&srepoch=1699206832&from=searchresults#hotelTmpl,"Résidence Charles Quint is set in an 18th-century building in the historical centre of Besançon, offering both double rooms and self-catering apartments. The building features a garden and a courtyard.

Each room includes a flat-screen TV, tea and coffee-making facilities and a private bathroom with a walk-in shower. The apartments also include a lounge area with a sofa bed, a dining area and an equipped kitchen area. Double rooms feature a small, private terrace.

Free Wi-Fi access is provided in the entire property. You can enjoy a buffet breakfast at an extra charge, served at the property’s hotel, 200 metres away."
