hotel_name,hotel_score,hotel_reviews,hotel_lat,hotel_lon,hotel_url,hotel_description
Château du Clair de Lune - Les Collectionneurs,8.9,258 reviews,43.45005266,-1.54581070,https://www.booking.com/hotel/fr/chateau-du-clair-de-lune.en-gb.html?aid=304142&label=gen173nr-1FCAEoggI46AdIM1gEaE2IAQGYAQm4AQrIAQXYAQHoAQH4AQOIAgGoAgO4ApSun6oGwAIB0gIkNjAyYWEzYzYtYTQ5YS00MWY4LWI1OWQtZTI1Y2U0Y2E3NTk42AIG4AIB&ucfs=1&arphpl=1&group_adults=2&req_adults=2&no_rooms=1&group_children=0&req_children=0&hpos=14&hapos=14&sr_order=bayesian_review_score&srpvid=7ed97e0b63560205&srepoch=1699206935&from_sustainable_property_sr=1&from=searchresults#hotelTmpl,"Chateau Du Clair De Lune is in a 19th-century manor house located 5 km from the centre of Biarritz. Free Wi-Fi is available.

The rooms are split between the manor house and the hunting lodge. Each room has a flat-screen TV with satellite channels, bathtub, hairdryer and minibar. Rooms in the hunting lodge have a private terrace with garden or park view.

The Chateau’s manor house has a lounge and library. Guests are invited to enjoy Chateau Du Clair De Lune’s park, which is full of roses, magnolia and rhododendron.

Atelier Alexandre Bousquet is a Michelin-starred restaurant housed on site in an 18th-century farm with mountain views offering fine-dining cuisine. Guests can also order brasserie cuisine from inside the Chateau, and snack food is also served during July and August by the pool.

The Chateau is a 10-minute drive from Biarritz Anglet Bayonne Airport."
"BLUE COCOON : hypercentre, plages, WIFI",9.1,56 reviews,43.48253280,-1.56200060,https://www.booking.com/hotel/fr/blue-cocoon-hypercentre-plages-wifi.en-gb.html?aid=304142&label=gen173nr-1FCAEoggI46AdIM1gEaE2IAQGYAQm4AQrIAQXYAQHoAQH4AQOIAgGoAgO4ApSun6oGwAIB0gIkNjAyYWEzYzYtYTQ5YS00MWY4LWI1OWQtZTI1Y2U0Y2E3NTk42AIG4AIB&ucfs=1&arphpl=1&group_adults=2&req_adults=2&no_rooms=1&group_children=0&req_children=0&hpos=24&hapos=24&sr_order=bayesian_review_score&srpvid=7ed97e0b63560205&srepoch=1699206935&from_sustainable_property_sr=1&from=searchresults#hotelTmpl,"Set in the centre of Biarritz, just 100 metres from Grande Plage and 300 metres from Plage Pêcheurs, BLUE COCOON: hypercentre, plages, WIFI offers accommodation with inner courtyard views and free WiFi. This apartment is 600 metres from Cote des Basques Beach and 3.4 km from Biarritz La Négresse Train Station.

The apartment has 1 bedroom, a flat-screen TV, an equipped kitchenette with a microwave and a toaster, and 1 bathroom with a walk-in shower. Towels and bed linen are offered in the apartment.

Saint Jean de Luz Train Station is 18 km from the apartment, while Saint-Jean-Baptiste Church is 18 km from the property. The nearest airport is Biarritz Airport, 3 km from BLUE COCOON: hypercentre, plages, WIFI."
Bellevue 766 Biarritz,9.0,154 reviews,43.48262852,-1.56090895,https://www.booking.com/hotel/fr/apt-766-biarritz.en-gb.html?aid=304142&label=gen173nr-1FCAEoggI46AdIM1gEaE2IAQGYAQm4AQrIAQXYAQHoAQH4AQOIAgGoAgO4ApSun6oGwAIB0gIkNjAyYWEzYzYtYTQ5YS00MWY4LWI1OWQtZTI1Y2U0Y2E3NTk42AIG4AIB&ucfs=1&arphpl=1&group_adults=2&req_adults=2&no_rooms=1&group_children=0&req_children=0&hpos=23&hapos=23&sr_order=bayesian_review_score&srpvid=7ed97e0b63560205&srepoch=1699206935&from=searchresults#hotelTmpl,"Offering free WiFi and city views, Bellevue 766 Biarritz is an accommodation situated right in the centre of Biarritz, just 100 metres from Grande Plage and 200 metres from Plage Pêcheurs. Located on the beachfront, this property features a casino.

The apartment has 1 bedroom, a flat-screen TV with cable channels, an equipped kitchen with an oven and a microwave, a washing machine, and 1 bathroom with a shower. Towels and bed linen are offered in the apartment.

Cote des Basques Beach is 700 metres from the apartment, while Biarritz La Négresse Train Station is 4.9 km from the property. The nearest airport is Biarritz Airport, 5 km from Bellevue 766 Biarritz."
"Charming 1 bedroom flat, Biarritz center with pool and car park",8.8,29 reviews,43.47675860,-1.56023630,https://www.booking.com/hotel/fr/charming-1-bedroom-flat-biarritz-center-with-pool-and-car-park.en-gb.html?aid=304142&label=gen173nr-1FCAEoggI46AdIM1gEaE2IAQGYAQm4AQrIAQXYAQHoAQH4AQOIAgGoAgO4ApSun6oGwAIB0gIkNjAyYWEzYzYtYTQ5YS00MWY4LWI1OWQtZTI1Y2U0Y2E3NTk42AIG4AIB&ucfs=1&arphpl=1&group_adults=2&req_adults=2&no_rooms=1&group_children=0&req_children=0&hpos=21&hapos=21&sr_order=bayesian_review_score&srpvid=7ed97e0b63560205&srepoch=1699206935&from=searchresults#hotelTmpl,"In a prime location in the centre of Biarritz, Charming 1 bedroom flat, Biarritz center with pool and car park offers a balcony. This property offers access to a terrace, free private parking and free WiFi.

The 1-bedroom apartment comes with a living room with a flat-screen TV, a fully equipped kitchen with a dishwasher and microwave, and 1 bathroom with walk-in shower. Towels and bed linen are featured in the apartment.

Guests can enjoy the outdoor swimming pool at the apartment.

Popular points of interest near Charming 1 bedroom flat, Biarritz center with pool and car park include Grande Plage, Cote des Basques Beach and Plage Pêcheurs. The nearest airport is Biarritz Airport, 3 km from the accommodation."
Studio phare de Biarritz Résidence Régina Golf,9.0,24 reviews,43.49138367,-1.55251591,https://www.booking.com/hotel/fr/studio-golf-ocean.en-gb.html?aid=304142&label=gen173nr-1FCAEoggI46AdIM1gEaE2IAQGYAQm4AQrIAQXYAQHoAQH4AQOIAgGoAgO4ApSun6oGwAIB0gIkNjAyYWEzYzYtYTQ5YS00MWY4LWI1OWQtZTI1Y2U0Y2E3NTk42AIG4AIB&ucfs=1&arphpl=1&group_adults=2&req_adults=2&no_rooms=1&group_children=0&req_children=0&hpos=25&hapos=25&sr_order=bayesian_review_score&srpvid=7ed97e0b63560205&srepoch=1699206935&from=searchresults#hotelTmpl,"Situated in Biarritz, just 400 metres from VVF Beach, Studio phare de Biarritz Résidence Régina Golf features beachfront accommodation with a bar and free WiFi. It is set 400 metres from Plage Miramar and offers bicycle parking.

The apartment has 1 bedroom, a flat-screen TV, an equipped kitchen with a microwave and a toaster, a washing machine, and 1 bathroom with a shower. Towels and bed linen are offered in the apartment.

At the apartment guests are welcome to take advantage of spa facilities and wellness packages. Cycling can be enjoyed nearby.

Grande Plage is 700 metres from Studio phare de Biarritz Résidence Régina Golf, while Biarritz La Négresse Train Station is 4.3 km from the property. The nearest airport is Biarritz Airport, 5 km from the accommodation."
Hôtel PALMITO,8.7,"1,204 reviews",43.48205056,-1.56574488,https://www.booking.com/hotel/fr/palym-biarritz.en-gb.html?aid=304142&label=gen173nr-1FCAEoggI46AdIM1gEaE2IAQGYAQm4AQrIAQXYAQHoAQH4AQOIAgGoAgO4ApSun6oGwAIB0gIkNjAyYWEzYzYtYTQ5YS00MWY4LWI1OWQtZTI1Y2U0Y2E3NTk42AIG4AIB&ucfs=1&arphpl=1&group_adults=2&req_adults=2&no_rooms=1&group_children=0&req_children=0&hpos=22&hapos=22&sr_order=bayesian_review_score&srpvid=7ed97e0b63560205&srepoch=1699206935&from_sustainable_property_sr=1&from=searchresults#hotelTmpl,"Set in the Old Town in Biarritz, this non-smoking hotel is located just 100 metres from the beach. Free Wi-Fi and an LCD TV are provided in the guest rooms.

A glimpse of the sea or the courtyard is offered in each room, and some rooms feature a balcony. All of the rooms have a private bathroom, and some have a walk-in shower.

You can enjoy a continental buffet breakfast while reading the newspapers provided.

Biarritz Barrière Casino is just 700 metres from the hotel and Biarritz Train Station is 4 km away. Restaurants, bars and nightclubs are located 50 metres away."
"L'océan à perte de vue, la grande plage à vos pieds",9.3,98 reviews,43.48457170,-1.55756120,https://www.booking.com/hotel/fr/l-39-ocean-a-perte-de-vue-la-grande-plage-a-vos-pieds.en-gb.html?aid=304142&label=gen173nr-1FCAEoggI46AdIM1gEaE2IAQGYAQm4AQrIAQXYAQHoAQH4AQOIAgGoAgO4ApSun6oGwAIB0gIkNjAyYWEzYzYtYTQ5YS00MWY4LWI1OWQtZTI1Y2U0Y2E3NTk42AIG4AIB&ucfs=1&arphpl=1&group_adults=2&req_adults=2&no_rooms=1&group_children=0&req_children=0&hpos=20&hapos=20&sr_order=bayesian_review_score&srpvid=7ed97e0b63560205&srepoch=1699206935&from_sustainable_property_sr=1&from=searchresults#hotelTmpl,"Featuring sea views, L'océan à perte de vue, la grande plage à vos pieds offers accommodation with a balcony and a coffee machine, around 400 metres from Grande Plage. Located on the beachfront, this property features a seasonal outdoor swimming pool.

With free WiFi, this apartment provides a satellite flat-screen TV and a kitchenette with a microwave and toaster. Towels and bed linen are provided in the apartment.

Guests at the apartment can enjoy cycling and hiking nearby, or make the most of the sun terrace.

Popular points of interest near L'océan à perte de vue, la grande plage à vos pieds include Plage Miramar, Plage Pêcheurs and Cote des Basques Beach. The nearest airport is Biarritz Airport, 3 km from the accommodation."
Coup de Cœur assuré pour ce T2 rénové Hyper centre,9.3,21 reviews,43.48081900,-1.56303800,https://www.booking.com/hotel/fr/coup-de-coeur-assure-pour-ce-t2-renove-hyper-centre.en-gb.html?aid=304142&label=gen173nr-1FCAEoggI46AdIM1gEaE2IAQGYAQm4AQrIAQXYAQHoAQH4AQOIAgGoAgO4ApSun6oGwAIB0gIkNjAyYWEzYzYtYTQ5YS00MWY4LWI1OWQtZTI1Y2U0Y2E3NTk42AIG4AIB&ucfs=1&arphpl=1&group_adults=2&req_adults=2&no_rooms=1&group_children=0&req_children=0&hpos=18&hapos=18&sr_order=bayesian_review_score&srpvid=7ed97e0b63560205&srepoch=1699206935&from=searchresults#hotelTmpl,"Right in the heart of Biarritz, situated within a short distance of Grande Plage and Cote des Basques Beach, Coup de Cœur assuré pour ce T2 rénové Hyper centre offers free WiFi, air conditioning and household amenities such as a microwave and coffee machine. This apartment is 500 metres from Plage Pêcheurs and 3.3 km from Biarritz La Négresse Train Station.

This apartment features 1 bedroom, a kitchen with a dishwasher and an oven, a flat-screen TV, a seating area and 1 bathroom fitted with a shower. Towels and bed linen are available in the apartment.

Saint Jean de Luz Train Station is 18 km from the apartment, while Saint-Jean-Baptiste Church is 18 km from the property. The nearest airport is Biarritz Airport, 3 km from Coup de Cœur assuré pour ce T2 rénové Hyper centre."
"La Casa Cosy, Appart'Hôtel",8.7,142 reviews,43.48033300,-1.56254790,https://www.booking.com/hotel/fr/la-casa-cosy-biarritz.en-gb.html?aid=304142&label=gen173nr-1FCAEoggI46AdIM1gEaE2IAQGYAQm4AQrIAQXYAQHoAQH4AQOIAgGoAgO4ApSun6oGwAIB0gIkNjAyYWEzYzYtYTQ5YS00MWY4LWI1OWQtZTI1Y2U0Y2E3NTk42AIG4AIB&ucfs=1&arphpl=1&group_adults=2&req_adults=2&no_rooms=1&group_children=0&req_children=0&hpos=19&hapos=19&sr_order=bayesian_review_score&srpvid=7ed97e0b63560205&srepoch=1699206935&from=searchresults#hotelTmpl,"Boasting a terrace and free WiFi, La Casa Cosy, Appart'Hôtel is set in the centre of Biarritz, close to Cote des Basques Beach, Grande Plage and Plage Pêcheurs.

The aparthotel provides guests with a balcony, city views, a seating area, cable flat-screen TV, a fully equipped kitchen with a dishwasher and an oven, and a private bathroom with walk-in shower and a hair dryer. A microwave, a toaster and fridge are also offered, as well as a coffee machine and a kettle.

Biarritz La Négresse Train Station is 3.1 km from La Casa Cosy, Appart'Hôtel, while Saint Jean de Luz Train Station is 17 km from the property. The nearest airport is Biarritz Airport, 3 km from the accommodation."
SURF HOSTEL BIARRITZ,8.8,16 reviews,43.47291410,-1.54759890,https://www.booking.com/hotel/fr/surf-hostel-biarritz.en-gb.html?aid=304142&label=gen173nr-1FCAEoggI46AdIM1gEaE2IAQGYAQm4AQrIAQXYAQHoAQH4AQOIAgGoAgO4ApSun6oGwAIB0gIkNjAyYWEzYzYtYTQ5YS00MWY4LWI1OWQtZTI1Y2U0Y2E3NTk42AIG4AIB&ucfs=1&arphpl=1&group_adults=2&req_adults=2&no_rooms=1&group_children=0&req_children=0&hpos=17&hapos=17&sr_order=bayesian_review_score&srpvid=7ed97e0b63560205&srepoch=1699206935&from=searchresults#hotelTmpl,"Set in Biarritz in the Aquitaine region, SURF HOSTEL BIARRITZ offers accommodation with free private parking.

Continental and vegetarian breakfast options are available every morning at the bed and breakfast.

A bicycle rental service is available at SURF HOSTEL BIARRITZ.

Plage Pêcheurs is 2 km from the accommodation, while Grande Plage is 2.1 km away. The nearest airport is Biarritz Airport, 2 km from SURF HOSTEL BIARRITZ."
