hotel_name,hotel_score,hotel_reviews,hotel_lat,hotel_lon,hotel_url,hotel_description
Maison rue Trivalle,9.3,78 reviews,43.20907256,2.36370470,https://www.booking.com/hotel/fr/maison-rue-trivalle.en-gb.html?aid=304142&label=gen173nr-1FCAEoggI46AdIM1gEaE2IAQGYAQm4AQrIAQXYAQHoAQH4AQOIAgGoAgO4AtCwn6oGwAIB0gIkYmEyYzE4NGMtNWNkMy00ZDFiLWEyOTctNWIyN2UwZDU2NjNj2AIG4AIB&ucfs=1&arphpl=1&group_adults=2&req_adults=2&no_rooms=1&group_children=0&req_children=0&hpos=24&hapos=49&sr_order=bayesian_review_score&srpvid=42cc7ea9fb700161&srepoch=1699207251&from=searchresults#hotelTmpl,"Located in Carcassonne, 1.2 km from Memorial House (Maison des Memoires) and 600 metres from Comtal Castle, Maison rue Trivalle offers air conditioning. This property offers access to a terrace, free private parking and free WiFi.

The holiday home features 3 bedrooms, a flat-screen TV, an equipped kitchen with a dishwasher and an oven, a washing machine, and 2 bathrooms with a walk-in shower.

Carcassonne Cathedral is 1.2 km from the holiday home. The nearest airport is Carcassonne Airport, 5 km from Maison rue Trivalle."
Appartements Pech Mary,9.0,206 reviews,43.20745530,2.36430280,https://www.booking.com/hotel/fr/appartements-pech-mary.en-gb.html?aid=304142&label=gen173nr-1FCAEoggI46AdIM1gEaE2IAQGYAQm4AQrIAQXYAQHoAQH4AQOIAgGoAgO4AtCwn6oGwAIB0gIkYmEyYzE4NGMtNWNkMy00ZDFiLWEyOTctNWIyN2UwZDU2NjNj2AIG4AIB&ucfs=1&arphpl=1&group_adults=2&req_adults=2&no_rooms=1&group_children=0&req_children=0&hpos=23&hapos=48&sr_order=bayesian_review_score&srpvid=42cc7ea9fb700161&srepoch=1699207251&from=searchresults#hotelTmpl,"Located in the heart of the medieval village Carcassonne, Appartments Pech Mary proposes self-catering apartments with modern décor and free Wi-Fi access. The Pont Vieux is a 10-minute walk away.

All apartments are air-conditioned and feature a living area with a flat-screen TV, a wardrobe, ironing facilities and a private bathroom.

The kitchenette is equipped with an oven, microwave, refrigerator and stove. Supermarkets and restaurants are ideally located within walking distance.

The Canal du Midi and Minervois Vineyards are 50 km away respectively. Carcassonne Cathedral is a 7-minute drive away and free public parking is possible at a location nearby."
Drissia&Othman Grande Casa,9.4,150 reviews,43.21974410,2.34191970,https://www.booking.com/hotel/fr/grande-casa.en-gb.html?aid=304142&label=gen173nr-1FCAEoggI46AdIM1gEaE2IAQGYAQm4AQrIAQXYAQHoAQH4AQOIAgGoAgO4AtCwn6oGwAIB0gIkYmEyYzE4NGMtNWNkMy00ZDFiLWEyOTctNWIyN2UwZDU2NjNj2AIG4AIB&ucfs=1&arphpl=1&group_adults=2&req_adults=2&no_rooms=1&group_children=0&req_children=0&hpos=25&hapos=50&sr_order=bayesian_review_score&srpvid=42cc7ea9fb700161&srepoch=1699207251&from_sustainable_property_sr=1&from=searchresults#hotelTmpl,"Offering free WiFi and quiet street views, Drissia&Othman Grande Casa is an accommodation set in Carcassonne, just 1.5 km from Carcassonne Cathedral and 1.4 km from Memorial House (Maison des Memoires). The apartment is in an area where guests can engage in activities such as cycling, fishing and hiking.

The 3-bedroom apartment is fitted with a living room with a flat-screen TV with streaming services, a fully equipped kitchen with dishwasher and oven, and 1 bathroom with a hair dryer. The property also has 1 bathroom featuring a shower and free toiletries, and towels and bed linen are at guests' disposal.

Comtal Castle is 4.7 km from the apartment. The nearest airport is Carcassonne, 3 km from Drissia&Othman Grande Casa, and the property offers a paid airport shuttle service."
PETIT CAPUCIN,9.5,83 reviews,43.20872400,2.34879460,https://www.booking.com/hotel/fr/petit-capucin.en-gb.html?aid=304142&label=gen173nr-1FCAEoggI46AdIM1gEaE2IAQGYAQm4AQrIAQXYAQHoAQH4AQOIAgGoAgO4AtCwn6oGwAIB0gIkYmEyYzE4NGMtNWNkMy00ZDFiLWEyOTctNWIyN2UwZDU2NjNj2AIG4AIB&ucfs=1&arphpl=1&group_adults=2&req_adults=2&no_rooms=1&group_children=0&req_children=0&hpos=21&hapos=46&sr_order=bayesian_review_score&srpvid=42cc7ea9fb700161&srepoch=1699207251&from_sustainable_property_sr=1&from=searchresults#hotelTmpl,"Situated 400 metres from Carcassonne Cathedral, 600 metres from Memorial House (Maison des Memoires) and 1.8 km from Comtal Castle, PETIT CAPUCIN features accommodation located in Carcassonne. The accommodation is 50 km from the Termes Chateau and has free WiFithroughout the property.

The air-conditioned apartment consists of 1 bedroom, a living room, a fully equipped kitchen with a microwave and a coffee machine, and 1 bathroom with a shower and a hair dryer. Towels and bed linen are available in the apartment.

The nearest airport is Carcassonne Airport, 3 km from the apartment."
l'Occitane,9.3,66 reviews,43.20912780,2.36195410,https://www.booking.com/hotel/fr/porte-de-la-cite-medievale-carcassonne.en-gb.html?aid=304142&label=gen173nr-1FCAEoggI46AdIM1gEaE2IAQGYAQm4AQrIAQXYAQHoAQH4AQOIAgGoAgO4AtCwn6oGwAIB0gIkYmEyYzE4NGMtNWNkMy00ZDFiLWEyOTctNWIyN2UwZDU2NjNj2AIG4AIB&ucfs=1&arphpl=1&group_adults=2&req_adults=2&no_rooms=1&group_children=0&req_children=0&hpos=22&hapos=47&sr_order=bayesian_review_score&srpvid=42cc7ea9fb700161&srepoch=1699207251&from=searchresults#hotelTmpl,"Boasting city views, l'Occitane features accommodation with a balcony and a coffee machine, around 1 km from Memorial House (Maison des Memoires). It has an outdoor swimming pool, an open-air bath, garden views and free WiFithroughout the property.

The holiday home features 4 bedrooms, 4 bathrooms, bed linen, towels, a flat-screen TV with satellite channels, a dining area, a fully equipped kitchen, and a terrace with pool views.

Guests at the holiday home can enjoy fishing and hiking nearby, or make the most of the garden.

Carcassonne Cathedral is 1 km from l'Occitane, while Comtal Castle is 700 metres from the property. The nearest airport is Carcassonne Airport, 5 km from the accommodation."
Le Bout du Monde Appartement Hyper-centre,8.7,74 reviews,43.21326670,2.35440380,https://www.booking.com/hotel/fr/appartement-hyper-centre-carcassonne.en-gb.html?aid=304142&label=gen173nr-1FCAEoggI46AdIM1gEaE2IAQGYAQm4AQrIAQXYAQHoAQH4AQOIAgGoAgO4AtCwn6oGwAIB0gIkYmEyYzE4NGMtNWNkMy00ZDFiLWEyOTctNWIyN2UwZDU2NjNj2AIG4AIB&ucfs=1&arphpl=1&group_adults=2&req_adults=2&no_rooms=1&group_children=0&req_children=0&hpos=19&hapos=44&sr_order=bayesian_review_score&srpvid=42cc7ea9fb700161&srepoch=1699207251&from_sustainable_property_sr=1&from=searchresults#hotelTmpl,"Set in Carcassonne, 600 metres from Carcassonne Cathedral and 1.5 km from Comtal Castle, Le Bout du Monde Appartement Hyper-centre offers air conditioning. The accommodation is 300 metres from the Memorial House (Maison des Memoires) and features free WiFithroughout the property.

The 1-bedroom apartment is fitted with a living room with a flat-screen TV with streaming services, a fully equipped kitchen with a dishwasher and oven, and 1 bathroom with walk-in shower. Towels and bed linen are featured in the apartment.

The nearest airport is Carcassonne Airport, 3 km from the apartment."
Chambres d'hotes - Le Magnolia,9.6,183 reviews,43.21554800,2.35556800,https://www.booking.com/hotel/fr/b-amp-b-le-magnolia-carcassonne.en-gb.html?aid=304142&label=gen173nr-1FCAEoggI46AdIM1gEaE2IAQGYAQm4AQrIAQXYAQHoAQH4AQOIAgGoAgO4AtCwn6oGwAIB0gIkYmEyYzE4NGMtNWNkMy00ZDFiLWEyOTctNWIyN2UwZDU2NjNj2AIG4AIB&ucfs=1&arphpl=1&group_adults=2&req_adults=2&no_rooms=1&group_children=0&req_children=0&hpos=18&hapos=43&sr_order=bayesian_review_score&srpvid=42cc7ea9fb700161&srepoch=1699207251&from=searchresults#hotelTmpl,"Located in Carcassonne, 2.5 km from Carcassonne Cathedral and 3.6 km from Pont Rouge Commercial Zone, Chambres d'hotes - Le Magnolia provides accommodation with free WiFi, air conditioning, a bar and a garden.

The bed and breakfast offers a seating area with a flat-screen TV and a private bathroom with a hairdryer, free toiletries and bath or shower.

A continental breakfast is available daily at Chambres d'hotes - Le Magnolia.

The accommodation features a terrace.

Popular points of interest near Chambres d'hotes - Le Magnolia include Tribunal d'Instance - Magistrates Court, Grain d’Sel Media Library and Grain d’Aile Media Library. The nearest airport is Carcassonne, 6 km from the bed and breakfast, and the property offers a paid airport shuttle service. Free parking is available for motorbikes and bicycles."
Les Suites du Saint Nazaire - Les Balcons de la Cité,9.2,162 reviews,43.20695882,2.35294640,https://www.booking.com/hotel/fr/les-balcons-de-la-cita-c-les-suites-du-saint-nazaire.en-gb.html?aid=304142&label=gen173nr-1FCAEoggI46AdIM1gEaE2IAQGYAQm4AQrIAQXYAQHoAQH4AQOIAgGoAgO4AtCwn6oGwAIB0gIkYmEyYzE4NGMtNWNkMy00ZDFiLWEyOTctNWIyN2UwZDU2NjNj2AIG4AIB&ucfs=1&arphpl=1&group_adults=2&req_adults=2&no_rooms=1&group_children=0&req_children=0&hpos=20&hapos=45&sr_order=bayesian_review_score&srpvid=42cc7ea9fb700161&srepoch=1699207251&from=searchresults#hotelTmpl,"Les Balcons de la Cité - Les Suites du Saint Nazaire is located in Carcassonne just 2 km away from the Medieval City. Guests can enjoy views of the Medieval City from the furnished balcony and can relax in the spa bath.

The contemporary suites at Les Balcons de la Cité - Les Suites du Saint Nazaire feature free WiFi access. They are located in a villa and offer a private bathroom and a living room with a flat-screen TV. Bed linen is provided.

Guests can prepare homemade meals in the kitchen equipped with a stove, microwave and refrigerator. Restaurants can be found just 1 km away.

The Carcassonne Train Station is 2.5 km away and the Carcassonne Cathedral is a 10-minute walk away. Free private parking is possible on site."
Appartement au coeur de Carcassonne,9.4,78 reviews,43.21031571,2.35467504,https://www.booking.com/hotel/fr/appartement-au-coeur-de-carcassonne.en-gb.html?aid=304142&label=gen173nr-1FCAEoggI46AdIM1gEaE2IAQGYAQm4AQrIAQXYAQHoAQH4AQOIAgGoAgO4AtCwn6oGwAIB0gIkYmEyYzE4NGMtNWNkMy00ZDFiLWEyOTctNWIyN2UwZDU2NjNj2AIG4AIB&ucfs=1&arphpl=1&group_adults=2&req_adults=2&no_rooms=1&group_children=0&req_children=0&hpos=17&hapos=42&sr_order=bayesian_review_score&srpvid=42cc7ea9fb700161&srepoch=1699207251&from=searchresults#hotelTmpl,"Offering city views, Appartement au coeur de Carcassonne is an accommodation located in Carcassonne, 500 metres from Memorial House (Maison des Memoires) and 300 metres from Carcassonne Cathedral. It features garden views and free WiFithroughout the property.

The air-conditioned apartment consists of 2 bedrooms, a living room, a fully equipped kitchen with a dishwasher and a coffee machine, and 1 bathroom with a shower and a hair dryer. Towels and bed linen are featured in the apartment.

Comtal Castle is 1.3 km from the apartment. The nearest airport is Carcassonne Airport, 3 km from Appartement au coeur de Carcassonne."
