hotel_name,hotel_score,hotel_reviews,hotel_lat,hotel_lon,hotel_url,hotel_description
LE SEPT charmant studio aux portes des calanques,9.8,53 reviews,43.21759970,5.53235000,https://www.booking.com/hotel/fr/le-sept-charmant-studio-aux-portes-des-calanques.en-gb.html?aid=304142&label=gen173nr-1FCAEoggI46AdIM1gEaE2IAQGYAQm4AQrIAQXYAQHoAQH4AQOIAgGoAgO4As2tn6oGwAIB0gIkMTYwOTY4OTItMzM4MC00ZjljLTg0NjktYzM2NWUwN2JiYjVh2AIG4AIB&ucfs=1&arphpl=1&group_adults=2&req_adults=2&no_rooms=1&group_children=0&req_children=0&hpos=2&hapos=2&sr_order=bayesian_review_score&srpvid=0f3d7de70b3c0036&srepoch=1699206863&from_sustainable_property_sr=1&from=searchresults#hotelTmpl,"Set in Cassis, 700 metres from Bestouan and 1.1 km from Grande Mer, LE SEPT charmant studio aux portes des calanques offers a garden and air conditioning. This property offers a private pool, free WiFi and free private parking.

The apartment is fitted with 1 bedroom, 1 bathroom, bed linen, towels, a flat-screen TV, a dining area, a fully equipped kitchen, and a terrace with sea views.

If you would like to discover the area, fishing and hiking are possible in the surroundings.

Anse de Corton Beach is 1.6 km from the apartment, while Orange Velodrome Stadium is 20 km from the property. The nearest airport is Marseille Provence Airport, 46 km from LE SEPT charmant studio aux portes des calanques."
Le petit cassis vue mer appartement 70m2 dans villa,9.4,40 reviews,43.23303313,5.54128021,https://www.booking.com/hotel/fr/le-petit-cassis-cassis.en-gb.html?aid=304142&label=gen173nr-1FCAEoggI46AdIM1gEaE2IAQGYAQm4AQrIAQXYAQHoAQH4AQOIAgGoAgO4As2tn6oGwAIB0gIkMTYwOTY4OTItMzM4MC00ZjljLTg0NjktYzM2NWUwN2JiYjVh2AIG4AIB&ucfs=1&arphpl=1&group_adults=2&req_adults=2&no_rooms=1&group_children=0&req_children=0&hpos=5&hapos=5&sr_order=bayesian_review_score&srpvid=0f3d7de70b3c0036&srepoch=1699206863&from=searchresults#hotelTmpl,"Located in Cassis, Le petit cassis vue mer appartement 70m2 dans villa offers self-catering accommodation with an outdoor pool. This air-conditioned property features a garden and a furnished terrace with sea views. Guests have access to free WiFi and free on-site parking.

This apartment is located in the right-wing of the building. It includes a seating area with a TV. There is a fully equipped kitchen with a dishwasher and a microwave. The private bathroom comes with a shower. Sea and mountain views can be enjoyed from the property.

The centre of Cassis and its port are just a 6-minute drive from the property and a number of restaurants, cafes and shops can be found here.

Marseille Provence Airport is located 55 km away."
"AQUARIUS IN CASSIS, Chambres d'Hôtes",9.4,230 reviews,43.22235470,5.53453860,https://www.booking.com/hotel/fr/aquarius-in-cassis-chambres-d-hotes.en-gb.html?aid=304142&label=gen173nr-1FCAEoggI46AdIM1gEaE2IAQGYAQm4AQrIAQXYAQHoAQH4AQOIAgGoAgO4As2tn6oGwAIB0gIkMTYwOTY4OTItMzM4MC00ZjljLTg0NjktYzM2NWUwN2JiYjVh2AIG4AIB&ucfs=1&arphpl=1&group_adults=2&req_adults=2&no_rooms=1&group_children=0&req_children=0&hpos=4&hapos=4&sr_order=bayesian_review_score&srpvid=0f3d7de70b3c0036&srepoch=1699206863&from_sustainable_property_sr=1&from=searchresults#hotelTmpl,"Set in Cassis, within 1.2 km of Bestouan and 1.5 km of Grande Mer, AQUARIUS IN CASSIS, Chambres d'Hôtes offers accommodation with pool with a view and free WiFithroughout the property as well as free private parking for guests who drive. Featuring a shared kitchen, this property also provides guests with a sun terrace. The property features an open-air bath, walking tours and private check-in and check-out.

The guest house provides certain units with mountain views, and all rooms come with a private bathroom.

A continental breakfast is available every morning at AQUARIUS IN CASSIS, Chambres d'Hôtes.

Guests at the accommodation will be able to enjoy activities in and around Cassis, like snorkelling, cycling and fishing.

Anse de Corton Beach is 1.8 km from AQUARIUS IN CASSIS, Chambres d'Hôtes, while Orange Velodrome Stadium is 19 km away. The nearest airport is Marseille Provence Airport, 45 km from the guest house."
Villa le sud appartements,9.5,161 reviews,43.23304900,5.55305000,https://www.booking.com/hotel/fr/villa-le-sud-cassis1.en-gb.html?aid=304142&label=gen173nr-1FCAEoggI46AdIM1gEaE2IAQGYAQm4AQrIAQXYAQHoAQH4AQOIAgGoAgO4As2tn6oGwAIB0gIkMTYwOTY4OTItMzM4MC00ZjljLTg0NjktYzM2NWUwN2JiYjVh2AIG4AIB&ucfs=1&arphpl=1&group_adults=2&req_adults=2&no_rooms=1&group_children=0&req_children=0&hpos=3&hapos=3&sr_order=bayesian_review_score&srpvid=0f3d7de70b3c0036&srepoch=1699206863&from=searchresults#hotelTmpl,"Offering a shared swimming pool, a garden and a terrace, villa le sud is located in Cassis, 4.4 km from Cap Canaille.

The apartment comes with a flat-screen TV. The air-conditioned apartment consists of a living room, a fully equipped kitchenette with a microwave and a kettle, and 1 bathroom with a bath or shower and a hair dryer.

The apartment offers a hot tub.

The nearest airport is Marseille Provence Airport, 35 km from villa le sud.

The property is located 2.4 km from the city center Cassis.

Public parking spot are available for free and are located 200 meters away from the apartment."
Guest House Olivades,9.3,140 reviews,43.23304900,5.55304600,https://www.booking.com/hotel/fr/guest-house-olivades.en-gb.html?aid=304142&label=gen173nr-1FCAEoggI46AdIM1gEaE2IAQGYAQm4AQrIAQXYAQHoAQH4AQOIAgGoAgO4As2tn6oGwAIB0gIkMTYwOTY4OTItMzM4MC00ZjljLTg0NjktYzM2NWUwN2JiYjVh2AIG4AIB&ucfs=1&arphpl=1&group_adults=2&req_adults=2&no_rooms=1&group_children=0&req_children=0&hpos=7&hapos=7&sr_order=bayesian_review_score&srpvid=0f3d7de70b3c0036&srepoch=1699206863&from=searchresults#hotelTmpl,"Located in Cassis, 20 km from Orange Velodrome Stadium and 20 km from Rond-Point du Prado Metro Station, Guest House Olivades offers an outdoor swimming pool and air conditioning. This property offers access to a terrace, free private parking and free WiFi.

The homestay has a flat-screen TV. The kitchen is equipped with an oven, a microwave and a toaster, as well as coffee machine and kettle.

Spa and wellness facilities including a hot tub and a spa facilities are at guests' disposal during their stay at the homestay. Guests at Guest House Olivades can enjoy snorkelling nearby, or make the most of the garden.

Marseille Chanot Exhibition and Convention Centre is 20 km from the accommodation, while La Timone Metro Station is 21 km away. The nearest airport is Marseille Provence Airport, 45 km from Guest House Olivades."
SunSet Cassis,9.6,40 reviews,43.21545600,5.53573400,https://www.booking.com/hotel/fr/sunset-cassis.en-gb.html?aid=304142&label=gen173nr-1FCAEoggI46AdIM1gEaE2IAQGYAQm4AQrIAQXYAQHoAQH4AQOIAgGoAgO4As2tn6oGwAIB0gIkMTYwOTY4OTItMzM4MC00ZjljLTg0NjktYzM2NWUwN2JiYjVh2AIG4AIB&ucfs=1&arphpl=1&group_adults=2&req_adults=2&no_rooms=1&group_children=0&req_children=0&hpos=8&hapos=8&sr_order=bayesian_review_score&srpvid=0f3d7de70b3c0036&srepoch=1699206863&from=searchresults#hotelTmpl,"Featuring mountain views, SunSet Cassis provides accommodation with a balcony and a coffee machine, around 600 metres from Bestouan. This beachfront property offers access to a patio.

The apartment comes with 1 bedroom, 1 bathroom, bed linen, towels, a flat-screen TV with streaming services, a dining area, a fully equipped kitchen, and a terrace with sea views. Providing private parking, this 3-star apartment also features free WiFithroughout the property.

Guests can relax in the garden at the property.

Grande Mer is 600 metres from the apartment, while Anse de Corton Beach is 1.2 km away. The nearest airport is Marseille Provence Airport, 45 km from SunSet Cassis."
THE ADDRESS CASSIS,9.8,211 reviews,43.22040800,5.54109000,https://www.booking.com/hotel/fr/the-address-cassis.en-gb.html?aid=304142&label=gen173nr-1FCAEoggI46AdIM1gEaE2IAQGYAQm4AQrIAQXYAQHoAQH4AQOIAgGoAgO4As2tn6oGwAIB0gIkMTYwOTY4OTItMzM4MC00ZjljLTg0NjktYzM2NWUwN2JiYjVh2AIG4AIB&ucfs=1&arphpl=1&group_adults=2&req_adults=2&no_rooms=1&group_children=0&req_children=0&hpos=1&hapos=1&sr_order=bayesian_review_score&srpvid=0f3d7de70b3c0036&srepoch=1699206863&from_sustainable_property_sr=1&from=searchresults#hotelTmpl,"Located in Cassis, within 1.1 km of Grande Mer and 1.4 km of Bestouan, THE ADDRESS CASSIS provides accommodation with pool with a view and free WiFithroughout the property as well as free private parking for guests who drive. Each accommodation at the 5-star guest house has sea views, and guests can enjoy access to a casino and to a garden. The property is soundproof and is set 1.5 km from Anse de Corton Beach.

The guest house will provide guests with air-conditioned rooms with a desk, a coffee machine, a minibar, a safety deposit box, a flat-screen TV, a terrace and a private bathroom with a shower. At THE ADDRESS CASSIS each room is fitted with bed linen and towels.

The daily breakfast offers American, vegetarian or gluten-free options.

Guests at the accommodation will be able to enjoy activities in and around Cassis, like cycling and hiking.

Orange Velodrome Stadium is 19 km from THE ADDRESS CASSIS, while Rond-Point du Prado Metro Station is 19 km away. The nearest airport is Marseille Provence Airport, 45 km from the guest house."
HPC Suites,9.2,966 reviews,43.21644024,5.54174572,https://www.booking.com/hotel/fr/hpc-suites.en-gb.html?aid=304142&label=gen173nr-1FCAEoggI46AdIM1gEaE2IAQGYAQm4AQrIAQXYAQHoAQH4AQOIAgGoAgO4As2tn6oGwAIB0gIkMTYwOTY4OTItMzM4MC00ZjljLTg0NjktYzM2NWUwN2JiYjVh2AIG4AIB&ucfs=1&arphpl=1&group_adults=2&req_adults=2&no_rooms=1&group_children=0&req_children=0&hpos=6&hapos=6&sr_order=bayesian_review_score&srpvid=0f3d7de70b3c0036&srepoch=1699206863&from=searchresults#hotelTmpl,"Offering a shared outdoor pool with a terrace and views of the sea, HPC Suites is situated in a 4000 metres² park in the centre of Cassis. Marseille is 16 km away and the nearest beach is a 10-minute walk away. Free private parking is available on site.

The property was entirely renovated in 2019. Featuring a terrace, all units include a dining area and a seating area with a flat-screen TV. There is also a kitchen, fitted with an oven and microwave. A toaster, a fridge and stovetop are also available, as well as a coffee machine. HPC Suites features free WiFi throughout the property. Towels and bed linen are offered.

Free private secure parking is available.

The port is an 8-minute walk away and many restaurants and a traditional Provençal market can be found in the neighbourhood.

You can play table tennis at the property, and the area is popular for diving and cycling. Aix-en-Provence is 35 km from HPC Suites. The nearest airport is Marseille Provence Airport, 36 km from the property."
"Large private garden, 2 bedroom apartment, countryside, quiet, parking, air conditioning, wifi",9.4,57 reviews,43.21457190,5.54931410,https://www.booking.com/hotel/fr/le-coteau-de-cassis.en-gb.html?aid=304142&label=gen173nr-1FCAEoggI46AdIM1gEaE2IAQGYAQm4AQrIAQXYAQHoAQH4AQOIAgGoAgO4As2tn6oGwAIB0gIkMTYwOTY4OTItMzM4MC00ZjljLTg0NjktYzM2NWUwN2JiYjVh2AIG4AIB&ucfs=1&arphpl=1&group_adults=2&req_adults=2&no_rooms=1&group_children=0&req_children=0&hpos=9&hapos=9&sr_order=bayesian_review_score&srpvid=0f3d7de70b3c0036&srepoch=1699206863&from=searchresults#hotelTmpl,"Offering barbecue facilities and garden view, Large private garden, 2 bedroom apartment, countryside, quiet, parking, air conditioning, wifi is situated in Cassis, 1.5 km from Anse de Corton Beach and 1.7 km from Arene. The air-conditioned accommodation is 1.2 km from Grande Mer, and guests benefit from complimentary WiFi and private parking available on site.

The apartment features 2 bedrooms, 1 bathroom, bed linen, towels, a flat-screen TV with satellite channels, a dining area, a fully equipped kitchen, and a terrace with mountain views.

A outdoor play equipment is also available at the apartment, while guests can also relax in the garden.

Orange Velodrome Stadium is 20 km from Large private garden, 2 bedroom apartment, countryside, quiet, parking, air conditioning, wifi, while Rond-Point du Prado Metro Station is 20 km from the property. The nearest airport is Marseille Provence Airport, 45 km from the accommodation."
Hôtel Les Roches Blanches Cassis,8.8,305 reviews,43.21133700,5.52950200,https://www.booking.com/hotel/fr/des-roches-blanches.en-gb.html?aid=304142&label=gen173nr-1FCAEoggI46AdIM1gEaE2IAQGYAQm4AQrIAQXYAQHoAQH4AQOIAgGoAgO4As2tn6oGwAIB0gIkMTYwOTY4OTItMzM4MC00ZjljLTg0NjktYzM2NWUwN2JiYjVh2AIG4AIB&ucfs=1&arphpl=1&group_adults=2&req_adults=2&no_rooms=1&group_children=0&req_children=0&hpos=10&hapos=10&sr_order=bayesian_review_score&srpvid=0f3d7de70b3c0036&srepoch=1699206863&from_sustainable_property_sr=1&from=searchresults#hotelTmpl,"Providing free WiFi, Hôtel Les Roches Blanches Cassis is situated 1 km from the centre of Cassis. This 5-star hotel offers a seasonal outdoor swimming pool and a restaurant. Cap Canaille is 6 km away.

The rooms and suites feature a coffee machine and kettle, while some also have a terrace. The private bathroom has a hairdryer.

A continental breakfast is available every morning at Hôtel Les Roches Blanches Cassis.

With staff speaking English and French, advice is available at the reception. Marseille Provence Airport is 48 km away."
"Les Barques, Vue splendide sur le port de Cassis",9.6,31 reviews,43.21425002,5.53438313,https://www.booking.com/hotel/fr/appartement-avec-terrasse-sur-le-port-pieds-dans-l-eau.en-gb.html?aid=304142&label=gen173nr-1FCAEoggI46AdIM1gEaE2IAQGYAQm4AQrIAQXYAQHoAQH4AQOIAgGoAgO4As2tn6oGwAIB0gIkMTYwOTY4OTItMzM4MC00ZjljLTg0NjktYzM2NWUwN2JiYjVh2AIG4AIB&ucfs=1&arphpl=1&group_adults=2&req_adults=2&no_rooms=1&group_children=0&req_children=0&hpos=15&hapos=15&sr_order=bayesian_review_score&srpvid=0f3d7de70b3c0036&srepoch=1699206863&from=searchresults#hotelTmpl,"Les Barques, Vue splendide sur le port de Cassis is located in the heart of Cassis, right next to the harbour. This chic and contemporary accommodation offers beautiful views of the sea and cliffs.

Sleeping up to 4 guests, the apartment has a fully equipped kitchen and bathroom with shower, hairdryer and towels. Additional facilities include free Wi-Fi and a flat-screen TV.

You can enjoy meals on the terrace outside looking out sea. Grocery shops, bars and restaurants can be found within walking distance of the property.

This is an ideal situation for exploring the beaches and rockey bays of Cassis. You might also wish to visit Marseille or Bandol, both about a 25-minute drive from the property."
"CAP6 Bel appartement vue magnifique mer, Piscine Tennis T3 refait à neuf",8.8,31 reviews,43.21690642,5.52971161,https://www.booking.com/hotel/fr/bel-appartement-t3-refait-a-neuf.en-gb.html?aid=304142&label=gen173nr-1FCAEoggI46AdIM1gEaE2IAQGYAQm4AQrIAQXYAQHoAQH4AQOIAgGoAgO4As2tn6oGwAIB0gIkMTYwOTY4OTItMzM4MC00ZjljLTg0NjktYzM2NWUwN2JiYjVh2AIG4AIB&ucfs=1&arphpl=1&group_adults=2&req_adults=2&no_rooms=1&group_children=0&req_children=0&hpos=11&hapos=11&sr_order=bayesian_review_score&srpvid=0f3d7de70b3c0036&srepoch=1699206863&from_sustainable_property_sr=1&from=searchresults#hotelTmpl,"Featuring air-conditioned accommodation with a private pool, CAP6 Bel appartement vue magnifique mer, Piscine Tennis T3 refait à neuf is located in Cassis. This property offers access to a balcony, ping-pong, free private parking and free WiFi.

The apartment with a terrace and sea views features 2 bedrooms, a living room, a flat-screen TV, an equipped kitchen with a dishwasher and an oven, and 1 bathroom with a shower.

The apartment offers an open-air bath. Guests at CAP6 Bel appartement vue magnifique mer, Piscine Tennis T3 refait à neuf can enjoy hiking nearby, or make the most of the garden.

Popular points of interest near the accommodation include Bestouan, Grande Mer and Anse de Corton Beach. The nearest airport is Marseille Provence Airport, 46 km from CAP6 Bel appartement vue magnifique mer, Piscine Tennis T3 refait à neuf."
"Rêves de vie, studio Port Miou perle rare à Cassis",9.4,81 reviews,43.22728569,5.53310176,https://www.booking.com/hotel/fr/reves-de-vie.en-gb.html?aid=304142&label=gen173nr-1FCAEoggI46AdIM1gEaE2IAQGYAQm4AQrIAQXYAQHoAQH4AQOIAgGoAgO4As2tn6oGwAIB0gIkMTYwOTY4OTItMzM4MC00ZjljLTg0NjktYzM2NWUwN2JiYjVh2AIG4AIB&ucfs=1&arphpl=1&group_adults=2&req_adults=2&no_rooms=1&group_children=0&req_children=0&hpos=14&hapos=14&sr_order=bayesian_review_score&srpvid=0f3d7de70b3c0036&srepoch=1699206863&from=searchresults#hotelTmpl,"Situated in Cassis and only 19 km from Orange Velodrome Stadium, Rêves de vie, studio Port Miou perle rare à Cassis features accommodation with mountain views, free WiFi and free private parking. The air-conditioned accommodation is 19 km from Rond-Point du Prado Metro Station.

The apartment features 1 bedroom, 1 bathroom, bed linen, towels, a flat-screen TV with streaming services, a dining area, a fully equipped kitchen, and a terrace with sea views.

Spa and wellness facilities including a hot tub and a spa facilities are at guests' disposal during their stay at the apartment.

Marseille Chanot Exhibition and Convention Centre is 19 km from Rêves de vie, studio Port Miou perle rare à Cassis, while La Timone Metro Station is 20 km from the property. The nearest airport is Marseille Provence Airport, 45 km from the accommodation."
Villa Le Sud,9.4,272 reviews,43.23304906,5.55305108,https://www.booking.com/hotel/fr/villa-le-sud-cassis.en-gb.html?aid=304142&label=gen173nr-1FCAEoggI46AdIM1gEaE2IAQGYAQm4AQrIAQXYAQHoAQH4AQOIAgGoAgO4As2tn6oGwAIB0gIkMTYwOTY4OTItMzM4MC00ZjljLTg0NjktYzM2NWUwN2JiYjVh2AIG4AIB&ucfs=1&arphpl=1&group_adults=2&req_adults=2&no_rooms=1&group_children=0&req_children=0&hpos=13&hapos=13&sr_order=bayesian_review_score&srpvid=0f3d7de70b3c0036&srepoch=1699206863&from=searchresults#hotelTmpl,"Offering an outdoor pool, Villa Le Sud is located in Cassis. Free WiFi access is available. The accommodation is 2.5 km from Cassis cliffs. Circuit Paul Ricard is a 35-minute drive away.

Each room here will provide you with a flat-screen TV, air conditioning and a terrace. Featuring a bath or shower, private bathroom also comes with a hairdryer. You can enjoy pool view and garden view from the room. Extras include cable channels.

At Villa Le Sud you will find a garden and a terrace. The property offers free parking.

Marseille Provence Airport is 47.1 km away."
Villa Cassis,9.2,122 reviews,43.21150506,5.52610226,https://www.booking.com/hotel/fr/villa-cassis.en-gb.html?aid=304142&label=gen173nr-1FCAEoggI46AdIM1gEaE2IAQGYAQm4AQrIAQXYAQHoAQH4AQOIAgGoAgO4As2tn6oGwAIB0gIkMTYwOTY4OTItMzM4MC00ZjljLTg0NjktYzM2NWUwN2JiYjVh2AIG4AIB&ucfs=1&arphpl=1&group_adults=2&req_adults=2&no_rooms=1&group_children=0&req_children=0&hpos=12&hapos=12&sr_order=bayesian_review_score&srpvid=0f3d7de70b3c0036&srepoch=1699206863&from=searchresults#hotelTmpl,"La Villa Cassis est à 500 mètres de la plage du Bestouan et à 20 minutes à pied du port de Cassis.
Située sur la presqu’île de Cassis, entre mer et calanques, c’est un vrai havre de paix.
Cet établissement propose une piscine à débordement de 17 mètres avec un bel espace transat.
Les studios disposent d’un séjour avec kitchenette, et terrasse avec vue mer.
Les appartements comprennent une cuisine américaine complète, 1 chambre et une grande terrasse avec vue sur mer ou Cap canaille.
L’ensemble est climatisé, propose l’accès wifi et un parking gratuit.
C'est le quartier préféré des voyageurs visitant Cassis, selon les commentaires clients indépendants.
Les couples apprécient particulièrement l'emplacement de cet établissement. Ils lui donnent la note de 9,4 pour un séjour à deux."
Le Canaillou par Dodo-a-Cassis,8.2,26 reviews,43.21171558,5.54233502,https://www.booking.com/hotel/fr/front-de-mer-600m-du-port-piscine-parking.en-gb.html?aid=304142&label=gen173nr-1FCAEoggI46AdIM1gEaE2IAQGYAQm4AQrIAQXYAQHoAQH4AQOIAgGoAgO4As2tn6oGwAIB0gIkMTYwOTY4OTItMzM4MC00ZjljLTg0NjktYzM2NWUwN2JiYjVh2AIG4AIB&ucfs=1&arphpl=1&group_adults=2&req_adults=2&no_rooms=1&group_children=0&req_children=0&hpos=17&hapos=17&sr_order=bayesian_review_score&srpvid=0f3d7de70b3c0036&srepoch=1699206863&from=searchresults#hotelTmpl,"Situated just 300 metres from Anse de Corton Beach, Le Canaillou par Dodo-a-Cassis features accommodation in Cassis with access to pool with a view, a garden, as well as a lift. This beachfront property offers access to a balcony, free private parking and free WiFi.

The apartment with a terrace and garden views has 3 bedrooms, a living room, a flat-screen TV, an equipped kitchen with a dishwasher and an oven, and 2 bathrooms with a walk-in shower. Towels and bed linen are offered in the apartment.

Hiking can be enjoyed nearby.

Grande Mer is 600 metres from the apartment, while Arene is less than 1 km from the property. The nearest airport is Marseille Provence, 46 km from Le Canaillou par Dodo-a-Cassis, and the property offers a paid airport shuttle service."
Vu Mer by K6&You,9.0,34 reviews,43.21820779,5.53090312,https://www.booking.com/hotel/fr/studio-les-terres-marines-climatise-piscine-k6-amp-you.en-gb.html?aid=304142&label=gen173nr-1FCAEoggI46AdIM1gEaE2IAQGYAQm4AQrIAQXYAQHoAQH4AQOIAgGoAgO4As2tn6oGwAIB0gIkMTYwOTY4OTItMzM4MC00ZjljLTg0NjktYzM2NWUwN2JiYjVh2AIG4AIB&ucfs=1&arphpl=1&group_adults=2&req_adults=2&no_rooms=1&group_children=0&req_children=0&hpos=25&hapos=25&sr_order=bayesian_review_score&srpvid=0f3d7de70b3c0036&srepoch=1699206863&from=searchresults#hotelTmpl,"Featuring air-conditioned accommodation with a private pool, Vu Mer by K6&You is located in Cassis. This beachfront property offers access to ping-pong, free private parking and free WiFi.

The apartment comes with 1 bedroom, 1 bathroom, bed linen, towels, a flat-screen TV with cable channels, a dining area, a fully equipped kitchen, and a terrace with sea views.

Guests at the apartment can enjoy fishing and hiking nearby, or make the most of the garden.

Popular points of interest near Vu Mer by K6&You include Bestouan, Grande Mer and Anse de Corton Beach. The nearest airport is Marseille Provence Airport, 45 km from the accommodation."
Villa Bobnell,9.4,79 reviews,43.22045190,5.53609080,https://www.booking.com/hotel/fr/villa-bobnell.en-gb.html?aid=304142&label=gen173nr-1FCAEoggI46AdIM1gEaE2IAQGYAQm4AQrIAQXYAQHoAQH4AQOIAgGoAgO4As2tn6oGwAIB0gIkMTYwOTY4OTItMzM4MC00ZjljLTg0NjktYzM2NWUwN2JiYjVh2AIG4AIB&ucfs=1&arphpl=1&group_adults=2&req_adults=2&no_rooms=1&group_children=0&req_children=0&hpos=23&hapos=23&sr_order=bayesian_review_score&srpvid=0f3d7de70b3c0036&srepoch=1699206863&from=searchresults#hotelTmpl,"Villa Bobnell is a self-catering accommodation located in Cassis, offering a garden and a terrace with BBQ facilities. Free WiFi access is available.

Accommodation will provide you with a flat-screen TV with cable channels, a DVD player, air conditioning and a terrace. Private bathrooms come with a bath or shower and a hairdryer.

The equipped kitchen features a stovetop, microwave, toaster, kitchenware and oven. Extras include a coffee machine and electric kettle. Meals can be enjoyed either indoors or outdoors.

Provence Airport is located 35 km away. The property offers free parking."
Appart Port Cassis Village Parking,9.4,16 reviews,43.21462613,5.53784391,https://www.booking.com/hotel/fr/appartement-port-rue-michel-arnaud.en-gb.html?aid=304142&label=gen173nr-1FCAEoggI46AdIM1gEaE2IAQGYAQm4AQrIAQXYAQHoAQH4AQOIAgGoAgO4As2tn6oGwAIB0gIkMTYwOTY4OTItMzM4MC00ZjljLTg0NjktYzM2NWUwN2JiYjVh2AIG4AIB&ucfs=1&arphpl=1&group_adults=2&req_adults=2&no_rooms=1&group_children=0&req_children=0&hpos=22&hapos=22&sr_order=bayesian_review_score&srpvid=0f3d7de70b3c0036&srepoch=1699206863&from=searchresults#hotelTmpl,"LAppartement Port Cassis Village 6p offers accommodation in Cassis, just a 1-minute walk from the Port and 200 metres from the beach. The air-conditioned unit is 53 km from Aix-en-Provence. Free WiFi is provided throughout the property.

This air-conditioned apartment has been decorated in a contemporary-style and there is a seating area, 3 flat-screen TV's, a desk and a kitchen equipped with a dishwasher and a Nespresso coffee machine. Towels and bed linen are featured in this self-catering accommodation. There is a private bathroom with a shower.

A number of restaurants and shops can be found less than 100 metres from the property.

Toulon is 33 km from Appartement Port Cassis Village 6p., while Hyères is 49 km away. The nearest airport is Marseille Provence Airport, 36 km from the property."
"Cassis, charmant appart en face de la plage.",8.5,42 reviews,43.21320810,5.53886490,https://www.booking.com/hotel/fr/cassis-charmant-appart-en-face-de-la-plage.en-gb.html?aid=304142&label=gen173nr-1FCAEoggI46AdIM1gEaE2IAQGYAQm4AQrIAQXYAQHoAQH4AQOIAgGoAgO4As2tn6oGwAIB0gIkMTYwOTY4OTItMzM4MC00ZjljLTg0NjktYzM2NWUwN2JiYjVh2AIG4AIB&ucfs=1&arphpl=1&group_adults=2&req_adults=2&no_rooms=1&group_children=0&req_children=0&hpos=21&hapos=21&sr_order=bayesian_review_score&srpvid=0f3d7de70b3c0036&srepoch=1699206863&from=searchresults#hotelTmpl,"Set in Cassis, just 300 metres from Grande Mer, Cassis, charmant appart en face de la plage. Offers beachfront accommodation with free WiFi. The air-conditioned accommodation is 800 metres from Anse de Corton Beach.

The apartment features 1 bedroom, a flat-screen TV, an equipped kitchen with a dishwasher and a microwave, a washing machine, and 1 bathroom with a shower. Towels and bed linen are featured in the apartment.

Bestouan is less than 1 km from the apartment, while Orange Velodrome Stadium is 20 km away. The nearest airport is Marseille Provence Airport, 46 km from Cassis, charmant appart en face de la plage.."
