hotel_name,hotel_score,hotel_reviews,hotel_lat,hotel_lon,hotel_url,hotel_description
Le Petit Paradis,8.5,25 reviews,43.21854153,5.54233474,https://www.booking.com/hotel/fr/le-petit-paradis-cassis.en-gb.html?aid=304142&label=gen173nr-1FCAEoggI46AdIM1gEaE2IAQGYAQm4AQrIAQXYAQHoAQH4AQOIAgGoAgO4Asmxn6oGwAIB0gIkMDJkNmFlZjQtN2JiNC00ZWU2LTllMTQtMzc2NzNhZmQ5ZTAz2AIG4AIB&ucfs=1&arphpl=1&group_adults=2&req_adults=2&no_rooms=1&group_children=0&req_children=0&hpos=17&hapos=42&sr_order=bayesian_review_score&srpvid=be4c7ee5d0510015&srepoch=1699207372&from=searchresults#hotelTmpl,"Boasting garden views, Le Petit Paradis features accommodation with a balcony and a coffee machine, around 1.2 km from Anse de Corton Beach. The air-conditioned accommodation is less than 1 km from Grande Mer, and guests benefit from complimentary WiFi and private parking available on site.

The holiday home with a terrace and mountain views has 2 bedrooms, a living room, a flat-screen TV, an equipped kitchenette with a dishwasher and an oven, and 1 bathroom with a walk-in shower.

The holiday home offers a barbecue. Guests at Le Petit Paradis can enjoy snorkelling and hiking nearby, or make the most of the garden.

Bestouan is 1.4 km from the accommodation, while Orange Velodrome Stadium is 19 km from the property. The nearest airport is Marseille Provence Airport, 45 km from Le Petit Paradis."
LE SEA SIDE - Ultra centre - Terrasse vue Mer - 4 personnes,8.8,44 reviews,43.21289920,5.53870020,https://www.booking.com/hotel/fr/superbe-appartement-ultra-centre-proche-plage-et-port-4-personnes.en-gb.html?aid=304142&label=gen173nr-1FCAEoggI46AdIM1gEaE2IAQGYAQm4AQrIAQXYAQHoAQH4AQOIAgGoAgO4Asmxn6oGwAIB0gIkMDJkNmFlZjQtN2JiNC00ZWU2LTllMTQtMzc2NzNhZmQ5ZTAz2AIG4AIB&ucfs=1&arphpl=1&group_adults=2&req_adults=2&no_rooms=1&group_children=0&req_children=0&hpos=24&hapos=49&sr_order=bayesian_review_score&srpvid=be4c7ee5d0510015&srepoch=1699207372&from=searchresults#hotelTmpl,"LE SEA SIDE - Ultra centre - Terrasse vue Mer - 4 personnes is a beachfront property situated in Cassis, a few steps from Grande Mer and 800 metres from Anse de Corton Beach. It has a terrace, sea views and free WiFithroughout the property.

The apartment features 1 bedroom, a flat-screen TV and a fully equipped kitchen that provides guests with a dishwasher, an oven, a washing machine, a microwave and a toaster. For added convenience, the property can provide towels and linens for a supplement.

Bestouan is less than 1 km from the apartment, while Orange Velodrome Stadium is 20 km from the property. The nearest airport is Marseille Provence Airport, 46 km from LE SEA SIDE - Ultra centre - Terrasse vue Mer - 4 personnes."
Le Jardin d'Emile,8.7,208 reviews,43.21455980,5.53365740,https://www.booking.com/hotel/fr/le-jardin-d-emile.en-gb.html?aid=304142&label=gen173nr-1FCAEoggI46AdIM1gEaE2IAQGYAQm4AQrIAQXYAQHoAQH4AQOIAgGoAgO4Asmxn6oGwAIB0gIkMDJkNmFlZjQtN2JiNC00ZWU2LTllMTQtMzc2NzNhZmQ5ZTAz2AIG4AIB&ucfs=1&arphpl=1&group_adults=2&req_adults=2&no_rooms=1&group_children=0&req_children=0&hpos=25&hapos=50&sr_order=bayesian_review_score&srpvid=be4c7ee5d0510015&srepoch=1699207372&from=searchresults#hotelTmpl,"This typical Provence-style house is a 5-minute walk from Cassis's port. It offers en suite accommodations with either views of the Bestouan beach or the garden with old pine trees. Free WiFi is included.

Le Jardin d’Emile offers individually decorated rooms, each with a different colour and atmosphere. They are all air conditioned and feature a private bathroom and a TV. Free Wi-Fi access is available in the entire hotel.

Every morning, a continental breakfast is served. At lunchtime, the bar Pastis welcomes you on its outdoor terrace overlooking Cape Canaille.

Le Jardin d’Emile hotel also provides luggage storage, daily newspapers and 24-hour reception.

You can follow the hiking tracks, right next to the hotel, and discover Cassis amazing landscapes.  Le Jardin d’Emile is just a 30-minute drive from Marseille and 44 km from Toulon. Free private parking is available on site."
Pleine vue,9.1,19 reviews,43.21444870,5.53394410,https://www.booking.com/hotel/fr/pleine-vue.en-gb.html?aid=304142&label=gen173nr-1FCAEoggI46AdIM1gEaE2IAQGYAQm4AQrIAQXYAQHoAQH4AQOIAgGoAgO4Asmxn6oGwAIB0gIkMDJkNmFlZjQtN2JiNC00ZWU2LTllMTQtMzc2NzNhZmQ5ZTAz2AIG4AIB&ucfs=1&arphpl=1&group_adults=2&req_adults=2&no_rooms=1&group_children=0&req_children=0&hpos=21&hapos=46&sr_order=bayesian_review_score&srpvid=be4c7ee5d0510015&srepoch=1699207372&from=searchresults#hotelTmpl,"Featuring accommodation with a balcony, Pleine vue is set in Cassis. The accommodation is 300 metres from the Bestouan and has free WiFithroughout the property.

The apartment with a terrace and sea views features 1 bedroom, a living room, a flat-screen TV, an equipped kitchen with a dishwasher and a microwave, and 1 bathroom with a shower. Towels and bed linen are featured in the apartment.

Grande Mer is 800 metres from the apartment, while Anse de Corton Beach is 1.2 km away. The nearest airport is Marseille Provence Airport, 46 km from Pleine vue."
Cassis Hostel,8.9,288 reviews,43.21634593,5.53281382,https://www.booking.com/hotel/fr/cassis-hostel.en-gb.html?aid=304142&label=gen173nr-1FCAEoggI46AdIM1gEaE2IAQGYAQm4AQrIAQXYAQHoAQH4AQOIAgGoAgO4Asmxn6oGwAIB0gIkMDJkNmFlZjQtN2JiNC00ZWU2LTllMTQtMzc2NzNhZmQ5ZTAz2AIG4AIB&ucfs=1&arphpl=1&group_adults=2&req_adults=2&no_rooms=1&group_children=0&req_children=0&hpos=23&hapos=48&sr_order=bayesian_review_score&srpvid=be4c7ee5d0510015&srepoch=1699207372&from=searchresults#hotelTmpl,"Offering an outdoor swimming pool with views of the sea, Cassis Hostel is set in a Provençal villa in Cassis. This property features a garden, a terrace and free Wi-Fi access throughout.

Guests can choose between a bed in a shared dormitory or a private double room. All rooms have access to a bathroom with shower, toilet and sink.

Breakfast including fresh bread from the local bakery, a selection of jams and hot drinks is served every morning. Guests have open access to the shared, fully equipped kitchen. Restaurants and bars can be found within walking distance of the property.

Cassis hostel is 400 metres from the beach, 500 metres from the port and 3.5 km from Cassis Train Station. The property offers free parking on site."
L'HORIZON - 90m2 - Belle vue - Centre - Parking - 3 Chambres,9.2,23 reviews,43.21550630,5.54622740,https://www.booking.com/hotel/fr/l-39-horizon-90m2-belle-vue-centre-parking-3-chambres.en-gb.html?aid=304142&label=gen173nr-1FCAEoggI46AdIM1gEaE2IAQGYAQm4AQrIAQXYAQHoAQH4AQOIAgGoAgO4Asmxn6oGwAIB0gIkMDJkNmFlZjQtN2JiNC00ZWU2LTllMTQtMzc2NzNhZmQ5ZTAz2AIG4AIB&ucfs=1&arphpl=1&group_adults=2&req_adults=2&no_rooms=1&group_children=0&req_children=0&hpos=22&hapos=47&sr_order=bayesian_review_score&srpvid=be4c7ee5d0510015&srepoch=1699207372&from=searchresults#hotelTmpl,"Located in Cassis and only less than 1 km from Grande Mer, L'HORIZON - 90m2 - Belle vue - Centre - Parking - 3 Chambres provides accommodation with mountain views, free WiFi and free private parking. This apartment features a private pool and a garden.

The apartment is equipped with 3 bedrooms, 2 bathrooms, a flat-screen TV, a dining area, a fully equipped kitchen, and a terrace with sea views. For added convenience, the property can provide towels and linens for a supplement.

Anse de Corton Beach is 1 km from the apartment, while Arene is 1.4 km away. The nearest airport is Marseille Provence Airport, 45 km from L'HORIZON - 90m2 - Belle vue - Centre - Parking - 3 Chambres."
"Maison provençale - 2 chambres - 2,5km de la plage",9.0,51 reviews,43.22613733,5.57465038,https://www.booking.com/hotel/fr/maison-provencale-2-chambres-2-5km-de-la-plage.en-gb.html?aid=304142&label=gen173nr-1FCAEoggI46AdIM1gEaE2IAQGYAQm4AQrIAQXYAQHoAQH4AQOIAgGoAgO4Asmxn6oGwAIB0gIkMDJkNmFlZjQtN2JiNC00ZWU2LTllMTQtMzc2NzNhZmQ5ZTAz2AIG4AIB&ucfs=1&arphpl=1&group_adults=2&req_adults=2&no_rooms=1&group_children=0&req_children=0&hpos=20&hapos=45&sr_order=bayesian_review_score&srpvid=be4c7ee5d0510015&srepoch=1699207372&from=searchresults#hotelTmpl,"Situated in Cassis, 26 km from La Timone Metro Station and 27 km from Castellane Metro Station, Maison provençale - 2 chambres - 2,5km de la plage offers a garden and air conditioning. This apartment features free private parking and private check-in and check-out.

The apartment with a terrace and mountain views has 2 bedrooms, a living room, a flat-screen TV, an equipped kitchen with a dishwasher and an oven, and 1 bathroom with a walk-in shower. Towels and bed linen are available in the apartment.

The apartment offers a solarium.

Marseille Chanot Exhibition and Convention Centre is 27 km from Maison provençale - 2 chambres - 2,5km de la plage, while Rond-Point du Prado Metro Station is 27 km from the property. The nearest airport is Marseille Provence Airport, 50 km from the accommodation."
Leï Tapenié par Dodo-a-Cassis,8.4,31 reviews,43.21604100,5.53699320,https://www.booking.com/hotel/fr/lei-tapenie.en-gb.html?aid=304142&label=gen173nr-1FCAEoggI46AdIM1gEaE2IAQGYAQm4AQrIAQXYAQHoAQH4AQOIAgGoAgO4Asmxn6oGwAIB0gIkMDJkNmFlZjQtN2JiNC00ZWU2LTllMTQtMzc2NzNhZmQ5ZTAz2AIG4AIB&ucfs=1&arphpl=1&group_adults=2&req_adults=2&no_rooms=1&group_children=0&req_children=0&hpos=19&hapos=44&sr_order=bayesian_review_score&srpvid=be4c7ee5d0510015&srepoch=1699207372&from=searchresults#hotelTmpl,"Located in Cassis, 300 metres from the beach, Leï Tapenié par Dodo-a-Cassis provides accommodation with a balcony and free WiFi. The property has mountain views and is 100 metres from the harbour.

The apartment features 2 bedrooms, a flat-screen TV, an equipped kitchen with a traditional coffe machine and Nespresso, a dishwasher and a microwave, a washing machine, and 1 bathroom with a bath. Ceiling fans are available in each room. Guests wishing to travel light can make use of towels and linens for an additional supplement.

The apartment offers a terrace.

The nearest airport is Marseille Provence Airport, 50 km from Leï Tapenié par Dodo-a-Cassis."
Le grand clocher de Cassis,8.3,56 reviews,43.21560200,5.53771110,https://www.booking.com/hotel/fr/le-grand-clocher-de-cassis.en-gb.html?aid=304142&label=gen173nr-1FCAEoggI46AdIM1gEaE2IAQGYAQm4AQrIAQXYAQHoAQH4AQOIAgGoAgO4Asmxn6oGwAIB0gIkMDJkNmFlZjQtN2JiNC00ZWU2LTllMTQtMzc2NzNhZmQ5ZTAz2AIG4AIB&ucfs=1&arphpl=1&group_adults=2&req_adults=2&no_rooms=1&group_children=0&req_children=0&hpos=18&hapos=43&sr_order=bayesian_review_score&srpvid=be4c7ee5d0510015&srepoch=1699207372&from=searchresults#hotelTmpl,"Le grand clocher de Cassis is situated in Cassis, 700 metres from Bestouan and less than 1 km from Anse de Corton Beach, in an area where fishing can be enjoyed. The accommodation is 400 metres from the Grande Mer and has free WiFithroughout the property.

The air-conditioned apartment consists of 1 bedroom, a living room, a fully equipped kitchen with a dishwasher and a coffee machine, and 1 bathroom with a shower and a hair dryer. A flat-screen TV is available.

A casino is also available for guests at the apartment.

Orange Velodrome Stadium is 19 km from Le grand clocher de Cassis, while Rond-Point du Prado Metro Station is 20 km from the property. The nearest airport is Marseille Provence Airport, 45 km from the accommodation."
Cassis Ma Vie Là,9.1,219 reviews,43.21690500,5.54144600,https://www.booking.com/hotel/fr/cassis-ma-vie-la.en-gb.html?aid=304142&label=gen173nr-1FCAEoggI46AdIM1gEaE2IAQGYAQm4AQrIAQXYAQHoAQH4AQOIAgGoAgO4Asmxn6oGwAIB0gIkMDJkNmFlZjQtN2JiNC00ZWU2LTllMTQtMzc2NzNhZmQ5ZTAz2AIG4AIB&ucfs=1&arphpl=1&group_adults=2&req_adults=2&no_rooms=1&group_children=0&req_children=0&hpos=16&hapos=41&sr_order=bayesian_review_score&srpvid=be4c7ee5d0510015&srepoch=1699207372&from_sustainable_property_sr=1&from=searchresults#hotelTmpl,"Offering a garden and sea view, Cassis Ma Vie Là is located in Cassis, 700 metres from Grande Mer and 1 km from Anse de Corton Beach. Free WiFi is provided throughout the property and private parking is available on site.

The air-conditioned apartment consists of 2 bedrooms, a living room, a fully equipped kitchen with a dishwasher and a coffee machine, and 1 bathroom with a walk-in shower and a hair dryer. A flat-screen TV with satellite channels and a Blu-ray player are featured.

If you would like to discover the area, snorkelling, cycling and walking tours are possible in the surroundings.

Bestouan is 1.2 km from the apartment, while Orange Velodrome Stadium is 19 km away. The nearest airport is Marseille Provence Airport, 45 km from Cassis Ma Vie Là."
