hotel_name,hotel_score,hotel_reviews,hotel_lat,hotel_lon,hotel_url,hotel_description
"Place de Metz, Hyper-centre Grenoble, Studio 25 m2",9.4,68 reviews,45.18745600,5.73006310,https://www.booking.com/hotel/fr/place-de-metz-victor-hugo-a-3-min-studio-25-m2.en-gb.html?aid=304142&label=gen173nr-1FCAEoggI46AdIM1gEaE2IAQGYAQm4AQrIAQXYAQHoAQH4AQOIAgGoAgO4AsSon6oGwAIB0gIkZWJmMTM1MTktMDYxZS00NzI2LTliODItNzFhZTQxNzU0MzE52AIG4AIB&ucfs=1&arphpl=1&group_adults=2&req_adults=2&no_rooms=1&group_children=0&req_children=0&hpos=20&hapos=20&sr_order=bayesian_review_score&srpvid=11d97ca2afb7023e&srepoch=1699206214&from=searchresults#hotelTmpl,"Located in the centre of Grenoble, Place de Metz, Hyper-centre Grenoble, Studio 25 m2 features accommodation with city views, just 1.5 km from Grenoble Train Station and 1.8 km from WTC Grenoble. It is situated 4.9 km from AlpExpo and offers a lift.

With free WiFi, this apartment provides a flat-screen TV, a washing machine and a kitchen with an oven and microwave. Towels and bed linen are provided in the apartment.

Alps Stadium is less than 1 km from the apartment, while The Bastille Grenoble is 4.3 km away. The nearest airport is Alpes–Isère Airport, 47 km from Place de Metz, Hyper-centre Grenoble, Studio 25 m2."
Le balcon de l'Aigle,8.7,79 reviews,45.18257190,5.71753050,https://www.booking.com/hotel/fr/le-balcon-de-l-39-aigle.en-gb.html?aid=304142&label=gen173nr-1FCAEoggI46AdIM1gEaE2IAQGYAQm4AQrIAQXYAQHoAQH4AQOIAgGoAgO4AsSon6oGwAIB0gIkZWJmMTM1MTktMDYxZS00NzI2LTliODItNzFhZTQxNzU0MzE52AIG4AIB&ucfs=1&arphpl=1&group_adults=2&req_adults=2&no_rooms=1&group_children=0&req_children=0&hpos=19&hapos=19&sr_order=bayesian_review_score&srpvid=11d97ca2afb7023e&srepoch=1699206214&from=searchresults#hotelTmpl,"Le balcon de l'Aigle features a balcony and is situated in Grenoble, within just 1.1 km of Grenoble Train Station and 1.4 km of WTC Grenoble. It has city views and free WiFithroughout the property.

The apartment features 1 bedroom, 1 bathroom, bed linen, towels, a TV, a dining area, a fully equipped kitchen, and a terrace with mountain views.

AlpExpo is 4.6 km from the apartment, while Alps Stadium is 2.3 km from the property. The nearest airport is Alpes–Isère Airport, 47 km from Le balcon de l'Aigle."
Chez Flo,8.9,93 reviews,45.18046950,5.73207800,https://www.booking.com/hotel/fr/chez-flo-grenoble.en-gb.html?aid=304142&label=gen173nr-1FCAEoggI46AdIM1gEaE2IAQGYAQm4AQrIAQXYAQHoAQH4AQOIAgGoAgO4AsSon6oGwAIB0gIkZWJmMTM1MTktMDYxZS00NzI2LTliODItNzFhZTQxNzU0MzE52AIG4AIB&ucfs=1&arphpl=1&group_adults=2&req_adults=2&no_rooms=1&group_children=0&req_children=0&hpos=22&hapos=22&sr_order=bayesian_review_score&srpvid=11d97ca2afb7023e&srepoch=1699206214&from=searchresults#hotelTmpl,"Located 2.3 km from Grenoble Train Station and 3 km from WTC Grenoble, Chez Flo in Grenoble provides air-conditioned accommodation with views of the quiet street and free WiFi.

The apartment provides guests with a balcony, city views, a seating area, cable flat-screen TV, a fully equipped kitchen with a dishwasher and an oven, and a private bathroom with walk-in shower and a hair dryer. A microwave, a fridge and stovetop are also provided, as well as a coffee machine.

AlpExpo is 3.6 km from Chez Flo, while Alps Stadium is 1.2 km away. The nearest airport is Alpes–Isère Airport, 48 km from the accommodation."
Sweet Loft Grenoble-Love Room avec jacuzzi & sauna,8.3,67 reviews,45.18677290,5.73226140,https://www.booking.com/hotel/fr/sweet-loft-grenoble.en-gb.html?aid=304142&label=gen173nr-1FCAEoggI46AdIM1gEaE2IAQGYAQm4AQrIAQXYAQHoAQH4AQOIAgGoAgO4AsSon6oGwAIB0gIkZWJmMTM1MTktMDYxZS00NzI2LTliODItNzFhZTQxNzU0MzE52AIG4AIB&ucfs=1&arphpl=1&group_adults=2&req_adults=2&no_rooms=1&group_children=0&req_children=0&hpos=16&hapos=16&sr_order=bayesian_review_score&srpvid=11d97ca2afb7023e&srepoch=1699206214&from_sustainable_property_sr=1&from=searchresults#hotelTmpl,"Well set in the centre of Grenoble, Sweet Loft Grenoble-Love Room avec jacuzzi & sauna offers a patio, air conditioning, free WiFi and flat-screen TV. Including a private pool and a bar, this apartment also features a restaurant.

Featuring a DVD player, the apartment has a kitchenette with a microwave, a toaster and a fridge, a living room with a seating area and a dining area, 1 bedroom, and 1 bathroom with a walk-in shower and a hot tub. Towels and bed linen are provided in the apartment.

Guests at the apartment can enjoy an à la carte or a vegetarian breakfast.

At Sweet Loft Grenoble-Love Room avec jacuzzi & sauna guests are welcome to take advantage of a sauna, a hot tub and spa facilities. A bicycle rental service is available at the accommodation.

Popular points of interest near Sweet Loft Grenoble-Love Room avec jacuzzi & sauna include Grenoble Train Station, WTC Grenoble and Alps Stadium. The nearest airport is Alpes–Isère Airport, 48 km from the apartment."
hotel_name,hotel_score,hotel_reviews,hotel_lat,hotel_lon,hotel_url,hotel_description
le Cosy Rock / Rent4night Grenoble,8.5,62 reviews,45.18565140,5.74387840,https://www.booking.com/hotel/fr/le-cosy-rock-rent4night-grenoble.en-gb.html?aid=304142&label=gen173nr-1FCAEoggI46AdIM1gEaE2IAQGYAQm4AQrIAQXYAQHoAQH4AQOIAgGoAgO4Apqrn6oGwAIB0gIkMWY3YWJkOTUtODFkNC00Mzk3LWI2OGQtNWMxNzVjNjk1NGQ02AIG4AIB&ucfs=1&arphpl=1&group_adults=2&req_adults=2&no_rooms=1&group_children=0&req_children=0&hpos=1&hapos=26&sr_order=bayesian_review_score&srpvid=8c377d4d02590139&srepoch=1699206556&from_sustainable_property_sr=1&from=searchresults#hotelTmpl,"Located in Grenoble, 3.4 km from Grenoble Train Station and 3.9 km from WTC Grenoble, le Cosy Rock / Rent4night Grenoble offers air conditioning. It features a garden, city views and free WiFithroughout the property.

The 1-bedroom apartment is equipped with a living room with a flat-screen TV with streaming services, a fully equipped kitchen with a microwave and toaster, and 1 bathroom with shower. Towels and bed linen are provided in the apartment.

Staff at the apartment are always available to provide guidance at the reception.

AlpExpo is 4.8 km from le Cosy Rock / Rent4night Grenoble, while Alps Stadium is 700 metres away. The nearest airport is Alpes–Isère Airport, 49 km from the accommodation."
The station chessboard #H9,9.1,16 reviews,45.19195070,5.71818300,https://www.booking.com/hotel/fr/superbe-et-vaste-t4-calme-en-centre-ville-h9-grenoble.en-gb.html?aid=304142&label=gen173nr-1FCAEoggI46AdIM1gEaE2IAQGYAQm4AQrIAQXYAQHoAQH4AQOIAgGoAgO4Apqrn6oGwAIB0gIkMWY3YWJkOTUtODFkNC00Mzk3LWI2OGQtNWMxNzVjNjk1NGQ02AIG4AIB&ucfs=1&arphpl=1&group_adults=2&req_adults=2&no_rooms=1&group_children=0&req_children=0&hpos=7&hapos=32&sr_order=bayesian_review_score&srpvid=8c377d4d02590139&srepoch=1699206556&from=searchresults#hotelTmpl,"The station chessboard #H9 is situated in Grenoble, 600 metres from WTC Grenoble, 5.5 km from AlpExpo, and 2.3 km from Alps Stadium. The accommodation is 300 metres from the Grenoble Train Station and features free WiFithroughout the property.

The apartment has 3 bedrooms, a TV, an equipped kitchen with a dishwasher and an oven, a washing machine, and 1 bathroom with an a bath or shower. Towels and bed linen are available in the apartment.

The reception at the apartment can provide tips on the area.

The Bastille Grenoble is 1.9 km from The station chessboard #H9, while Summum is 5.7 km from the property. The nearest airport is Alpes–Isère Airport, 46 km from the accommodation."
Le Janet1 YourHostHelper,9.0,8 reviews,45.18293500,5.73083110,https://www.booking.com/hotel/fr/le-janet1-yourhosthelper.en-gb.html?aid=304142&label=gen173nr-1FCAEoggI46AdIM1gEaE2IAQGYAQm4AQrIAQXYAQHoAQH4AQOIAgGoAgO4Apqrn6oGwAIB0gIkMWY3YWJkOTUtODFkNC00Mzk3LWI2OGQtNWMxNzVjNjk1NGQ02AIG4AIB&ucfs=1&arphpl=1&group_adults=2&req_adults=2&no_rooms=1&group_children=0&req_children=0&hpos=4&hapos=29&sr_order=bayesian_review_score&srpvid=8c377d4d02590139&srepoch=1699206556&from=searchresults#hotelTmpl,"Le Janet1 YourHostHelper is located in Grenoble, 2.9 km from WTC Grenoble, 4.5 km from AlpExpo, as well as 1 km from Alps Stadium. The accommodation is 1.8 km from the Grenoble Train Station and features free WiFithroughout the property.

This apartment is equipped with 1 bedroom, a flat-screen TV, and a kitchen. Towels and bed linen are provided in the apartment.

Summum is 4.7 km from the apartment, while The Bastille Grenoble is 4.8 km away. The nearest airport is Alpes–Isère Airport, 48 km from Le Janet1 YourHostHelper."
Grenoble hyper-centre + WiFi + Netflix,9.2,24 reviews,45.18127131,5.72097498,https://www.booking.com/hotel/fr/grenoble-hyper-centre-wifi-netflix.en-gb.html?aid=304142&label=gen173nr-1FCAEoggI46AdIM1gEaE2IAQGYAQm4AQrIAQXYAQHoAQH4AQOIAgGoAgO4Apqrn6oGwAIB0gIkMWY3YWJkOTUtODFkNC00Mzk3LWI2OGQtNWMxNzVjNjk1NGQ02AIG4AIB&ucfs=1&arphpl=1&group_adults=2&req_adults=2&no_rooms=1&group_children=0&req_children=0&hpos=3&hapos=28&sr_order=bayesian_review_score&srpvid=8c377d4d02590139&srepoch=1699206556&from_sustainable_property_sr=1&from=searchresults#hotelTmpl,"Offering free WiFi and mountain views, Grenoble hyper-centre + WiFi + Netflix is an accommodation set in the heart of Grenoble, just 1.5 km from Grenoble Train Station and 1.7 km from WTC Grenoble. The 3-star apartment has city views and is 4.2 km from AlpExpo.

The apartment features 1 bedroom, a flat-screen TV with streaming services, an equipped kitchenette with a microwave and a toaster, and 1 bathroom with a bath. Towels and bed linen are featured in the apartment.

Alps Stadium is 1.9 km from the apartment, while Summum is 4.4 km away. The nearest airport is Alpes–Isère Airport, 47 km from Grenoble hyper-centre + WiFi + Netflix."
Gold Europole-Gare,8.6,42 reviews,45.19011156,5.71100713,https://www.booking.com/hotel/fr/gold-europole-gare.en-gb.html?aid=304142&label=gen173nr-1FCAEoggI46AdIM1gEaE2IAQGYAQm4AQrIAQXYAQHoAQH4AQOIAgGoAgO4Apqrn6oGwAIB0gIkMWY3YWJkOTUtODFkNC00Mzk3LWI2OGQtNWMxNzVjNjk1NGQ02AIG4AIB&ucfs=1&arphpl=1&group_adults=2&req_adults=2&no_rooms=1&group_children=0&req_children=0&hpos=5&hapos=30&sr_order=bayesian_review_score&srpvid=8c377d4d02590139&srepoch=1699206556&from=searchresults#hotelTmpl,"Located in Grenoble and only 300 metres from Grenoble Train Station, Gold Europole-Gare provides accommodation with inner courtyard views, free WiFi and free private parking. Housed in a building dating from 1930, this apartment is 500 metres from WTC Grenoble and 5.8 km from AlpExpo.

The apartment features 2 bedrooms, a flat-screen TV with streaming services, an equipped kitchen with a dishwasher and an oven, a washing machine, and 1 bathroom with a walk-in shower. Towels and bed linen are provided in the apartment.

Alps Stadium is 2.8 km from the apartment, while The Bastille Grenoble is 5.1 km away. The nearest airport is Alpes–Isère Airport, 45 km from Gold Europole-Gare."
"Appartement des 4 Saisons, 80m², 6P, lumineux et traversant",8.2,30 reviews,45.18503497,5.74187530,https://www.booking.com/hotel/fr/appartement-des-4-saisons-80m2-6p-lumineux-et-traversant.en-gb.html?aid=304142&label=gen173nr-1FCAEoggI46AdIM1gEaE2IAQGYAQm4AQrIAQXYAQHoAQH4AQOIAgGoAgO4Apqrn6oGwAIB0gIkMWY3YWJkOTUtODFkNC00Mzk3LWI2OGQtNWMxNzVjNjk1NGQ02AIG4AIB&ucfs=1&arphpl=1&group_adults=2&req_adults=2&no_rooms=1&group_children=0&req_children=0&hpos=6&hapos=31&sr_order=bayesian_review_score&srpvid=8c377d4d02590139&srepoch=1699206556&from=searchresults#hotelTmpl,"Located in Grenoble, Appartement des 4 Saisons, 80m², 6P, lumineux et traversant provides accommodation with a plunge pool and city views. It features garden views and free WiFithroughout the property.

The apartment comes with 2 bedrooms, 1 bathroom, bed linen, towels, a flat-screen TV with cable channels, a dining area, a fully equipped kitchen, and a balcony with mountain views.

The apartment offers a sun terrace.

Grenoble Train Station is 3 km from Appartement des 4 Saisons, 80m², 6P, lumineux et traversant, while WTC Grenoble is 3.5 km away. The nearest airport is Alpes–Isère Airport, 49 km from the accommodation."
Laura Cosy T2 *CLIM* Proche Gare,8.8,26 reviews,45.18804620,5.71735760,https://www.booking.com/hotel/fr/laura-cosy-t2-clim-proche-gare.en-gb.html?aid=304142&label=gen173nr-1FCAEoggI46AdIM1gEaE2IAQGYAQm4AQrIAQXYAQHoAQH4AQOIAgGoAgO4Apqrn6oGwAIB0gIkMWY3YWJkOTUtODFkNC00Mzk3LWI2OGQtNWMxNzVjNjk1NGQ02AIG4AIB&ucfs=1&arphpl=1&group_adults=2&req_adults=2&no_rooms=1&group_children=0&req_children=0&hpos=8&hapos=33&sr_order=bayesian_review_score&srpvid=8c377d4d02590139&srepoch=1699206556&from=searchresults#hotelTmpl,"Situated within 500 metres of Grenoble Train Station and less than 1 km of WTC Grenoble in Grenoble, Laura Cosy T2 *CLIM* Proche Gare features accommodation with a TV. Complimentary WiFi is availablethroughout the property.

Each unit is fitted with air conditioning, private bathroom and a kitchen including an oven, microwave, fridge and kitchenware.

If you would like to discover the area, hiking, walking tours and bike tours are possible in the surroundings.

AlpExpo is 5.2 km from the apartment, while Alps Stadium is 2.3 km from the property. The nearest airport is Alpes–Isère Airport, 46 km from Laura Cosy T2 *CLIM* Proche Gare."
R'Apparts Studio Cocooning Végétal,8.1,15 reviews,45.19268850,5.72510620,https://www.booking.com/hotel/fr/apparts-studio-cocooning-vegetal.en-gb.html?aid=304142&label=gen173nr-1FCAEoggI46AdIM1gEaE2IAQGYAQm4AQrIAQXYAQHoAQH4AQOIAgGoAgO4Apqrn6oGwAIB0gIkMWY3YWJkOTUtODFkNC00Mzk3LWI2OGQtNWMxNzVjNjk1NGQ02AIG4AIB&ucfs=1&arphpl=1&group_adults=2&req_adults=2&no_rooms=1&group_children=0&req_children=0&hpos=2&hapos=27&sr_order=bayesian_review_score&srpvid=8c377d4d02590139&srepoch=1699206556&from=searchresults#hotelTmpl,"R'Apparts Studio Cocooning Végétal is located in the centre of Grenoble, just less than 1 km from Grenoble Train Station and a 14-minute walk from WTC Grenoble. This apartment is 1.8 km from The Bastille Grenoble and 7.6 km from Summum.

With free WiFi, this 1-bedroom apartment provides a flat-screen TV, a washing machine and a kitchen with a microwave and toaster. Towels and bed linen are provided in the apartment.

Hiking can be enjoyed nearby.

AlpExpo is 7.4 km from the apartment, while Alps Stadium is 1.7 km away. The nearest airport is Alpes–Isère Airport, 47 km from R'Apparts Studio Cocooning Végétal."
Jungle studio proche de la gare,8.6,56 reviews,45.19509600,5.71390790,https://www.booking.com/hotel/fr/jungle-studio-proche-de-la-gare-bloomy-appart.en-gb.html?aid=304142&label=gen173nr-1FCAEoggI46AdIM1gEaE2IAQGYAQm4AQrIAQXYAQHoAQH4AQOIAgGoAgO4Apqrn6oGwAIB0gIkMWY3YWJkOTUtODFkNC00Mzk3LWI2OGQtNWMxNzVjNjk1NGQ02AIG4AIB&ucfs=1&arphpl=1&group_adults=2&req_adults=2&no_rooms=1&group_children=0&req_children=0&hpos=10&hapos=35&sr_order=bayesian_review_score&srpvid=8c377d4d02590139&srepoch=1699206556&from=searchresults#hotelTmpl,"Jungle studio proche de la gare is set in Grenoble, 500 metres from Grenoble Train Station, less than 1 km from WTC Grenoble, and 6 km from AlpExpo. It has mountain views and free WiFithroughout the property.

The kitchenette has a microwave, a fridge and a stovetop, as well as coffee machine and kettle.

Alps Stadium is 2.8 km from the apartment, while The Bastille Grenoble is 4.5 km from the property. The nearest airport is Alpes–Isère Airport, 45 km from Jungle studio proche de la gare."
Le petit Versailles - T2 au centre-ville,9.5,22 reviews,45.18697410,5.71659840,https://www.booking.com/hotel/fr/le-petit-versailles-t2-au-centre-ville.en-gb.html?aid=304142&label=gen173nr-1FCAEoggI46AdIM1gEaE2IAQGYAQm4AQrIAQXYAQHoAQH4AQOIAgGoAgO4Apqrn6oGwAIB0gIkMWY3YWJkOTUtODFkNC00Mzk3LWI2OGQtNWMxNzVjNjk1NGQ02AIG4AIB&ucfs=1&arphpl=1&group_adults=2&req_adults=2&no_rooms=1&group_children=0&req_children=0&hpos=11&hapos=36&sr_order=bayesian_review_score&srpvid=8c377d4d02590139&srepoch=1699206556&from_sustainable_property_sr=1&from=searchresults#hotelTmpl,"Situated in Grenoble, 600 metres from Grenoble Train Station and less than 1 km from WTC Grenoble, Le petit Versailles - T2 au centre-ville offers air conditioning. It has city views and free WiFithroughout the property.

The 1-bedroom apartment features a living room with a flat-screen TV with streaming services, a fully equipped kitchen with a dishwasher and oven, and 1 bathroom with walk-in shower. Towels and bed linen are available in the apartment.

AlpExpo is 5.1 km from the apartment, while Alps Stadium is 2.2 km from the property. The nearest airport is Alpes–Isère Airport, 46 km from Le petit Versailles - T2 au centre-ville."
The little Paris #G4,7.3,10 reviews,45.18553520,5.71481740,https://www.booking.com/hotel/fr/grand-studio-calme-lumineuxproche-gem-gare-g4.en-gb.html?aid=304142&label=gen173nr-1FCAEoggI46AdIM1gEaE2IAQGYAQm4AQrIAQXYAQHoAQH4AQOIAgGoAgO4Apqrn6oGwAIB0gIkMWY3YWJkOTUtODFkNC00Mzk3LWI2OGQtNWMxNzVjNjk1NGQ02AIG4AIB&ucfs=1&arphpl=1&group_adults=2&req_adults=2&no_rooms=1&group_children=0&req_children=0&hpos=15&hapos=40&sr_order=bayesian_review_score&srpvid=8c377d4d02590139&srepoch=1699206556&from=searchresults#hotelTmpl,"The little Paris #G4 is situated in Grenoble, 1.1 km from WTC Grenoble, 5 km from AlpExpo, as well as 2.8 km from Alps Stadium. It is located less than 1 km from Grenoble Train Station and features a 24-hour front desk.

With free WiFi, this apartment provides a TV and a kitchen with a microwave and fridge. Towels and bed linen are featured in the apartment.

The Bastille Grenoble is 5 km from the apartment, while Summum is 5.2 km away. The nearest airport is Alpes–Isère Airport, 46 km from The little Paris #G4."
Esprit Bistrot / Rent4night Grenoble,8.3,93 reviews,45.18543211,5.74399642,https://www.booking.com/hotel/fr/esprit-bistrot-rent4night-grenoble.en-gb.html?aid=304142&label=gen173nr-1FCAEoggI46AdIM1gEaE2IAQGYAQm4AQrIAQXYAQHoAQH4AQOIAgGoAgO4Apqrn6oGwAIB0gIkMWY3YWJkOTUtODFkNC00Mzk3LWI2OGQtNWMxNzVjNjk1NGQ02AIG4AIB&ucfs=1&arphpl=1&group_adults=2&req_adults=2&no_rooms=1&group_children=0&req_children=0&hpos=13&hapos=38&sr_order=bayesian_review_score&srpvid=8c377d4d02590139&srepoch=1699206556&from_sustainable_property_sr=1&from=searchresults#hotelTmpl,"Offering a garden and garden view, Esprit Bistrot / Rent4night Grenoble is set in Grenoble, 3.4 km from Grenoble Train Station and 3.9 km from WTC Grenoble. This property offers access to a terrace, free private parking and free WiFi.

This air-conditioned apartment comes with a kitchen, a seating area, a dining area and a TV. Towels and bed linen are offered in the apartment.

Staff at the apartment are always available to provide information at the reception.

If you would like to discover the area, hiking is possible in the surroundings.

AlpExpo is 4.8 km from Esprit Bistrot / Rent4night Grenoble, while Alps Stadium is 700 metres from the property. The nearest airport is Alpes–Isère Airport, 49 km from the accommodation."
Grenoble LA SUITE 2 spa jaccuzzi et sauna privatif,9.5,13 reviews,45.18887660,5.70977994,https://www.booking.com/hotel/fr/la-suite-2-grenoble-spa-jaccuzzi-et-sauna-privatif.en-gb.html?aid=304142&label=gen173nr-1FCAEoggI46AdIM1gEaE2IAQGYAQm4AQrIAQXYAQHoAQH4AQOIAgGoAgO4Apqrn6oGwAIB0gIkMWY3YWJkOTUtODFkNC00Mzk3LWI2OGQtNWMxNzVjNjk1NGQ02AIG4AIB&ucfs=1&arphpl=1&group_adults=2&req_adults=2&no_rooms=1&group_children=0&req_children=0&hpos=12&hapos=37&sr_order=bayesian_review_score&srpvid=8c377d4d02590139&srepoch=1699206556&from=searchresults#hotelTmpl,"Providing free WiFi throughout the property, Grenoble LA SUITE 2 spa jaccuzzi et sauna privatif is located in Grenoble, 600 metres from Grenoble Train Station and 700 metres from WTC Grenoble. The property is around 6.8 km from AlpExpo, 2.8 km from Alps Stadium and 5.1 km from The Bastille Grenoble. Guests can use the spa and wellness centre with a sauna, and hot tub, as well as a bar.

All units in the love hotel are equipped with air conditioning, a seating area, a flat-screen TV with cable channels, a kitchen, a dining area and a private bathroom with free toiletries, a shower and a hot tub. The rooms will provide guests with a fridge.

Summum is 7 km from Grenoble LA SUITE 2 spa jaccuzzi et sauna privatif, while Col de Parménie is 32 km away. The nearest airport is Alpes–Isère Airport, 45 km from the accommodation."
R'Studio Ciné Salle 1 Hypercentre Grenoble,8.7,61 reviews,45.18905610,5.72143980,https://www.booking.com/hotel/fr/studio-cine-salle-1-hypercentre-grenoble.en-gb.html?aid=304142&label=gen173nr-1FCAEoggI46AdIM1gEaE2IAQGYAQm4AQrIAQXYAQHoAQH4AQOIAgGoAgO4Apqrn6oGwAIB0gIkMWY3YWJkOTUtODFkNC00Mzk3LWI2OGQtNWMxNzVjNjk1NGQ02AIG4AIB&ucfs=1&arphpl=1&group_adults=2&req_adults=2&no_rooms=1&group_children=0&req_children=0&hpos=9&hapos=34&sr_order=bayesian_review_score&srpvid=8c377d4d02590139&srepoch=1699206556&from=searchresults#hotelTmpl,"Set in the centre of Grenoble, 700 metres from Grenoble Train Station and less than 1 km from WTC Grenoble, R'Studio Ciné Salle 1 Hypercentre Grenoble offers free WiFi. It is situated 5.5 km from AlpExpo and offers a lift.

The apartment features 1 bedroom, a flat-screen TV with streaming services, an equipped kitchen with a dishwasher and a microwave, a washing machine, and 1 bathroom with a shower. Towels and bed linen are featured in the apartment.

Alps Stadium is 1.8 km from the apartment, while The Bastille Grenoble is 4.5 km away. The nearest airport is Alpes–Isère Airport, 46 km from R'Studio Ciné Salle 1 Hypercentre Grenoble."
Nid Douillet 2 - Appartement cosy avec garage,8.3,57 reviews,45.18618040,5.70594670,https://www.booking.com/hotel/fr/appartement-cosy-space.en-gb.html?aid=304142&label=gen173nr-1FCAEoggI46AdIM1gEaE2IAQGYAQm4AQrIAQXYAQHoAQH4AQOIAgGoAgO4Apqrn6oGwAIB0gIkMWY3YWJkOTUtODFkNC00Mzk3LWI2OGQtNWMxNzVjNjk1NGQ02AIG4AIB&ucfs=1&arphpl=1&group_adults=2&req_adults=2&no_rooms=1&group_children=0&req_children=0&hpos=14&hapos=39&sr_order=bayesian_review_score&srpvid=8c377d4d02590139&srepoch=1699206556&from_sustainable_property_sr=1&from=searchresults#hotelTmpl,"Located in Grenoble and only 1.1 km from Grenoble Train Station, Nid Douillet 2 - Appartement cosy avec garage provides accommodation with inner courtyard views, free WiFi and free private parking. It is situated 1.2 km from WTC Grenoble and features private check-in and check-out.

The apartment with a patio and city views features 1 bedroom, a living room, a flat-screen TV, an equipped kitchen with a dishwasher and an oven, and 1 bathroom with a walk-in shower. Towels and bed linen are provided in the apartment.

AlpExpo is 6 km from the apartment, while Alps Stadium is 3.8 km away. The nearest airport is Alpes–Isère, 45 km from Nid Douillet 2 - Appartement cosy avec garage, and the property offers a paid airport shuttle service."
La petite Maison,8.2,116 reviews,45.17557000,5.71358200,https://www.booking.com/hotel/fr/la-petite-maison-grenoble1.en-gb.html?aid=304142&label=gen173nr-1FCAEoggI46AdIM1gEaE2IAQGYAQm4AQrIAQXYAQHoAQH4AQOIAgGoAgO4Apqrn6oGwAIB0gIkMWY3YWJkOTUtODFkNC00Mzk3LWI2OGQtNWMxNzVjNjk1NGQ02AIG4AIB&ucfs=1&arphpl=1&group_adults=2&req_adults=2&no_rooms=1&group_children=0&req_children=0&hpos=17&hapos=42&sr_order=bayesian_review_score&srpvid=8c377d4d02590139&srepoch=1699206556&from=searchresults#hotelTmpl,"Set within 2 km of WTC Grenoble and 3.8 km of AlpExpo in Grenoble, La petite Maison offers accommodation with seating area. Complimentary WiFi is offered throughout the property and paid secure private parking is available on site. Free public parking can be found in the streets nearby.

All units here are air-conditioned and feature a flat-screen TV, a living room with a sofa, a well-equipped kitchen with a dining area, and a private bathroom with shower, a hairdryer and free toiletries. A microwave, a fridge and stovetop are also featured, as well as a kettle and a coffee machine.

There is a garden with a barbecue at this property and guests can go hiking and cycling nearby.

Alps Stadium is 3.1 km from the aparthotel, while Summum is 4 km from the property. The nearest airport is Grenoble - Isère Airport, 46 km from La petite Maison."
Brooklyn - Studio moderne à 2 pas du tram A,8.1,16 reviews,45.17398120,5.73113650,https://www.booking.com/hotel/fr/brooklyn-studio-moderne-a-2-pas-du-tram-a.en-gb.html?aid=304142&label=gen173nr-1FCAEoggI46AdIM1gEaE2IAQGYAQm4AQrIAQXYAQHoAQH4AQOIAgGoAgO4Apqrn6oGwAIB0gIkMWY3YWJkOTUtODFkNC00Mzk3LWI2OGQtNWMxNzVjNjk1NGQ02AIG4AIB&ucfs=1&arphpl=1&group_adults=2&req_adults=2&no_rooms=1&group_children=0&req_children=0&hpos=24&hapos=49&sr_order=bayesian_review_score&srpvid=8c377d4d02590139&srepoch=1699206556&from=searchresults#hotelTmpl,"Brooklyn - Studio moderne à 2 pas du tram A is located in Grenoble, 3 km from Grenoble Train Station, 3.7 km from WTC Grenoble, as well as 2.5 km from Alps Stadium. The accommodation is 2.7 km from the AlpExpo and features free WiFithroughout the property.

This air-conditioned apartment is equipped with 1 bedroom, a flat-screen TV, a dining area, and a kitchenette with an oven and a microwave.

Summum is 2.9 km from the apartment, while The Bastille Grenoble is 6.2 km away. The nearest airport is Alpes–Isère Airport, 49 km from Brooklyn - Studio moderne à 2 pas du tram A."
