hotel_name,hotel_score,hotel_reviews,hotel_lat,hotel_lon,hotel_url,hotel_description
41 Vallier,8.0,22 reviews,45.17986580,5.70924250,https://www.booking.com/hotel/fr/41-vallier.en-gb.html?aid=304142&label=gen173nr-1FCAEoggI46AdIM1gEaE2IAQGYAQm4AQrIAQXYAQHoAQH4AQOIAgGoAgO4Apqrn6oGwAIB0gIkMWY3YWJkOTUtODFkNC00Mzk3LWI2OGQtNWMxNzVjNjk1NGQ02AIG4AIB&ucfs=1&arphpl=1&group_adults=2&req_adults=2&no_rooms=1&group_children=0&req_children=0&hpos=25&hapos=50&sr_order=bayesian_review_score&srpvid=8c377d4d02590139&srepoch=1699206556&from=searchresults#hotelTmpl,"Set 1.6 km from Grenoble Train Station, 4.8 km from AlpExpo and 2.7 km from Alps Stadium, 41 Vallier offers accommodation situated in Grenoble. The accommodation is 1.7 km from the WTC Grenoble and features free WiFithroughout the property.

The 2-bedroom apartment comes with a living room with a TV, a fully equipped kitchen with dishwasher and microwave, and 2 bathrooms with a hair dryer. Towels and bed linen are featured in the apartment.

Summum is 5 km from the apartment, while The Bastille Grenoble is 6.5 km away. The nearest airport is Alpes–Isère Airport, 46 km from 41 Vallier."
Le Filmophile avec garage,8.2,68 reviews,45.18704127,5.71158517,https://www.booking.com/hotel/fr/le-filmophile-avec-garage.en-gb.html?aid=304142&label=gen173nr-1FCAEoggI46AdIM1gEaE2IAQGYAQm4AQrIAQXYAQHoAQH4AQOIAgGoAgO4Apqrn6oGwAIB0gIkMWY3YWJkOTUtODFkNC00Mzk3LWI2OGQtNWMxNzVjNjk1NGQ02AIG4AIB&ucfs=1&arphpl=1&group_adults=2&req_adults=2&no_rooms=1&group_children=0&req_children=0&hpos=22&hapos=47&sr_order=bayesian_review_score&srpvid=8c377d4d02590139&srepoch=1699206556&from_sustainable_property_sr=1&from=searchresults#hotelTmpl,"Set in Grenoble and only 700 metres from Grenoble Train Station, Le Filmophile avec garage offers accommodation with mountain views, free WiFi and free private parking. With city views, this accommodation provides a balcony.

This apartment is fitted with 1 bedroom, a kitchen with an oven and a microwave, a flat-screen TV, a seating area and 1 bathroom fitted with a walk-in shower. Towels and bed linen are offered in the apartment.

The reception at the apartment can provide tips on the area.

WTC Grenoble is less than 1 km from Le Filmophile avec garage, while AlpExpo is 5.5 km from the property. The nearest airport is Alpes–Isère Airport, 45 km from the accommodation."
"Le Grand Hôtel Grenoble, BW Premier Collection by Best Western",8.3,"1,453 reviews",45.19081504,5.72854802,https://www.booking.com/hotel/fr/le-grand-grenoble-centre.en-gb.html?aid=304142&label=gen173nr-1FCAEoggI46AdIM1gEaE2IAQGYAQm4AQrIAQXYAQHoAQH4AQOIAgGoAgO4Apqrn6oGwAIB0gIkMWY3YWJkOTUtODFkNC00Mzk3LWI2OGQtNWMxNzVjNjk1NGQ02AIG4AIB&ucfs=1&arphpl=1&group_adults=2&req_adults=2&no_rooms=1&group_children=0&req_children=0&hpos=23&hapos=48&sr_order=bayesian_review_score&srpvid=8c377d4d02590139&srepoch=1699206556&from=searchresults#hotelTmpl,"The 4-star Le Grand Hôtel is located in the Grenoble City Centre, 10 metres from Place Grenette. The guest rooms are soundproofed, air-conditioned and some offer a balcony.

The guest rooms have a private bathroom with a bathtub or a walk-in shower. They also have a minibar, a flat-screen TV with satellite channels and free WiFi.

Le Stendhal onsite bar offers a variety of drinks, cocktails and wines. Guests have the option of a full-breakfast or an express breakfast. A range of cold dishes can be delivered to your room for lunch or dinner.

The front desk at Le Grand Hôtel Grenoble is open 24 hours a day. Grenoble TGV Train Station is 1.5 km away. Public parking is available nearby."
The subtile red #G3,7.8,22 reviews,45.18508550,5.71839450,https://www.booking.com/hotel/fr/beau-t2-cachetmur-en-pierres-pour-4-g3.en-gb.html?aid=304142&label=gen173nr-1FCAEoggI46AdIM1gEaE2IAQGYAQm4AQrIAQXYAQHoAQH4AQOIAgGoAgO4Apqrn6oGwAIB0gIkMWY3YWJkOTUtODFkNC00Mzk3LWI2OGQtNWMxNzVjNjk1NGQ02AIG4AIB&ucfs=1&arphpl=1&group_adults=2&req_adults=2&no_rooms=1&group_children=0&req_children=0&hpos=20&hapos=45&sr_order=bayesian_review_score&srpvid=8c377d4d02590139&srepoch=1699206556&from=searchresults#hotelTmpl,"Offering free WiFi, The subtile red #G3 is situated in the centre of Grenoble within less than 1 km of Grenoble Train Station and a 13-minute walk from WTC Grenoble. It is set 5 km from AlpExpo and features a 24-hour front desk.

This apartment includes 1 bedroom, a living room and a TV, an equipped kitchen with a dining area, and 1 bathroom with an a bath or shower and a washing machine. Towels and bed linen are available in the apartment.

Alps Stadium is 2.4 km from the apartment, while The Bastille Grenoble is 4.7 km from the property. The nearest airport is Alpes–Isère Airport, 46 km from The subtile red #G3."
Europole 2 Gare de Grenoble & centre ville,7.1,36 reviews,45.18909300,5.71245570,https://www.booking.com/hotel/fr/suite-proche-gare-de-grenoble-et-centre-ville.en-gb.html?aid=304142&label=gen173nr-1FCAEoggI46AdIM1gEaE2IAQGYAQm4AQrIAQXYAQHoAQH4AQOIAgGoAgO4Apqrn6oGwAIB0gIkMWY3YWJkOTUtODFkNC00Mzk3LWI2OGQtNWMxNzVjNjk1NGQ02AIG4AIB&ucfs=1&arphpl=1&group_adults=2&req_adults=2&no_rooms=1&group_children=0&req_children=0&hpos=18&hapos=43&sr_order=bayesian_review_score&srpvid=8c377d4d02590139&srepoch=1699206556&from_sustainable_property_sr=1&from=searchresults#hotelTmpl,"Europole 2 Gare de Grenoble & centre ville is situated in Grenoble, 500 metres from WTC Grenoble, 5.8 km from AlpExpo, and 2.8 km from Alps Stadium. The accommodation is 400 metres from the Grenoble Train Station and has free WiFithroughout the property.

This apartment has 1 bedroom, a kitchen with a microwave and a fridge, a flat-screen TV, a seating area and 1 bathroom fitted with a walk-in shower. Towels and bed linen are offered in the apartment.

The Bastille Grenoble is 5.1 km from the apartment, while Summum is 6 km from the property. The nearest airport is Alpes–Isère, 45 km from Europole 2 Gare de Grenoble & centre ville, and the property offers a paid airport shuttle service."
Tempologis Grenoble,8.1,110 reviews,45.17927340,5.73433891,https://www.booking.com/hotel/fr/tempologis-grenoble.en-gb.html?aid=304142&label=gen173nr-1FCAEoggI46AdIM1gEaE2IAQGYAQm4AQrIAQXYAQHoAQH4AQOIAgGoAgO4Apqrn6oGwAIB0gIkMWY3YWJkOTUtODFkNC00Mzk3LWI2OGQtNWMxNzVjNjk1NGQ02AIG4AIB&ucfs=1&arphpl=1&group_adults=2&req_adults=2&no_rooms=1&group_children=0&req_children=0&hpos=21&hapos=46&sr_order=bayesian_review_score&srpvid=8c377d4d02590139&srepoch=1699206556&from_sustainable_property_sr=1&from=searchresults#hotelTmpl,"Tempologis Grenoble is located in Grenoble and offers self-catering accommodation. Free WiFi access is available. The property is 1 km from Paul Mistral Park and 2.5 km from Grenoble Train Station.

Apartments at Tempologis Grenoble feature a flat-screen TV, a balcony and a seating area. There is a full a kitchenette with a dishwasher and a microwave. Featuring a shower, private bathroom also comes with a hairdryer and free toiletries. You can enjoy mountain view and city view from the room.

At Tempologis Grenoble you will find a garden. Other facilities like grocery deliveries, laundry facilities and a vending machine are offered.

Grenoble-Isère Airport is 43.1 km away."
"Standing Europole, garage privé, calme, netflix",8.0,29 reviews,45.19403300,5.71137930,https://www.booking.com/hotel/fr/europole-vue-bastille-confort-standing-calme.en-gb.html?aid=304142&label=gen173nr-1FCAEoggI46AdIM1gEaE2IAQGYAQm4AQrIAQXYAQHoAQH4AQOIAgGoAgO4Apqrn6oGwAIB0gIkMWY3YWJkOTUtODFkNC00Mzk3LWI2OGQtNWMxNzVjNjk1NGQ02AIG4AIB&ucfs=1&arphpl=1&group_adults=2&req_adults=2&no_rooms=1&group_children=0&req_children=0&hpos=19&hapos=44&sr_order=bayesian_review_score&srpvid=8c377d4d02590139&srepoch=1699206556&from=searchresults#hotelTmpl,"Standing Europole, garage privé, calme, netflix is located in Grenoble, 400 metres from WTC Grenoble, 500 metres from Grenoble Train Station, as well as 7 km from AlpExpo. This property offers access to a balcony, free private parking and free WiFi.

The air-conditioned apartment consists of 1 bedroom, a living room, a fully equipped kitchen with a dishwasher and a coffee machine, and 2 bathrooms with a bath and a hair dryer. Towels and bed linen are provided in the apartment.

Alps Stadium is 3.7 km from the apartment, while The Bastille Grenoble is 6 km away. The nearest airport is Alpes–Isère Airport, 45 km from Standing Europole, garage privé, calme, netflix."
"Le Huppé, Hypercentre, proche Bastille, WIFI illimité & Netflix",9.0,23 reviews,45.19249102,5.72785267,https://www.booking.com/hotel/fr/le-huppe-hypercentre-proche-bastille-wifi-illimite-amp-netflix.en-gb.html?aid=304142&label=gen173nr-1FCAEoggI46AdIM1gEaE2IAQGYAQm4AQrIAQXYAQHoAQH4AQOIAgGoAgO4Apqrn6oGwAIB0gIkMWY3YWJkOTUtODFkNC00Mzk3LWI2OGQtNWMxNzVjNjk1NGQ02AIG4AIB&ucfs=1&arphpl=1&group_adults=2&req_adults=2&no_rooms=1&group_children=0&req_children=0&hpos=16&hapos=41&sr_order=bayesian_review_score&srpvid=8c377d4d02590139&srepoch=1699206556&from=searchresults#hotelTmpl,"Situated in the centre of Grenoble, 1.2 km from Grenoble Train Station and 1.5 km from WTC Grenoble, Le Huppé, Hypercentre, proche Bastille, WIFI illimité & Netflix offers free WiFi and air conditioning. This apartment is 7.2 km from AlpExpo and 1.5 km from Alps Stadium.

The apartment has 1 bedroom, a flat-screen TV with streaming services, an equipped kitchen with a microwave and a fridge, a washing machine, and 1 bathroom with a shower. Towels and bed linen are available in the apartment.

The Bastille Grenoble is 1.7 km from the apartment, while Summum is 7.4 km from the property. The nearest airport is Alpes–Isère Airport, 47 km from Le Huppé, Hypercentre, proche Bastille, WIFI illimité & Netflix."
