hotel_name,hotel_score,hotel_reviews,hotel_lat,hotel_lon,hotel_url,hotel_description
"Grand appartement, 2 chambres et jardin",9.7,22 reviews,43.82820190,4.36686200,https://www.booking.com/hotel/fr/appartement-avec-petit-jardin-nimes.en-gb.html?aid=304142&label=gen173nr-1FCAEoggI46AdIM1gEaE2IAQGYAQm4AQrIAQXYAQHoAQH4AQOIAgGoAgO4AvSrn6oGwAIB0gIkNjdkNDQ4NGItYjFhNS00NjgxLTljMDItYmMwMmNiNzY1MjM02AIG4AIB&ucfs=1&arphpl=1&group_adults=2&req_adults=2&no_rooms=1&group_children=0&req_children=0&hpos=2&hapos=27&sr_order=bayesian_review_score&srpvid=45f87d7affc300ac&srepoch=1699206646&from=searchresults#hotelTmpl,"Offering inner courtyard views, Grand appartement, 2 chambres et jardin is an accommodation set in Nîmes, 1.6 km from Parc Expo Nîmes and 33 km from Arles Amphitheatre. It has a garden, garden views and free WiFithroughout the property.

The apartment features 2 bedrooms, a flat-screen TV, an equipped kitchen with a dishwasher and an oven, a washing machine, and 1 bathroom with a shower. Towels and bed linen are featured in the apartment.

Avignon Central Station is 44 km from the apartment, while Papal Palace is 46 km away. The nearest airport is Nimes-Ales-Camargue-Cevennes Airport, 8 km from Grand appartement, 2 chambres et jardin."
Guest House Encantada,9.7,117 reviews,43.85305200,4.35138600,https://www.booking.com/hotel/fr/encantadahome.en-gb.html?aid=304142&label=gen173nr-1FCAEoggI46AdIM1gEaE2IAQGYAQm4AQrIAQXYAQHoAQH4AQOIAgGoAgO4AvSrn6oGwAIB0gIkNjdkNDQ4NGItYjFhNS00NjgxLTljMDItYmMwMmNiNzY1MjM02AIG4AIB&ucfs=1&arphpl=1&group_adults=2&req_adults=2&no_rooms=1&group_children=0&req_children=0&hpos=1&hapos=26&sr_order=bayesian_review_score&srpvid=45f87d7affc300ac&srepoch=1699206646&from_sustainable_property_sr=1&from=searchresults#hotelTmpl,"With pool views, Guest House Encantada is set in Nîmes and has a restaurant, full-day security, bar, garden, sun terrace and outdoor fireplace. The homestay features both WiFi and private parking free of charge.

There is a private bathroom with walk-in shower and a hair dryer in each unit, along with free toiletries.

A continental breakfast is available every morning at Guest House Encantada.

Guests can enjoy the infinity pool at the accommodation.

Parc Expo Nîmes is 15 km from Guest House Encantada, while Arles Amphitheatre is 36 km from the property. The nearest airport is Nimes-Ales-Camargue-Cevennes, 11 km from the homestay, and the property offers a paid airport shuttle service."
Appartemment Nimes Arènes,,,43.83511431,4.36398609,https://www.booking.com/hotel/fr/apparemment-nimes-arenes.en-gb.html?aid=304142&label=gen173nr-1FCAEoggI46AdIM1gEaE2IAQGYAQm4AQrIAQXYAQHoAQH4AQOIAgGoAgO4AvSrn6oGwAIB0gIkNjdkNDQ4NGItYjFhNS00NjgxLTljMDItYmMwMmNiNzY1MjM02AIG4AIB&ucfs=1&arphpl=1&group_adults=2&req_adults=2&no_rooms=1&group_children=0&req_children=0&hpos=6&hapos=31&sr_order=bayesian_review_score&srpvid=45f87d7affc300ac&srepoch=1699206646&from=searchresults#hotelTmpl,"Appartemment Nimes Arènes is located in Nîmes, 34 km from Arles Amphitheatre, 43 km from Avignon Central Station, as well as 45 km from Papal Palace. It is situated 13 km from Parc Expo Nîmes and features free WiFi and free private parking.

This apartment has 2 bedrooms, a kitchen with a dishwasher and a microwave, a flat-screen TV, a seating area and 1 bathroom fitted with a walk-in shower. Towels and bed linen are offered in the apartment.

Avignon TGV Train Station is 46 km from the apartment, while Zenith Sud Montpellier is 48 km from the property. The nearest airport is Nimes-Ales-Camargue-Cevennes Airport, 9 km from Appartemment Nimes Arènes."
"LE COSY Joli F2 proche gare, Arénes avec terrasse privée",9.3,80 reviews,43.82800500,4.37496210,https://www.booking.com/hotel/fr/le-cosy-nimes2.en-gb.html?aid=304142&label=gen173nr-1FCAEoggI46AdIM1gEaE2IAQGYAQm4AQrIAQXYAQHoAQH4AQOIAgGoAgO4AvSrn6oGwAIB0gIkNjdkNDQ4NGItYjFhNS00NjgxLTljMDItYmMwMmNiNzY1MjM02AIG4AIB&ucfs=1&arphpl=1&group_adults=2&req_adults=2&no_rooms=1&group_children=0&req_children=0&hpos=5&hapos=30&sr_order=bayesian_review_score&srpvid=45f87d7affc300ac&srepoch=1699206646&from_sustainable_property_sr=1&from=searchresults#hotelTmpl,"Set in Nîmes, 33 km from Arles Amphitheatre and 43 km from Avignon Central Station, LE COSY Joli F2 proche gare, Arénes avec terrasse privée offers air conditioning. The accommodation is 1.8 km from the Parc Expo Nîmes and has free WiFithroughout the property.

The apartment is fitted with 1 bedroom, 1 bathroom, bed linen, towels, a flat-screen TV with streaming services, a fully equipped kitchen, and a terrace with garden views.

The apartment can conveniently provide information at the reception to help guests to get around the area.

Papal Palace is 45 km from LE COSY Joli F2 proche gare, Arénes avec terrasse privée, while Avignon TGV Train Station is 45 km from the property. The nearest airport is Nimes-Ales-Camargue-Cevennes Airport, 9 km from the accommodation."
Dolce NÎMES CENTRE,8.6,110 reviews,43.84200130,4.36324300,https://www.booking.com/hotel/fr/enclos-rey.en-gb.html?aid=304142&label=gen173nr-1FCAEoggI46AdIM1gEaE2IAQGYAQm4AQrIAQXYAQHoAQH4AQOIAgGoAgO4AvSrn6oGwAIB0gIkNjdkNDQ4NGItYjFhNS00NjgxLTljMDItYmMwMmNiNzY1MjM02AIG4AIB&ucfs=1&arphpl=1&group_adults=2&req_adults=2&no_rooms=1&group_children=0&req_children=0&hpos=3&hapos=28&sr_order=bayesian_review_score&srpvid=45f87d7affc300ac&srepoch=1699206646&from=searchresults#hotelTmpl,"Dolce NÎMES CENTRE has air-conditioned guest accommodation in Nîmes, 13 km from Parc Expo Nîmes, 35 km from Arles Amphitheatre and 44 km from Avignon Central Station. Free WiFi is featuredthroughout the property.

All units include a seating area, a flat-screen TV with cable channels, an equipped kitchen, a dining area, and a private bathroom fiitted with bathrobes, while some rooms feature a terrace or a balcony. A dishwasher, a microwave and toaster are also available, as well as a coffee machine and a kettle.

Papal Palace is 45 km from the apartment, while Avignon TGV Train Station is 46 km from the property. The nearest airport is Nimes-Ales-Camargue-Cevennes Airport, 10 km from Dolce NÎMES CENTRE."
Patrick&Pierre Bed and Breakfast Nîmes,9.3,278 reviews,43.83503623,4.34953472,https://www.booking.com/hotel/fr/patrick-amp-pierre-bnb-nimes.en-gb.html?aid=304142&label=gen173nr-1FCAEoggI46AdIM1gEaE2IAQGYAQm4AQrIAQXYAQHoAQH4AQOIAgGoAgO4AvSrn6oGwAIB0gIkNjdkNDQ4NGItYjFhNS00NjgxLTljMDItYmMwMmNiNzY1MjM02AIG4AIB&ucfs=1&arphpl=1&group_adults=2&req_adults=2&no_rooms=1&group_children=0&req_children=0&hpos=4&hapos=29&sr_order=bayesian_review_score&srpvid=45f87d7affc300ac&srepoch=1699206646&from_sustainable_property_sr=1&from=searchresults#hotelTmpl,"Patrick&Pierre BnB Nîmes is located in Nîmes, 500 metres from the Jardins de la Fontaine, 900 metres from the historic centre and 2.6 km from the Parc Expo Nîmes. Free WiFi is offered.

The rooms include a private bathroom and a flat-screen TV. You will find a kettle in the room. Extras include free toiletries and a hairdryer.

Breakfast is provided.

Nîmes Town Hall is 800 metres from Patrick&Pierre BnB Nîmes, while the Nimes School of Fine Arts is 900 metres away. The train station is 3 km away, while the nearest airport is Nimes-Ales-Camargue-Cevennes Airport, 11 km from the property."
Superbe appartement avec parking sur place,8.9,116 reviews,43.83799940,4.37090630,https://www.booking.com/hotel/fr/superbe-appartement-avec-parking-sur-place.en-gb.html?aid=304142&label=gen173nr-1FCAEoggI46AdIM1gEaE2IAQGYAQm4AQrIAQXYAQHoAQH4AQOIAgGoAgO4AvSrn6oGwAIB0gIkNjdkNDQ4NGItYjFhNS00NjgxLTljMDItYmMwMmNiNzY1MjM02AIG4AIB&ucfs=1&arphpl=1&group_adults=2&req_adults=2&no_rooms=1&group_children=0&req_children=0&hpos=9&hapos=34&sr_order=bayesian_review_score&srpvid=45f87d7affc300ac&srepoch=1699206646&from=searchresults#hotelTmpl,"Offering garden views, Superbe appartement avec parking sur place is an accommodation located in Nîmes, 35 km from Arles Amphitheatre and 43 km from Avignon Central Station. The air-conditioned accommodation is 12 km from Parc Expo Nîmes, and guests benefit from private parking available on site and free WiFi.

This apartment is equipped with 2 bedrooms, a kitchen with a dishwasher and an oven, a flat-screen TV, a seating area and 1 bathroom equipped with a shower. Towels and bed linen are provided in the apartment.

Papal Palace is 44 km from the apartment, while Avignon TGV Train Station is 45 km away. The nearest airport is Nimes-Ales-Camargue-Cevennes Airport, 10 km from Superbe appartement avec parking sur place."
La Dolce Vita Nîmoise Terrasse 100 m des Arènes,9.5,55 reviews,43.83344380,4.36038700,https://www.booking.com/hotel/fr/t2-terrasse-vue-sur-les-arenes.en-gb.html?aid=304142&label=gen173nr-1FCAEoggI46AdIM1gEaE2IAQGYAQm4AQrIAQXYAQHoAQH4AQOIAgGoAgO4AvSrn6oGwAIB0gIkNjdkNDQ4NGItYjFhNS00NjgxLTljMDItYmMwMmNiNzY1MjM02AIG4AIB&ucfs=1&arphpl=1&group_adults=2&req_adults=2&no_rooms=1&group_children=0&req_children=0&hpos=7&hapos=32&sr_order=bayesian_review_score&srpvid=45f87d7affc300ac&srepoch=1699206646&from=searchresults#hotelTmpl,"Set in Nîmes, 33 km from Arles Amphitheatre and 44 km from Avignon Central Station, La Dolce Vita Nîmoise Terrasse 100 m des Arènes offers air conditioning. The accommodation is 14 km from the Parc Expo Nîmes and has free WiFithroughout the property.

The apartment with a terrace and city views features 1 bedroom, a living room, a flat-screen TV, an equipped kitchen with a dishwasher and an oven, and 1 bathroom with a bath. Towels and bed linen are featured in the apartment.

Papal Palace is 46 km from the apartment, while Avignon TGV Train Station is 47 km away. The nearest airport is Nimes-Ales-Camargue-Cevennes Airport, 8 km from La Dolce Vita Nîmoise Terrasse 100 m des Arènes."
Mas de Boudan,9.1,123 reviews,43.82080551,4.37125320,https://www.booking.com/hotel/fr/mas-de-boudan.en-gb.html?aid=304142&label=gen173nr-1FCAEoggI46AdIM1gEaE2IAQGYAQm4AQrIAQXYAQHoAQH4AQOIAgGoAgO4AvSrn6oGwAIB0gIkNjdkNDQ4NGItYjFhNS00NjgxLTljMDItYmMwMmNiNzY1MjM02AIG4AIB&ucfs=1&arphpl=1&group_adults=2&req_adults=2&no_rooms=1&group_children=0&req_children=0&hpos=8&hapos=33&sr_order=bayesian_review_score&srpvid=45f87d7affc300ac&srepoch=1699206646&from=searchresults#hotelTmpl,"Situated 3 km from Nimes’ Arena, the Mas de Boudan is a boutique hotel that features two restaurants, Bistr'Au and Restaurant Gastronomique, which has a Michelin star. This air-conditioned hotel offers free WiFi throughout.

The non-smoking rooms have a flat screen TV, an iPod dock, a safe, a minibar, a coffee machine and an electric kettle. The private bathrooms are equipped with a shower and come with bathrobes, slippers and a hairdryer.  All rooms have a garden view.

Mas de Boudan offers a shared garden and terrace area. There is an on-site shop selling homemade and local produce. You will also find a massage service, a laundry service and business facilities at the hotel.

The property is a 9-minute drive from Nimes Train Station, 52 km from Montpellier-Mediterranee Airport and 100 km from Marseille Provence Airport. Free parking is available at Mas de Boudan."
Allegria Nimes Chambre Deluxe Spa,9.0,70 reviews,43.82458070,4.35053480,https://www.booking.com/hotel/fr/allegriasuites-nimes-nimes.en-gb.html?aid=304142&label=gen173nr-1FCAEoggI46AdIM1gEaE2IAQGYAQm4AQrIAQXYAQHoAQH4AQOIAgGoAgO4AvSrn6oGwAIB0gIkNjdkNDQ4NGItYjFhNS00NjgxLTljMDItYmMwMmNiNzY1MjM02AIG4AIB&ucfs=1&arphpl=1&group_adults=2&req_adults=2&no_rooms=1&group_children=0&req_children=0&hpos=13&hapos=38&sr_order=bayesian_review_score&srpvid=45f87d7affc300ac&srepoch=1699206646&from=searchresults#hotelTmpl,"Located in Nîmes, 1.9 km from Parc Expo Nîmes and 33 km from Arles Amphitheatre, Allegria Nimes Chambre Deluxe Spa offers a spa and wellness centre and air conditioning. This property offers access to a terrace, free private parking and free WiFi.

The bed and breakfast comes with a flat-screen TV. Towels and bed linen are featured in the bed and breakfast.

A continental breakfast is available daily at the bed and breakfast.

At Allegria Nimes Chambre Deluxe Spa guests are welcome to take advantage of a hot tub. Guests can enjoy the outdoor swimming pool and garden at the accommodation.

Zenith Sud Montpellier is 46 km from Allegria Nimes Chambre Deluxe Spa, while Odysseum Shopping Centre is 47 km away. The nearest airport is Nimes-Ales-Camargue-Cevennes Airport, 10 km from the bed and breakfast."
Maison Carrée/Coeur historique de Nîmes - Superbe Appt 55m²,9.1,38 reviews,43.83725820,4.35486990,https://www.booking.com/hotel/fr/maison-carree-47-coeur-historique-de-nimes-superbe-appt-55m2.en-gb.html?aid=304142&label=gen173nr-1FCAEoggI46AdIM1gEaE2IAQGYAQm4AQrIAQXYAQHoAQH4AQOIAgGoAgO4AvSrn6oGwAIB0gIkNjdkNDQ4NGItYjFhNS00NjgxLTljMDItYmMwMmNiNzY1MjM02AIG4AIB&ucfs=1&arphpl=1&group_adults=2&req_adults=2&no_rooms=1&group_children=0&req_children=0&hpos=12&hapos=37&sr_order=bayesian_review_score&srpvid=45f87d7affc300ac&srepoch=1699206646&from=searchresults#hotelTmpl,"Set in the centre of Nîmes, just 15 km from Parc Expo Nîmes and 34 km from Arles Amphitheatre, Maison Carrée/Coeur historique de Nîmes - Superbe Appt 55m² offers accommodation with city views and free WiFi. This apartment is 45 km from Avignon Central Station and 47 km from Papal Palace.

The 1-bedroom apartment has a living room with a flat-screen TV, a fully equipped kitchen with dishwasher and oven, and 1 bathroom with a hair dryer. Towels and bed linen are offered in the apartment.

Zenith Sud Montpellier is 47 km from the apartment, while Avignon TGV Train Station is 47 km from the property. The nearest airport is Nimes-Ales-Camargue-Cevennes Airport, 9 km from Maison Carrée/Coeur historique de Nîmes - Superbe Appt 55m²."
La cigale et la fourmi,9.0,134 reviews,43.84345325,4.33401470,https://www.booking.com/hotel/fr/la-cigale-et-la-fourmi-nimes.en-gb.html?aid=304142&label=gen173nr-1FCAEoggI46AdIM1gEaE2IAQGYAQm4AQrIAQXYAQHoAQH4AQOIAgGoAgO4AvSrn6oGwAIB0gIkNjdkNDQ4NGItYjFhNS00NjgxLTljMDItYmMwMmNiNzY1MjM02AIG4AIB&ucfs=1&arphpl=1&group_adults=2&req_adults=2&no_rooms=1&group_children=0&req_children=0&hpos=10&hapos=35&sr_order=bayesian_review_score&srpvid=45f87d7affc300ac&srepoch=1699206646&from=searchresults#hotelTmpl,"Located 16 km from Parc Expo Nîmes, La cigale et la fourmi provides accommodation with an infinity pool, a garden and a shared kitchen for your convenience. Complimentary WiFi is featuredthroughout the property.

Fitted with a terrace, the units offer air conditioning and feature a flat-screen TV and a private bathroom with shower and a hair dryer. A dishwasher, an oven and microwave are also provided, as well as a coffee machine and a kettle.

The homestay offers a picnic area.

A outdoor play equipment is also available for guests at La cigale et la fourmi.

Arles Amphitheatre is 35 km from the accommodation, while Avignon Central Station is 46 km away. The nearest airport is Nimes-Ales-Camargue-Cevennes Airport, 12 km from La cigale et la fourmi."
Roma Divine home cinéma et jardin,9.7,49 reviews,43.83548750,4.36488547,https://www.booking.com/hotel/fr/roma-divine-home-cinema-jardinet-hyper-centre.en-gb.html?aid=304142&label=gen173nr-1FCAEoggI46AdIM1gEaE2IAQGYAQm4AQrIAQXYAQHoAQH4AQOIAgGoAgO4AvSrn6oGwAIB0gIkNjdkNDQ4NGItYjFhNS00NjgxLTljMDItYmMwMmNiNzY1MjM02AIG4AIB&ucfs=1&arphpl=1&group_adults=2&req_adults=2&no_rooms=1&group_children=0&req_children=0&hpos=11&hapos=36&sr_order=bayesian_review_score&srpvid=45f87d7affc300ac&srepoch=1699206646&from_sustainable_property_sr=1&from=searchresults#hotelTmpl,"Boasting garden views, Roma Divine home cinéma et jardin features accommodation with a patio and a coffee machine, around 13 km from Parc Expo Nîmes. This property offers access to a terrace, free private parking and free WiFi.

The apartment is located on the ground floor and features 2 bedrooms, a flat-screen TV with streaming services and a fully equipped kitchen that provides guests with a dishwasher, an oven, a washing machine, a microwave and a toaster. Towels and bed linen are available in the apartment.

Staff at the apartment are available to provide advice at the 24-hour front desk.

Guests can relax in the garden at the property.

Arles Amphitheatre is 34 km from Roma Divine home cinéma et jardin, while Avignon Central Station is 43 km from the property. The nearest airport is Nimes-Ales-Camargue-Cevennes Airport, 9 km from the accommodation."
L'Ecluse - Clim - Parking - Central,9.0,23 reviews,43.83750700,4.36516840,https://www.booking.com/hotel/fr/appartement-nimes1.en-gb.html?aid=304142&label=gen173nr-1FCAEoggI46AdIM1gEaE2IAQGYAQm4AQrIAQXYAQHoAQH4AQOIAgGoAgO4AvSrn6oGwAIB0gIkNjdkNDQ4NGItYjFhNS00NjgxLTljMDItYmMwMmNiNzY1MjM02AIG4AIB&ucfs=1&arphpl=1&group_adults=2&req_adults=2&no_rooms=1&group_children=0&req_children=0&hpos=14&hapos=39&sr_order=bayesian_review_score&srpvid=45f87d7affc300ac&srepoch=1699206646&from_sustainable_property_sr=1&from=searchresults#hotelTmpl,"L'Ecluse - Clim - Parking - Central is situated in Nîmes, 13 km from Parc Expo Nîmes, 34 km from Arles Amphitheatre, and 43 km from Avignon Central Station. This property offers access to a balcony, free private parking and free WiFi.

The air-conditioned apartment consists of 1 bedroom, a living room, a fully equipped kitchen with an oven and a coffee machine, and 1 bathroom with a bath and a hair dryer. Towels and bed linen are available in the apartment.

Papal Palace is 45 km from the apartment, while Avignon TGV Train Station is 46 km from the property. The nearest airport is Nimes-Ales-Camargue-Cevennes Airport, 9 km from L'Ecluse - Clim - Parking - Central."
Appart charme Arenes Nimes,9.2,40 reviews,43.83167600,4.36020260,https://www.booking.com/hotel/fr/appart-charme-arenes-nimes.en-gb.html?aid=304142&label=gen173nr-1FCAEoggI46AdIM1gEaE2IAQGYAQm4AQrIAQXYAQHoAQH4AQOIAgGoAgO4AvSrn6oGwAIB0gIkNjdkNDQ4NGItYjFhNS00NjgxLTljMDItYmMwMmNiNzY1MjM02AIG4AIB&ucfs=1&arphpl=1&group_adults=2&req_adults=2&no_rooms=1&group_children=0&req_children=0&hpos=15&hapos=40&sr_order=bayesian_review_score&srpvid=45f87d7affc300ac&srepoch=1699206646&from=searchresults#hotelTmpl,"Offering free WiFi and garden views, Appart charme Arenes Nimes is accommodation located in Nîmes, just 1.6 km from Parc Expo Nîmes and 400 metres from Nimes Court House. The Nîmes Town Hall and the Nimes School of Fine Arts are within an 8-minute walk of the apartment. Free secure parking is available.

The apartment has 2 bedrooms with air conditioning and a fully equipped kitchen with a dishwasher. The apartment also provides a bathroom with a bath.

Carré d’Art Library is a 10-minute walk from Appart charme Arenes Nimes. Nimes-Ales-Camargue-Cevennes Airport is 9 km away."
Feel@Home Nemausus « Le 42 »,9.1,104 reviews,43.82936825,4.35786962,https://www.booking.com/hotel/fr/feel-home-nemausus-le-42.en-gb.html?aid=304142&label=gen173nr-1FCAEoggI46AdIM1gEaE2IAQGYAQm4AQrIAQXYAQHoAQH4AQOIAgGoAgO4AvSrn6oGwAIB0gIkNjdkNDQ4NGItYjFhNS00NjgxLTljMDItYmMwMmNiNzY1MjM02AIG4AIB&ucfs=1&arphpl=1&group_adults=2&req_adults=2&no_rooms=1&group_children=0&req_children=0&hpos=17&hapos=42&sr_order=bayesian_review_score&srpvid=45f87d7affc300ac&srepoch=1699206646&from=searchresults#hotelTmpl,"Set in Nîmes, 1.8 km from Parc Expo Nîmes and 33 km from Arles Amphitheatre, Feel@Home Nemausus « Le 42 » offers a garden and air conditioning. It is located 44 km from Avignon Central Station and offers a minimarket.

The apartment is fitted with 1 bedroom, 1 bathroom, bed linen, towels, a flat-screen TV with streaming services, a dining area, a fully equipped kitchen, and a terrace with garden views. Offering free private parking, this 3-star apartment also features free WiFithroughout the property.

Walking tours can be enjoyed nearby.

Papal Palace is 46 km from the apartment, while Zenith Sud Montpellier is 46 km from the property. The nearest airport is Nimes-Ales-Camargue-Cevennes Airport, 8 km from Feel@Home Nemausus « Le 42 »."
La place Zen - Free Wifi - City Center,8.8,67 reviews,43.83714700,4.36046130,https://www.booking.com/hotel/fr/la-place-zen-free-wifi-city-center.en-gb.html?aid=304142&label=gen173nr-1FCAEoggI46AdIM1gEaE2IAQGYAQm4AQrIAQXYAQHoAQH4AQOIAgGoAgO4AvSrn6oGwAIB0gIkNjdkNDQ4NGItYjFhNS00NjgxLTljMDItYmMwMmNiNzY1MjM02AIG4AIB&ucfs=1&arphpl=1&group_adults=2&req_adults=2&no_rooms=1&group_children=0&req_children=0&hpos=25&hapos=50&sr_order=bayesian_review_score&srpvid=45f87d7affc300ac&srepoch=1699206646&from=searchresults#hotelTmpl,"Situated in the centre of Nîmes, just 13 km from Parc Expo Nîmes and 34 km from Arles Amphitheatre, La place Zen - Free Wifi - City Center features accommodation with inner courtyard views and free WiFi. This apartment is 44 km from Avignon Central Station and 45 km from Papal Palace.

This apartment has 1 bedroom, a kitchen with microwave, a flat-screen TV, a seating area and 1 bathroom with a walk-in shower. Towels and bed linen are offered in the apartment.

Avignon TGV Train Station is 46 km from the apartment, while Zenith Sud Montpellier is 48 km from the property. The nearest airport is Nimes-Ales-Camargue-Cevennes Airport, 10 km from La place Zen - Free Wifi - City Center."
Spa Nimeslodge,8.8,20 reviews,43.81742735,4.30728994,https://www.booking.com/hotel/fr/nimeslodge.en-gb.html?aid=304142&label=gen173nr-1FCAEoggI46AdIM1gEaE2IAQGYAQm4AQrIAQXYAQHoAQH4AQOIAgGoAgO4AvSrn6oGwAIB0gIkNjdkNDQ4NGItYjFhNS00NjgxLTljMDItYmMwMmNiNzY1MjM02AIG4AIB&ucfs=1&arphpl=1&group_adults=2&req_adults=2&no_rooms=1&group_children=0&req_children=0&hpos=23&hapos=48&sr_order=bayesian_review_score&srpvid=45f87d7affc300ac&srepoch=1699206646&from_sustainable_property_sr=1&from=searchresults#hotelTmpl,"Situated 36 km from Arles Amphitheatre, Spa Nimeslodge features accommodation in Nîmes with access to a hot tub. The air-conditioned accommodation is 21 km from Parc Expo Nîmes, and guests benefit from private parking available on site and free WiFi.

The apartment features 1 bedroom, 1 bathroom, bed linen, towels, a flat-screen TV, a fully equipped kitchen, and a terrace with garden views.

Guests at the apartment can enjoy walking tours nearby, or make the most of the garden.

Zenith Sud Montpellier is 47 km from Spa Nimeslodge, while Odysseum Shopping Centre is 48 km from the property. The nearest airport is Nimes-Ales-Camargue-Cevennes Airport, 14 km from the accommodation."
Le Mas Des Cigales,9.1,62 reviews,43.84952355,4.32767231,https://www.booking.com/hotel/fr/le-mas-des-cigales-nimes.en-gb.html?aid=304142&label=gen173nr-1FCAEoggI46AdIM1gEaE2IAQGYAQm4AQrIAQXYAQHoAQH4AQOIAgGoAgO4AvSrn6oGwAIB0gIkNjdkNDQ4NGItYjFhNS00NjgxLTljMDItYmMwMmNiNzY1MjM02AIG4AIB&ucfs=1&arphpl=1&group_adults=2&req_adults=2&no_rooms=1&group_children=0&req_children=0&hpos=21&hapos=46&sr_order=bayesian_review_score&srpvid=45f87d7affc300ac&srepoch=1699206646&from_sustainable_property_sr=1&from=searchresults#hotelTmpl,"Offering pool views, Le Mas Des Cigales is an accommodation situated in Nîmes, 17 km from Parc Expo Nîmes and 36 km from Arles Amphitheatre. This property offers access to a terrace, free private parking and free WiFi.

The bed and breakfast features a flat-screen TV. Towels and bed linen are available in the bed and breakfast.

Guests at the bed and breakfast can enjoy a continental breakfast.

Le Mas Des Cigales offers a picnic area. Guests can swim in the pool with a view, go snorkelling or cycling or relax in the garden.

Avignon Central Station is 47 km from the accommodation, while Papal Palace is 49 km from the property. The nearest airport is Nimes-Ales-Camargue-Cevennes Airport, 13 km from Le Mas Des Cigales."
liste rouge,9.7,44 reviews,43.84730400,4.32921000,https://www.booking.com/hotel/fr/liste-rouge.en-gb.html?aid=304142&label=gen173nr-1FCAEoggI46AdIM1gEaE2IAQGYAQm4AQrIAQXYAQHoAQH4AQOIAgGoAgO4AvSrn6oGwAIB0gIkNjdkNDQ4NGItYjFhNS00NjgxLTljMDItYmMwMmNiNzY1MjM02AIG4AIB&ucfs=1&arphpl=1&group_adults=2&req_adults=2&no_rooms=1&group_children=0&req_children=0&hpos=20&hapos=45&sr_order=bayesian_review_score&srpvid=45f87d7affc300ac&srepoch=1699206646&from=searchresults#hotelTmpl,"Boasting an outdoor pool, liste rouge in Nîmes features accommodation with free WiFi and free private parking for guests who drive.

Guests at the homestay can enjoy a continental breakfast.

Liste rouge offers a terrace.

Guests can relax in the garden at the property.

Parc Expo Nîmes is 17 km from the accommodation, while Arles Amphitheatre is 36 km from the property. The nearest airport is Nimes-Ales-Camargue-Cevennes Airport, 13 km from liste rouge."
Chambres d'Hôtes Lovely Planette,9.6,50 reviews,43.85710100,4.34791500,https://www.booking.com/hotel/fr/lovely-planette-nimes.en-gb.html?aid=304142&label=gen173nr-1FCAEoggI46AdIM1gEaE2IAQGYAQm4AQrIAQXYAQHoAQH4AQOIAgGoAgO4AvSrn6oGwAIB0gIkNjdkNDQ4NGItYjFhNS00NjgxLTljMDItYmMwMmNiNzY1MjM02AIG4AIB&ucfs=1&arphpl=1&group_adults=2&req_adults=2&no_rooms=1&group_children=0&req_children=0&hpos=22&hapos=47&sr_order=bayesian_review_score&srpvid=45f87d7affc300ac&srepoch=1699206646&from_sustainable_property_sr=1&from=searchresults#hotelTmpl,"Situated just 5 km from Parc Expo Nîmes, Chambres d'Hôtes Lovely Planette features accommodation in Nîmes with access to a garden, swimming pool, a terrace, as well as a 24-hour front desk. It has garden views and free WiFi throughout the property.

The air-conditioned bed and breakfast consists of 1 separate bedroom, 1 bathroom with free toiletries and a hairdryer, and a living room. Towels and bed linen are available in the bed and breakfast.

Guests at the bed and breakfast can enjoy a continental breakfast.

If you would like to discover the area, hiking is possible in the surroundings.

Arles Amphitheatre is 36 km from Chambres d'Hôtes Lovely Planette, while Pont du Gard is 25 km from the property. The nearest airport is Nimes-Ales-Camargue-Cevennes Airport, 14 km from the accommodation."
