hotel_name,hotel_score,hotel_reviews,hotel_lat,hotel_lon,hotel_url,hotel_description
Rougetomette,9.7,109 reviews,43.83003691,4.36611269,https://www.booking.com/hotel/fr/rougetomette-nimes123.en-gb.html?aid=304142&label=gen173nr-1FCAEoggI46AdIM1gEaE2IAQGYAQm4AQrIAQXYAQHoAQH4AQOIAgGoAgO4Apewn6oGwAIB0gIkNjE1NGNkMGQtN2ViNS00MTgxLWEyZTgtMzAzYTM1NDhiNzky2AIG4AIB&ucfs=1&arphpl=1&group_adults=2&req_adults=2&no_rooms=1&group_children=0&req_children=0&hpos=15&hapos=15&sr_order=bayesian_review_score&srpvid=15857e8cb9840028&srepoch=1699207194&from_sustainable_property_sr=1&from=searchresults#hotelTmpl,"Located in Nîmes, 1.8 km from Parc Expo Nîmes and 33 km from Arles Amphitheatre, Rougetomette provides pool views and free WiFi.

A fridge and kettle are also provided.

A continental breakfast is available daily at the bed and breakfast.

Guests can also relax in the garden, beside the outdoor swimming pool, or on the sun terrace.

Avignon Central Station is 44 km from Rougetomette, while Papal Palace is 45 km away. The nearest airport is Nimes-Ales-Camargue-Cevennes Airport, 8 km from the accommodation."
Suite 6,9.9,34 reviews,43.83879740,4.36244450,https://www.booking.com/hotel/fr/suite-6.en-gb.html?aid=304142&label=gen173nr-1FCAEoggI46AdIM1gEaE2IAQGYAQm4AQrIAQXYAQHoAQH4AQOIAgGoAgO4Apewn6oGwAIB0gIkNjE1NGNkMGQtN2ViNS00MTgxLWEyZTgtMzAzYTM1NDhiNzky2AIG4AIB&ucfs=1&arphpl=1&group_adults=2&req_adults=2&no_rooms=1&group_children=0&req_children=0&hpos=25&hapos=25&sr_order=bayesian_review_score&srpvid=15857e8cb9840028&srepoch=1699207194&from=searchresults#hotelTmpl,"Attractively set in the centre of Nîmes, Suite 6 offers a terrace, air conditioning, free WiFi and flat-screen TV. This property offers access to a patio and free private parking.

The kitchenette features a microwave, a toaster and a fridge and there is walk-in shower with bathrobes and slippers.

A continental breakfast is available each morning at the bed and breakfast.

Parc Expo Nîmes is 13 km from Suite 6, while Arles Amphitheatre is 35 km from the property. The nearest airport is Nimes-Ales-Camargue-Cevennes Airport, 10 km from the accommodation."
entre arènes et maison carrée,,,43.83628985,4.35639625,https://www.booking.com/hotel/fr/entre-arenes-et-maison-carree.en-gb.html?aid=304142&label=gen173nr-1FCAEoggI46AdIM1gEaE2IAQGYAQm4AQrIAQXYAQHoAQH4AQOIAgGoAgO4Apewn6oGwAIB0gIkNjE1NGNkMGQtN2ViNS00MTgxLWEyZTgtMzAzYTM1NDhiNzky2AIG4AIB&ucfs=1&arphpl=1&group_adults=2&req_adults=2&no_rooms=1&group_children=0&req_children=0&hpos=23&hapos=23&sr_order=bayesian_review_score&srpvid=15857e8cb9840028&srepoch=1699207194&from=searchresults#hotelTmpl,"Entre arènes et maison carrée in Nîmes provides accommodation with free WiFi, 15 km from Parc Expo Nîmes, 34 km from Arles Amphitheatre and 45 km from Avignon Central Station. This holiday home is 47 km from Zenith Sud Montpellier and 48 km from Odysseum Shopping Centre.

This air-conditioned holiday home comes with a seating area, a kitchen with a dishwasher, and a flat-screen TV. Towels and bed linen are provided in the holiday home.

Papal Palace is 46 km from the holiday home, while Avignon TGV Train Station is 47 km away. The nearest airport is Nimes-Ales-Camargue-Cevennes Airport, 9 km from entre arènes et maison carrée."
Feel@Home Nemausus « Le 21 »,9.5,96 reviews,43.82936675,4.35789713,https://www.booking.com/hotel/fr/feel-home-nemausus-le-21.en-gb.html?aid=304142&label=gen173nr-1FCAEoggI46AdIM1gEaE2IAQGYAQm4AQrIAQXYAQHoAQH4AQOIAgGoAgO4Apewn6oGwAIB0gIkNjE1NGNkMGQtN2ViNS00MTgxLWEyZTgtMzAzYTM1NDhiNzky2AIG4AIB&ucfs=1&arphpl=1&group_adults=2&req_adults=2&no_rooms=1&group_children=0&req_children=0&hpos=22&hapos=22&sr_order=bayesian_review_score&srpvid=15857e8cb9840028&srepoch=1699207194&from_sustainable_property_sr=1&from=searchresults#hotelTmpl,"Located in Nîmes, 1.8 km from Parc Expo Nîmes and 33 km from Arles Amphitheatre, Feel@Home Nemausus « Le 21 » offers air conditioning. This apartment provides free private parking and a lift.

The apartment features 1 bedroom, a flat-screen TV with streaming services, an equipped kitchen with a dishwasher and a microwave, a washing machine, and 1 bathroom with a walk-in shower. Towels and bed linen are provided in the apartment.

Avignon Central Station is 44 km from the apartment, while Papal Palace is 46 km away. The nearest airport is Nimes-Ales-Camargue-Cevennes Airport, 8 km from Feel@Home Nemausus « Le 21 »."
Mas d'Escattes,9.7,204 reviews,43.87046900,4.40491000,https://www.booking.com/hotel/fr/mas-d-39-escattes.en-gb.html?aid=304142&label=gen173nr-1FCAEoggI46AdIM1gEaE2IAQGYAQm4AQrIAQXYAQHoAQH4AQOIAgGoAgO4Apewn6oGwAIB0gIkNjE1NGNkMGQtN2ViNS00MTgxLWEyZTgtMzAzYTM1NDhiNzky2AIG4AIB&ucfs=1&arphpl=1&group_adults=2&req_adults=2&no_rooms=1&group_children=0&req_children=0&hpos=21&hapos=21&sr_order=bayesian_review_score&srpvid=15857e8cb9840028&srepoch=1699207194&from=searchresults#hotelTmpl,"Located in Nîmes in the Languedoc-Roussillon region and Parc Expo Nîmes reachable within 10 km, Mas d'Escattes provides accommodation with free WiFi, barbecue facilities, an outdoor swimming pool and free private parking.

There is also a kitchen in some of the units equipped with a dishwasher.

Guests at the bed and breakfast can enjoy a continental breakfast.

Mas d'Escattes features a garden and sun terrace, which can be enjoyed by guests if the weather permits.

Avignon Central Station is 40 km from the accommodation, while Papal Palace is 42 km away. The nearest airport is Nimes-Ales-Camargue-Cevennes Airport, 15 km from Mas d'Escattes."
Atipyc Nimes,9.3,76 reviews,43.83564540,4.35951840,https://www.booking.com/hotel/fr/le-145.en-gb.html?aid=304142&label=gen173nr-1FCAEoggI46AdIM1gEaE2IAQGYAQm4AQrIAQXYAQHoAQH4AQOIAgGoAgO4Apewn6oGwAIB0gIkNjE1NGNkMGQtN2ViNS00MTgxLWEyZTgtMzAzYTM1NDhiNzky2AIG4AIB&ucfs=1&arphpl=1&group_adults=2&req_adults=2&no_rooms=1&group_children=0&req_children=0&hpos=20&hapos=20&sr_order=bayesian_review_score&srpvid=15857e8cb9840028&srepoch=1699207194&from=searchresults#hotelTmpl,"Located in the centre of Nîmes, 14 km from Parc Expo Nîmes and 33 km from Arles Amphitheatre, Atipyc Nimes offers free WiFi, a spa and wellness centre and air conditioning. The property has city and quiet street views, and is 45 km from Avignon Central Station.

The apartment features 1 bedroom, a flat-screen TV with satellite channels, an equipped kitchen with a dishwasher and a microwave, and 1 bathroom with a walk-in shower. Towels and bed linen are featured in the apartment.

The apartment offers a hot tub.

Papal Palace is 46 km from Atipyc Nimes, while Avignon TGV Train Station is 47 km away. The nearest airport is Nimes-Ales-Camargue-Cevennes Airport, 9 km from the accommodation."
"Nimes , appartement rénové dans immeuble classé.",9.0,58 reviews,43.84000420,4.36231400,https://www.booking.com/hotel/fr/nimes-appartement-renove-dans-immeuble-classe.en-gb.html?aid=304142&label=gen173nr-1FCAEoggI46AdIM1gEaE2IAQGYAQm4AQrIAQXYAQHoAQH4AQOIAgGoAgO4Apewn6oGwAIB0gIkNjE1NGNkMGQtN2ViNS00MTgxLWEyZTgtMzAzYTM1NDhiNzky2AIG4AIB&ucfs=1&arphpl=1&group_adults=2&req_adults=2&no_rooms=1&group_children=0&req_children=0&hpos=24&hapos=24&sr_order=bayesian_review_score&srpvid=15857e8cb9840028&srepoch=1699207194&from=searchresults#hotelTmpl,"Located in the centre of Nîmes, just 13 km from Parc Expo Nîmes and 34 km from Arles Amphitheatre, Nimes, appartement rénové dans immeuble classé. Provides accommodation with city views and free WiFi. This apartment features accommodation with a terrace.

This apartment comes with 2 bedrooms, a kitchen with a dishwasher and an oven, a flat-screen TV, a seating area and 1 bathroom equipped with a bath. Towels and bed linen are featured in the apartment.

Avignon Central Station is 44 km from the apartment, while Papal Palace is 45 km away. The nearest airport is Nimes-Ales-Camargue-Cevennes Airport, 10 km from Nimes, appartement rénové dans immeuble classé.."
Nîmes en Garrigues,9.0,65 reviews,43.86227800,4.35544200,https://www.booking.com/hotel/fr/nimes-en-garrigues.en-gb.html?aid=304142&label=gen173nr-1FCAEoggI46AdIM1gEaE2IAQGYAQm4AQrIAQXYAQHoAQH4AQOIAgGoAgO4Apewn6oGwAIB0gIkNjE1NGNkMGQtN2ViNS00MTgxLWEyZTgtMzAzYTM1NDhiNzky2AIG4AIB&ucfs=1&arphpl=1&group_adults=2&req_adults=2&no_rooms=1&group_children=0&req_children=0&hpos=19&hapos=19&sr_order=bayesian_review_score&srpvid=15857e8cb9840028&srepoch=1699207194&from_sustainable_property_sr=1&from=searchresults#hotelTmpl,"Boasting a garden, a seasonal outdoor pool and garden views, Nîmes en Garrigues is set in Nîmes. This property offers access to a terrace and free private parking.

The bed and breakfast consists of 1 bedroom, a living room, a fully equipped kitchenette with a microwave and a coffee machine, and 1 bathroom with a shower and a hair dryer. Towels and bed linen are offered in the bed and breakfast.

A outdoor play equipment is also available for guests at the bed and breakfast.

Parc Expo Nîmes is 15 km from Nîmes en Garrigues, while Arles Amphitheatre is 37 km from the property. The nearest airport is Nimes-Ales-Camargue-Cevennes, 12 km from the accommodation, and the property offers a paid airport shuttle service."
Maison d'hotes - chambre-kitchenette-salle de bain-espace extèrieur,9.6,49 reviews,43.86102590,4.37283380,https://www.booking.com/hotel/fr/maison-d-hotes-chambre-kitchenette-salle-de-bain-espace-exterieur.en-gb.html?aid=304142&label=gen173nr-1FCAEoggI46AdIM1gEaE2IAQGYAQm4AQrIAQXYAQHoAQH4AQOIAgGoAgO4Apewn6oGwAIB0gIkNjE1NGNkMGQtN2ViNS00MTgxLWEyZTgtMzAzYTM1NDhiNzky2AIG4AIB&ucfs=1&arphpl=1&group_adults=2&req_adults=2&no_rooms=1&group_children=0&req_children=0&hpos=18&hapos=18&sr_order=bayesian_review_score&srpvid=15857e8cb9840028&srepoch=1699207194&from=searchresults#hotelTmpl,"Boasting barbecue facilities, Maison d'hotes - chambre-kitchenette-salle de bain-espace extèrieur is situated in Nîmes in the Languedoc-Roussillon region, 14 km from Parc Expo Nîmes and 37 km from Arles Amphitheatre. The property is around 44 km from Avignon Central Station, 46 km from Papal Palace and 47 km from Avignon TGV Train Station. The rooms are equipped with a terrace with views of the inner courtyard.

All rooms are fitted with air conditioning, a flat-screen TV with streaming services, a microwave, a coffee machine, a shower, a hair dryer and a outdoor furniture. With a private bathroom, rooms at the guest house also feature free WiFi. At Maison d'hotes - chambre-kitchenette-salle de bain-espace extèrieur the rooms include bed linen and towels.

The nearest airport is Nimes-Ales-Camargue-Cevennes Airport, 12 km from the accommodation."
Feel@Home Nemausus « Le 4 »,9.3,109 reviews,43.83881520,4.36241362,https://www.booking.com/hotel/fr/feel-home-nemausus-le-4.en-gb.html?aid=304142&label=gen173nr-1FCAEoggI46AdIM1gEaE2IAQGYAQm4AQrIAQXYAQHoAQH4AQOIAgGoAgO4Apewn6oGwAIB0gIkNjE1NGNkMGQtN2ViNS00MTgxLWEyZTgtMzAzYTM1NDhiNzky2AIG4AIB&ucfs=1&arphpl=1&group_adults=2&req_adults=2&no_rooms=1&group_children=0&req_children=0&hpos=16&hapos=16&sr_order=bayesian_review_score&srpvid=15857e8cb9840028&srepoch=1699207194&from=searchresults#hotelTmpl,"Situated right in the heart of Nîmes, 13 km from Parc Expo Nîmes and 35 km from Arles Amphitheatre, Feel@Home Nemausus « Le 4 » features air-conditioned accommodation with a patio and free WiFi. The 3-star apartment features quiet street views and is 43 km from Avignon Central Station.

The apartment with a terrace and inner courtyard views has 1 bedroom, a living room, a flat-screen TV, an equipped kitchen with a dishwasher and an oven, and 1 bathroom with a walk-in shower. Towels and bed linen are available in the apartment.

Hiking and walking tours can be enjoyed nearby.

Papal Palace is 45 km from the apartment, while Avignon TGV Train Station is 46 km from the property. The nearest airport is Nimes-Ales-Camargue-Cevennes, 10 km from Feel@Home Nemausus « Le 4 », and the property offers a paid airport shuttle service."
