hotel_name,hotel_score,hotel_reviews,hotel_lat,hotel_lon,hotel_url,hotel_description
Mas des Rièges & Spa,8.8,91 reviews,43.46150341,4.42932761,https://www.booking.com/hotel/fr/mas-des-rieges-amp-spa.en-gb.html?aid=304142&label=gen173nr-1FCAEoggI46AdIM1gEaE2IAQGYAQm4AQrIAQXYAQHoAQH4AQOIAgGoAgO4Aravn6oGwAIB0gIkMjllM2ExYTQtNWUwNi00NjU5LWExODItZmVhNzY4ZGViYTgy2AIG4AIB&ucfs=1&arphpl=1&group_adults=2&req_adults=2&no_rooms=1&group_children=0&req_children=0&hpos=15&hapos=40&sr_order=bayesian_review_score&srpvid=2f2d7e5b43340d72&srepoch=1699207096&from=searchresults#hotelTmpl,"Set in Saintes-Maries-de-la-Mer, 1.4 km from Amphora Beach, Mas des Rièges & Spa offers accommodation with an outdoor swimming pool, free private parking, a garden and a terrace. The property is situated 1.5 km from Est Beach, 1.6 km from Arenas Beach and 39 km from Arles Amphitheatre. The accommodation features room service and free WiFi throughout the property.

At the hotel, the rooms come with a patio with pool view. Complete with a private bathroom fitted with a shower, all guest rooms at Mas des Rièges & Spa have a flat-screen TV and air conditioning, and some rooms also feature a seating area. All rooms will provide guests with a fridge.

Guests at the accommodation can enjoy a continental breakfast.

The area is popular for cycling, and bike hire is available at Mas des Rièges & Spa.

The nearest airport is Nimes-Ales-Camargue-Cevennes Airport, 41 km from the hotel."
Hôtel Les Arcades,8.6,472 reviews,43.45262780,4.43076655,https://www.booking.com/hotel/fr/ha-tel-les-arcades.en-gb.html?aid=304142&label=gen173nr-1FCAEoggI46AdIM1gEaE2IAQGYAQm4AQrIAQXYAQHoAQH4AQOIAgGoAgO4Aravn6oGwAIB0gIkMjllM2ExYTQtNWUwNi00NjU5LWExODItZmVhNzY4ZGViYTgy2AIG4AIB&ucfs=1&arphpl=1&group_adults=2&req_adults=2&no_rooms=1&group_children=0&req_children=0&hpos=25&hapos=50&sr_order=bayesian_review_score&srpvid=2f2d7e5b43340d72&srepoch=1699207096&from=searchresults#hotelTmpl,"Just 100 metres from the nearest beach and 400 metres from the church in Saintes-Maries-de-la-Mer, this 3-star hotel offers free WiFi access throughout the property. It is 35-minute drive from Arles and a thalassotherapy centre can be found nearby.

The rooms at Hôtel Les Arcades feature an LCD TV with cable cahnnels such as Canal+, Canal+ Sport, RAI1 and RTL, a work desk and a mosquito net. Some rooms are air-conditioned and all have a private bathroom with free toiletries and a hairdryer.

The buffet breakfast is served every morning in the breakfast room. You can also enjoy one of the bar’s selection of soft drinks on the terrace.

Le Grau-du-Roi is a 45-minute drive from Les Arcades and Nîmes is 45 km away. Guests can explore the coastline and the Camargue Natural Regional Park. Free public parking is available 50 metres from the property and there is a space in front of the hotel where guests can park to unload their car."
Manade des Baumelles,8.5,319 reviews,43.51731484,4.36732963,https://www.booking.com/hotel/fr/manade-des-baumelles.en-gb.html?aid=304142&label=gen173nr-1FCAEoggI46AdIM1gEaE2IAQGYAQm4AQrIAQXYAQHoAQH4AQOIAgGoAgO4Aravn6oGwAIB0gIkMjllM2ExYTQtNWUwNi00NjU5LWExODItZmVhNzY4ZGViYTgy2AIG4AIB&ucfs=1&arphpl=1&group_adults=2&req_adults=2&no_rooms=1&group_children=0&req_children=0&hpos=24&hapos=49&sr_order=bayesian_review_score&srpvid=2f2d7e5b43340d72&srepoch=1699207096&from=searchresults#hotelTmpl,"Featuring free WiFi throughout the property, Manade des baumelles is located in Saintes-Maries-de-la-Mer, 9 km from Eglise des Stes Maries and 9 k from the nearest beach. Guests can enjoy the on-site restaurant. Free private parking is available on site.

Each room at this bed and breakfast is air conditioned and is equipped with a flat-screen TV. Some units include a seating area for your convenience. The rooms include a private bathroom. Superior rooms have a spa bath or a hot tub.

There is a gift shop at the property.

A number of activities are offered in the area, such as horse riding and cycling. Nimes-Ales-Camargue-Cevennes Airport is 27 km away."
Mas Sublime,6.9,12 reviews,43.54987781,4.40111799,https://www.booking.com/hotel/fr/mas-sublime.en-gb.html?aid=304142&label=gen173nr-1FCAEoggI46AdIM1gEaE2IAQGYAQm4AQrIAQXYAQHoAQH4AQOIAgGoAgO4Aravn6oGwAIB0gIkMjllM2ExYTQtNWUwNi00NjU5LWExODItZmVhNzY4ZGViYTgy2AIG4AIB&ucfs=1&arphpl=1&group_adults=2&req_adults=2&no_rooms=1&group_children=0&req_children=0&hpos=22&hapos=47&sr_order=bayesian_review_score&srpvid=2f2d7e5b43340d72&srepoch=1699207096&from=searchresults#hotelTmpl,"Mas Sublime, a property with a garden, is situated in Saintes-Maries-de-la-Mer, 43 km from Montpellier Arena, 44 km from Parc des Expositions de Montpellier, as well as 48 km from Zenith Sud Montpellier. It is located 28 km from Arles Amphitheatre and provides free WiFi and free private parking.

The holiday home with a terrace and garden views features 4 bedrooms, a living room, a flat-screen TV, an equipped kitchen with a dishwasher and an oven, and 2 bathrooms with a bath. Towels and bed linen are provided in the holiday home.

Odysseum Shopping Centre is 48 km from the holiday home, while Montpellier Town Hall is 49 km away. The nearest airport is Nimes-Ales-Camargue-Cevennes Airport, 29 km from Mas Sublime."
Les Saintes au bord de mer,8.2,12 reviews,43.45119620,4.43050690,https://www.booking.com/hotel/fr/alvica-triana.en-gb.html?aid=304142&label=gen173nr-1FCAEoggI46AdIM1gEaE2IAQGYAQm4AQrIAQXYAQHoAQH4AQOIAgGoAgO4Aravn6oGwAIB0gIkMjllM2ExYTQtNWUwNi00NjU5LWExODItZmVhNzY4ZGViYTgy2AIG4AIB&ucfs=1&arphpl=1&group_adults=2&req_adults=2&no_rooms=1&group_children=0&req_children=0&hpos=23&hapos=48&sr_order=bayesian_review_score&srpvid=2f2d7e5b43340d72&srepoch=1699207096&from=searchresults#hotelTmpl,"Situated in Saintes-Maries-de-la-Mer, 200 metres from Amphora Beach and 400 metres from Arenas Beach, Les Saintes au bord de mer offers air conditioning. This beachfront property offers access to a balcony and free WiFi.

The apartment with a terrace and sea views has 1 bedroom, a living room, a flat-screen TV, an equipped kitchen with a dishwasher and an oven, and 1 bathroom with an a bath or shower. Towels and bed linen are available in the apartment.

A bicycle rental service is available at the apartment.

Crin Blanc Beach is less than 1 km from Les Saintes au bord de mer, while Arles Amphitheatre is 39 km from the property. The nearest airport is Nimes-Ales-Camargue-Cevennes Airport, 41 km from the accommodation."
Mas de la Fouque - Hôtel & Spa,7.7,235 reviews,43.46708060,4.40451175,https://www.booking.com/hotel/fr/lodge-de-la-fouque.en-gb.html?aid=304142&label=gen173nr-1FCAEoggI46AdIM1gEaE2IAQGYAQm4AQrIAQXYAQHoAQH4AQOIAgGoAgO4Aravn6oGwAIB0gIkMjllM2ExYTQtNWUwNi00NjU5LWExODItZmVhNzY4ZGViYTgy2AIG4AIB&ucfs=1&arphpl=1&group_adults=2&req_adults=2&no_rooms=1&group_children=0&req_children=0&hpos=21&hapos=46&sr_order=bayesian_review_score&srpvid=2f2d7e5b43340d72&srepoch=1699207096&from_sustainable_property_sr=1&from=searchresults#hotelTmpl,"Mas de la Fouque boutique-hotel is located at the heart of the Camargue Nature Reserve just 10 minutes' drive from Saintes-Maries-de-la-Mer and 2 km from the beaches. It offers an outdoor swimming pool and an on-site bar.

Each air-conditioned room and suite is uniquely decorated. Some have a private terrace facing the lagoons or swimming pool.  They are equipped with satellite TV. Free WiFi internet access in available throughout the property.

Guests can view local wild life such as flamingos, Camargue horses and wild bulls whilst enjoying a drink on the outdoor lounges. The on-site Nuxe spa proposes a sauna, outdoor relaxing bath and an indoor pool

The restaurant serves organic, natural cuisine and guests can dine al fresco or by the fireplace in winter. A buffet breakfast is served daily.

Free private parking is available on site. Nimes Train Station is 40 minutes from Mas de la Fouque and Montpellier-Mediterranee Airport is 35 km away."
Le mas des mourguettes,8.8,81 reviews,43.51820734,4.37478617,https://www.booking.com/hotel/fr/le-mas-des-mourguettes.en-gb.html?aid=304142&label=gen173nr-1FCAEoggI46AdIM1gEaE2IAQGYAQm4AQrIAQXYAQHoAQH4AQOIAgGoAgO4Aravn6oGwAIB0gIkMjllM2ExYTQtNWUwNi00NjU5LWExODItZmVhNzY4ZGViYTgy2AIG4AIB&ucfs=1&arphpl=1&group_adults=2&req_adults=2&no_rooms=1&group_children=0&req_children=0&hpos=20&hapos=45&sr_order=bayesian_review_score&srpvid=2f2d7e5b43340d72&srepoch=1699207096&from=searchresults#hotelTmpl,"Featuring air-conditioned accommodation with a pool with a view, inner courtyard view and a patio, Le mas des mourguettes is located in Saintes-Maries-de-la-Mer. It is set 35 km from Arles Amphitheatre and provides full-day security.

The holiday home with a terrace and garden views features 1 bedroom, a living room, a flat-screen TV, an equipped kitchenette with a dishwasher and an oven, and 1 bathroom with a walk-in shower. Providing free private parking, this 1-star holiday home also features free WiFithroughout the property.

The holiday home offers a picnic area. If you would like to discover the area, snorkelling, cycling and walking tours are possible in the surroundings and Le mas des mourguettes can arrange a car rental service.

Montpellier Arena is 43 km from the accommodation, while Parc des Expositions de Montpellier is 43 km away. The nearest airport is Nimes-Ales-Camargue-Cevennes Airport, 36 km from Le mas des mourguettes."
Les Vagues,8.7,309 reviews,43.45035200,4.42504700,https://www.booking.com/hotel/fr/les-vagues-saintes-maries-de-la-mer.en-gb.html?aid=304142&label=gen173nr-1FCAEoggI46AdIM1gEaE2IAQGYAQm4AQrIAQXYAQHoAQH4AQOIAgGoAgO4Aravn6oGwAIB0gIkMjllM2ExYTQtNWUwNi00NjU5LWExODItZmVhNzY4ZGViYTgy2AIG4AIB&ucfs=1&arphpl=1&group_adults=2&req_adults=2&no_rooms=1&group_children=0&req_children=0&hpos=19&hapos=44&sr_order=bayesian_review_score&srpvid=2f2d7e5b43340d72&srepoch=1699207096&from_sustainable_property_sr=1&from=searchresults#hotelTmpl,"Featuring a restaurant, bar and views of sea, Les Vagues is located in Saintes-Maries-de-la-Mer, 300 metres from Arenas Beach. The property is around 400 metres from Crin Blanc Beach, 500 metres from Amphora Beach and 39 km from Arles Amphitheatre. Guests can have a drink at the snack bar.

Complete with a private bathroom equipped with a bath or shower and free toiletries, all units at the hotel have a flat-screen TV and air conditioning, and some rooms will provide you with a terrace. All rooms will provide guests with a wardrobe and a kettle.

Guests at Les Vagues can enjoy a continental breakfast.

Activities such as hiking, snorkelling, cycling can be enjoyed in the surroundings, and guests can relax along the beachfront.

The nearest airport is Nimes-Ales-Camargue-Cevennes Airport, 41 km from the accommodation."
Le Mas des Trémaïé,8.7,81 reviews,43.47224404,4.40981451,https://www.booking.com/hotel/fr/le-mas-des-tremaie.en-gb.html?aid=304142&label=gen173nr-1FCAEoggI46AdIM1gEaE2IAQGYAQm4AQrIAQXYAQHoAQH4AQOIAgGoAgO4Aravn6oGwAIB0gIkMjllM2ExYTQtNWUwNi00NjU5LWExODItZmVhNzY4ZGViYTgy2AIG4AIB&ucfs=1&arphpl=1&group_adults=2&req_adults=2&no_rooms=1&group_children=0&req_children=0&hpos=18&hapos=43&sr_order=bayesian_review_score&srpvid=2f2d7e5b43340d72&srepoch=1699207096&from=searchresults#hotelTmpl,"Located in Saintes-Maries-de-la-Mer, within 38 km of Arles Amphitheatre, Le Mas des Trémaïé offers accommodation with air conditioning. This property offers access to a terrace and free private parking.

The 2-bedroom holiday home comes with a living room with a flat-screen TV with satellite channels, a fully equipped kitchen with oven and microwave, and 1 bathroom with a hair dryer.

The holiday home offers a barbecue.

The nearest airport is Nimes-Ales-Camargue-Cevennes Airport, 40 km from Le Mas des Trémaïé."
Mas de charme Les Pellegrins,9.2,45 reviews,43.48681127,4.40356759,https://www.booking.com/hotel/fr/mas-de-charme-les-pellegrins.en-gb.html?aid=304142&label=gen173nr-1FCAEoggI46AdIM1gEaE2IAQGYAQm4AQrIAQXYAQHoAQH4AQOIAgGoAgO4Aravn6oGwAIB0gIkMjllM2ExYTQtNWUwNi00NjU5LWExODItZmVhNzY4ZGViYTgy2AIG4AIB&ucfs=1&arphpl=1&group_adults=2&req_adults=2&no_rooms=1&group_children=0&req_children=0&hpos=17&hapos=42&sr_order=bayesian_review_score&srpvid=2f2d7e5b43340d72&srepoch=1699207096&from=searchresults#hotelTmpl,"Located in Saintes-Maries-de-la-Mer, Mas de charme Les Pellegrins provides a saltwater pool. The air-conditioned accommodation is 35 km from Arles Amphitheatre, and guests benefit from private parking available on site and free WiFi.

The holiday home with a terrace and garden views features 3 bedrooms, a living room, a flat-screen TV, an equipped kitchen with a dishwasher and an oven, and 1 bathroom with a walk-in shower.

The holiday home offers a children's playground. Guests at Mas de charme Les Pellegrins can enjoy table tennis on site, or go cycling or hiking in the surroundings.

Montpellier Arena is 48 km from the accommodation, while Parc des Expositions de Montpellier is 48 km away. The nearest airport is Nimes-Ales-Camargue-Cevennes Airport, 37 km from Mas de charme Les Pellegrins."
