hotel_name,hotel_score,hotel_reviews,hotel_lat,hotel_lon,hotel_url,hotel_description
Manoir Du Cunningham,8.7,548 reviews,48.63633317,-2.02055365,https://www.booking.com/hotel/fr/manoir-du-cunningham.en-gb.html?aid=304142&label=gen173nr-1FCAEoggI46AdIM1gEaE2IAQGYAQm4AQrIAQXYAQHoAQH4AQOIAgGoAgO4AqSwn6oGwAIB0gIkZTJiOTM0OGMtMWJiZS00NzgxLTk2MWUtYzNmYWYyMmQ2OTAy2AIG4AIB&ucfs=1&arphpl=1&group_adults=2&req_adults=2&no_rooms=1&group_children=0&req_children=0&hpos=25&hapos=50&sr_order=bayesian_review_score&srpvid=70b87e92777300d8&srepoch=1699207206&from_sustainable_property_sr=1&from=searchresults#hotelTmpl,"The 17th-century Manoir Du Cunningham is located on the seafront, just a 10-minute walk from the Old Town in Saint-Malo. It offers rooms and suites with flat-screen TV and radio.

The guest rooms are spacious and include free Wi-Fi internet access. Most guest rooms at the Cunningham have a private terrace or balcony overlooking the marina and the Ile de Cezembre.

Guests can visit Saint-Malo’s main attractions including the walled city and the Château Saint-Malo. The hotel is 1 km from the Saint-Malo ferry terminal, with direct links to the nearby islands and England."
Les Îles Vagabondes,9.2,23 reviews,48.65517670,-1.98094650,https://www.booking.com/hotel/fr/les-iles-vagabondes.en-gb.html?aid=304142&label=gen173nr-1FCAEoggI46AdIM1gEaE2IAQGYAQm4AQrIAQXYAQHoAQH4AQOIAgGoAgO4AqSwn6oGwAIB0gIkZTJiOTM0OGMtMWJiZS00NzgxLTk2MWUtYzNmYWYyMmQ2OTAy2AIG4AIB&ucfs=1&arphpl=1&group_adults=2&req_adults=2&no_rooms=1&group_children=0&req_children=0&hpos=20&hapos=45&sr_order=bayesian_review_score&srpvid=70b87e92777300d8&srepoch=1699207206&from_sustainable_property_sr=1&from=searchresults#hotelTmpl,"Les Îles Vagabondes features garden views, free WiFi and free private parking, set in Saint Malo, 1.3 km from Sillon Beach.

There is a private bathroom with walk-in shower and a hair dryer in each unit, along with free toiletries.

Continental and gluten-free breakfast options are available every morning at the bed and breakfast.

At Les Îles Vagabondes guests are welcome to take advantage of wellness packages.

A a baby safety gate is also available at the accommodation, while guests can also relax on the sun terrace.

Rochebonne Beach is 1.3 km from Les Îles Vagabondes, while Minihic Beach is 1.8 km away. The nearest airport is Jersey Airport, 74 km from the bed and breakfast."
Résidence MALO'INN - au cœur de Saint Malo,8.8,63 reviews,48.64860270,-2.00769040,https://www.booking.com/hotel/fr/residence-malo-inn-saint-malo.en-gb.html?aid=304142&label=gen173nr-1FCAEoggI46AdIM1gEaE2IAQGYAQm4AQrIAQXYAQHoAQH4AQOIAgGoAgO4AqSwn6oGwAIB0gIkZTJiOTM0OGMtMWJiZS00NzgxLTk2MWUtYzNmYWYyMmQ2OTAy2AIG4AIB&ucfs=1&arphpl=1&group_adults=2&req_adults=2&no_rooms=1&group_children=0&req_children=0&hpos=21&hapos=46&sr_order=bayesian_review_score&srpvid=70b87e92777300d8&srepoch=1699207206&from=searchresults#hotelTmpl,"Résidence MALO'INN - au cœur de Saint Malo offers accommodation set in Saint Malo, 1.3 km from Palais du Grand Large and 1.4 km from Casino Barrière Saint-Malo. Complimentary WiFi is availablethroughout the property.

The accommodation comes with a TV and a private bathroom with shower and a hair dryer, while the kitchen features a dishwasher, an oven and a microwave. A toaster, a fridge and kitchenware are also featured, as well as a coffee machine and a kettle.

Popular points of interest near the apartment include Sillon Beach, Eventail Beach and Bas-Sablons Beach. The nearest airport is Jersey Airport, 72 km from Résidence MALO'INN - au cœur de Saint Malo."
T2 terrasse de charme à Rochebonne 400 m plage,9.4,51 reviews,48.66041823,-1.98692877,https://www.booking.com/hotel/fr/t2-de-charme-a-rochebonne.en-gb.html?aid=304142&label=gen173nr-1FCAEoggI46AdIM1gEaE2IAQGYAQm4AQrIAQXYAQHoAQH4AQOIAgGoAgO4AqSwn6oGwAIB0gIkZTJiOTM0OGMtMWJiZS00NzgxLTk2MWUtYzNmYWYyMmQ2OTAy2AIG4AIB&ucfs=1&arphpl=1&group_adults=2&req_adults=2&no_rooms=1&group_children=0&req_children=0&hpos=22&hapos=47&sr_order=bayesian_review_score&srpvid=70b87e92777300d8&srepoch=1699207206&from_sustainable_property_sr=1&from=searchresults#hotelTmpl,"In the Parame district of Saint Malo, close to Rochebonne Beach, T2 terrasse de charme à Rochebonne 400 m plage features free bikes, free WiFi and a washing machine. With city views, this accommodation features a balcony.

The apartment with a terrace and garden views has 1 bedroom, a living room, a flat-screen TV, an equipped kitchen with a dishwasher and an oven, and 1 bathroom with a shower. Towels and bed linen are available in the apartment.

Guests can relax in the garden at the property.

Sillon Beach is 600 metres from the apartment, while Minihic Beach is 1 km from the property. The nearest airport is Jersey Airport, 75 km from T2 terrasse de charme à Rochebonne 400 m plage."
Les Charmettes,8.7,"1,146 reviews",48.65902139,-1.99601144,https://www.booking.com/hotel/fr/les-charmettes.en-gb.html?aid=304142&label=gen173nr-1FCAEoggI46AdIM1gEaE2IAQGYAQm4AQrIAQXYAQHoAQH4AQOIAgGoAgO4AqSwn6oGwAIB0gIkZTJiOTM0OGMtMWJiZS00NzgxLTk2MWUtYzNmYWYyMmQ2OTAy2AIG4AIB&ucfs=1&arphpl=1&group_adults=2&req_adults=2&no_rooms=1&group_children=0&req_children=0&hpos=24&hapos=49&sr_order=bayesian_review_score&srpvid=70b87e92777300d8&srepoch=1699207206&from_sustainable_property_sr=1&from=searchresults#hotelTmpl,"Les Charmettes, on the seafront in the Brittany town of Saint-Malo, offers direct beach access and a guests can sample a drink at the beach bar. Each guest room has a private bathroom, flat-screen TV and free Wi-Fi.

All seaside room feature a balcony, while other rooms look onto the courtyard. All rooms come with a nautical theme.

The hotel Les Charmettes serves a continental breakfast, which can be enjoyed in the dining room or in the comfort of your room. The on-site restaurant serves traditional meals including seafood platters. Guests can also relax on the hotel terrace, overlooking the sea.

The Sillon beach is situated directly in front of the hotel and the Saint Malo Train Station is 2 km away. Guests can reach Saint-Malo city centre within 30 minutes by walk."
Le Paraméen - Appartement pour 6,9.1,12 reviews,48.65553410,-1.98189340,https://www.booking.com/hotel/fr/le-parameen-appartement-pour-6.en-gb.html?aid=304142&label=gen173nr-1FCAEoggI46AdIM1gEaE2IAQGYAQm4AQrIAQXYAQHoAQH4AQOIAgGoAgO4AqSwn6oGwAIB0gIkZTJiOTM0OGMtMWJiZS00NzgxLTk2MWUtYzNmYWYyMmQ2OTAy2AIG4AIB&ucfs=1&arphpl=1&group_adults=2&req_adults=2&no_rooms=1&group_children=0&req_children=0&hpos=19&hapos=44&sr_order=bayesian_review_score&srpvid=70b87e92777300d8&srepoch=1699207206&from=searchresults#hotelTmpl,"Le Paraméen - Appartement pour 6 is set in the Parame district of Saint Malo, 1.3 km from Rochebonne Beach, 1.7 km from Minihic Beach and 3.2 km from Palais du Grand Large. The accommodation is 1.3 km from the Sillon Beach and features free WiFithroughout the property.

The 2-bedroom apartment is fitted with a living room with a TV, a fully equipped kitchen with dishwasher and oven, and 1 bathroom with a hair dryer. Towels and bed linen are featured in the apartment.

Casino Barrière Saint-Malo is 3.3 km from the apartment, while National Fort is 3.5 km away. The nearest airport is Dinard–Pleurtuit–Saint-Malo Airport, 14 km from Le Paraméen - Appartement pour 6."
LITTLE BAHIA,8.2,98 reviews,48.64263610,-2.00835070,https://www.booking.com/hotel/fr/little-bahia.en-gb.html?aid=304142&label=gen173nr-1FCAEoggI46AdIM1gEaE2IAQGYAQm4AQrIAQXYAQHoAQH4AQOIAgGoAgO4AqSwn6oGwAIB0gIkZTJiOTM0OGMtMWJiZS00NzgxLTk2MWUtYzNmYWYyMmQ2OTAy2AIG4AIB&ucfs=1&arphpl=1&group_adults=2&req_adults=2&no_rooms=1&group_children=0&req_children=0&hpos=18&hapos=43&sr_order=bayesian_review_score&srpvid=70b87e92777300d8&srepoch=1699207206&from=searchresults#hotelTmpl,"Set 1.5 km from Sillon Beach, 1.8 km from Eventail Beach and 1.9 km from Palais du Grand Large, LITTLE BAHIA offers accommodation situated in Saint Malo. The accommodation is 1.3 km from the Bas-Sablons Beach and has free WiFithroughout the property.

The 1-bedroom apartment has a living room with a flat-screen TV with streaming services, a fully equipped kitchen with oven and microwave, and 1 bathroom with a hair dryer. Towels and bed linen are offered in the apartment.

Casino Barrière Saint-Malo is 1.8 km from the apartment, while Solidor Tower is 1.9 km from the property. The nearest airport is Jersey Airport, 71 km from LITTLE BAHIA."
la merveille de Rochebonne 3,9.2,32 reviews,48.66224770,-1.98908350,https://www.booking.com/hotel/fr/la-merveille-de-rochebonne-plage-du-sillon-50-m.en-gb.html?aid=304142&label=gen173nr-1FCAEoggI46AdIM1gEaE2IAQGYAQm4AQrIAQXYAQHoAQH4AQOIAgGoAgO4AqSwn6oGwAIB0gIkZTJiOTM0OGMtMWJiZS00NzgxLTk2MWUtYzNmYWYyMmQ2OTAy2AIG4AIB&ucfs=1&arphpl=1&group_adults=2&req_adults=2&no_rooms=1&group_children=0&req_children=0&hpos=16&hapos=41&sr_order=bayesian_review_score&srpvid=70b87e92777300d8&srepoch=1699207206&from=searchresults#hotelTmpl,"Situated in Saint Malo, just 200 metres from Rochebonne Beach, la merveille de Rochebonne 3 features beachfront accommodation with free WiFi. The property has garden views and is 200 metres from Sillon Beach and 700 metres from Minihic Beach.

This apartment has 1 bedroom, a kitchen with a microwave and a toaster, a flat-screen TV, a seating area and 1 bathroom fitted with a shower. Towels and bed linen are offered in the apartment.

Palais du Grand Large is 2.7 km from the apartment, while Casino Barrière Saint-Malo is 2.7 km from the property. The nearest airport is Jersey Airport, 75 km from la merveille de Rochebonne 3."
