hotel_name,hotel_score,hotel_reviews,hotel_lat,hotel_lon,hotel_url,hotel_description
Mas Lou Caloun - Chambre d'Hôte face à la piscine en Camargue - Les Saintes Maries de la Mer,9.4,64 reviews,43.51804861,4.37801421,https://www.booking.com/hotel/fr/chambre-d-39-hote-face-a-la-piscine-en-camargue-mas-lou-caloun-les-saintes-marie.en-gb.html?aid=304142&label=gen173nr-1FCAEoggI46AdIM1gEaE2IAQGYAQm4AQrIAQXYAQHoAQH4AQOIAgGoAgO4Au2tn6oGwAIB0gIkMDlkOGFkZmUtNGQyZS00ZGM2LWEyZDAtYzBhMjcxODkzY2Vj2AIG4AIB&ucfs=1&arphpl=1&group_adults=2&req_adults=2&no_rooms=1&group_children=0&req_children=0&hpos=21&hapos=21&sr_order=bayesian_review_score&srpvid=9b817df7c94b0003&srepoch=1699206896&from_sustainable_property_sr=1&from=searchresults#hotelTmpl,"Located in Saintes-Maries-de-la-Mer, 36 km from Arles Amphitheatre and 44 km from Montpellier Arena, Mas Lou Caloun - Chambre d'Hôte face à la piscine en Camargue - Les Saintes Maries de la Mer offers an open-air bath and air conditioning. This bed and breakfast features a pool with a view, a garden, barbecue facilities, free WiFi and free private parking.

This bed and breakfast will provide guests with a cable flat-screen TV, a terrace, a seating area and an iPod docking station. Towels and bed linen are featured in the bed and breakfast.

The bed and breakfast offers a continental or American breakfast.

Mas Lou Caloun - Chambre d'Hôte face à la piscine en Camargue - Les Saintes Maries de la Mer offers a picnic area. If you would like to discover the area, cycling, fishing and hiking are possible in the surroundings.

Parc des Expositions de Montpellier is 44 km from the accommodation, while Zenith Sud Montpellier is 48 km away. The nearest airport is Nimes-Ales-Camargue-Cevennes, 37 km from Mas Lou Caloun - Chambre d'Hôte face à la piscine en Camargue - Les Saintes Maries de la Mer, and the property offers a paid airport shuttle service."
Le Fangassier,8.8,918 reviews,43.45449604,4.43070754,https://www.booking.com/hotel/fr/le-fangassier.en-gb.html?aid=304142&label=gen173nr-1FCAEoggI46AdIM1gEaE2IAQGYAQm4AQrIAQXYAQHoAQH4AQOIAgGoAgO4Au2tn6oGwAIB0gIkMDlkOGFkZmUtNGQyZS00ZGM2LWEyZDAtYzBhMjcxODkzY2Vj2AIG4AIB&ucfs=1&arphpl=1&group_adults=2&req_adults=2&no_rooms=1&group_children=0&req_children=0&hpos=19&hapos=19&sr_order=bayesian_review_score&srpvid=9b817df7c94b0003&srepoch=1699206896&from=searchresults#hotelTmpl,"Located in the Provence-Alpes-Côte d’Azur region, Le Fangassier a hotel set in a Camargue-style building 600 metres from the beach in Saintes-Maries-de-la-Mer. It offers free WiFi access.

All the air-conditioned rooms at Le Fangassier feature a telephone and a flat-screen TV. A bathroom with a bath or shower is also provided. Some rooms have a private terrace or balcony.

A buffet breakfast is served every morning at Le Fangassier.

Shops and restaurants can be found within a 5-minute walk.

This hotel is a 15-minute drive from Château d’Avignon and Arles is 37 km away."
Lodge Sainte Helene,9.2,117 reviews,43.46575556,4.41393435,https://www.booking.com/hotel/fr/lodge-sainte-helene.en-gb.html?aid=304142&label=gen173nr-1FCAEoggI46AdIM1gEaE2IAQGYAQm4AQrIAQXYAQHoAQH4AQOIAgGoAgO4Au2tn6oGwAIB0gIkMDlkOGFkZmUtNGQyZS00ZGM2LWEyZDAtYzBhMjcxODkzY2Vj2AIG4AIB&ucfs=1&arphpl=1&group_adults=2&req_adults=2&no_rooms=1&group_children=0&req_children=0&hpos=20&hapos=20&sr_order=bayesian_review_score&srpvid=9b817df7c94b0003&srepoch=1699206896&from=searchresults#hotelTmpl,"Located on the peninsula of a lake near Saintes-Maries-de-la-Mer (1.5 km), Lodge Sainte Hélène offers panoramic views of the lake and its sumptuous sunsets, as well as free Wi-Fi. You can enjoy an outdoor swimming pool heated during the summer season, a garden and a terrace to relax in a peaceful and very relaxing.

Superior double rooms at Lodge Sainte Hélène feature a balcony with lake views, a minibar, a coffee/tea machine and a flat-screen TV. The private bathroom is equipped with a bath or a large walk-in shower, a hairdryer, a bathrobe, slippers and free toiletries l'Occitane.

To start your day well, we offer a brunch breakfast that you can enjoy in your room or in the common areas by the lake, terrace and buffet . The property also offers ironing and laundry services.

You can practice several activities on site or in the surroundings, such as horse riding, cycling and hiking on the paths of the Camargue National Park, which we will be pleased to reserve for you . Lodge Sainte Hélène also offers free parking in front of your room for your convenience."
Hôtel Restaurant Les Arnelles,8.6,368 reviews,43.46095608,4.42231894,https://www.booking.com/hotel/fr/les-arnelles.en-gb.html?aid=304142&label=gen173nr-1FCAEoggI46AdIM1gEaE2IAQGYAQm4AQrIAQXYAQHoAQH4AQOIAgGoAgO4Au2tn6oGwAIB0gIkMDlkOGFkZmUtNGQyZS00ZGM2LWEyZDAtYzBhMjcxODkzY2Vj2AIG4AIB&ucfs=1&arphpl=1&group_adults=2&req_adults=2&no_rooms=1&group_children=0&req_children=0&hpos=18&hapos=18&sr_order=bayesian_review_score&srpvid=9b817df7c94b0003&srepoch=1699206896&from_sustainable_property_sr=1&from=searchresults#hotelTmpl,"Located in the heart of the Camargue Natural Regional Park, Les Arnelles features an outdoor swimming pool, a garden and a terrace in Les Saintes-Marie-de-la-Mer. Extras include horse riding and massages.

Offering free Wi-Fi access, the air-conditioned guest rooms come with a flat-screen TV and a bathroom with shower or bathtub and free toiletries. They also have access to a private terrace.

Every morning, a breakfast buffet is served on site. Guests can also enjoy Mediterranean specialties served at the hotel or relax at the bar.

The evening meal is in the form of a unique menu in order to work with local producers in short circuit. Please indicate before your arrival any allergies, intolerance or culinary specifications.

Guests can go to the beach, 1.3 km away. Pont de Gau Zoological Garden can be visited 3.5 km away. Guests can also drive 35 km to discover le Grau Du Roi and Aigues Mortes. Arles TGV Train Station is 35 km away."
Maison au bord de mer,9.5,24 reviews,43.45015609,4.42718344,https://www.booking.com/hotel/fr/maison-au-bord-de-mer-saintes-maries-de-la-mer.en-gb.html?aid=304142&label=gen173nr-1FCAEoggI46AdIM1gEaE2IAQGYAQm4AQrIAQXYAQHoAQH4AQOIAgGoAgO4Au2tn6oGwAIB0gIkMDlkOGFkZmUtNGQyZS00ZGM2LWEyZDAtYzBhMjcxODkzY2Vj2AIG4AIB&ucfs=1&arphpl=1&group_adults=2&req_adults=2&no_rooms=1&group_children=0&req_children=0&hpos=16&hapos=16&sr_order=bayesian_review_score&srpvid=9b817df7c94b0003&srepoch=1699206896&from=searchresults#hotelTmpl,"Located in Saintes-Maries-de-la-Mer, 200 metres from Arenas Beach and 200 metres from Amphora Beach, Maison au bord de mer offers air conditioning. The 3-star holiday home has inner courtyard views and is 600 metres from Crin Blanc Beach.

The holiday home with a terrace and garden views features 2 bedrooms, a living room, a flat-screen TV, an equipped kitchen with a dishwasher and an oven, and 1 bathroom with a shower. For added convenience, the property can provide towels and linens for a supplement.

Arles Amphitheatre is 39 km from the holiday home. The nearest airport is Nimes-Ales-Camargue-Cevennes Airport, 41 km from Maison au bord de mer."
hotel_name,hotel_score,hotel_reviews,hotel_lat,hotel_lon,hotel_url,hotel_description
Superbe Duplex aux Saintes terrasse plein sud 3***,8.9,62 reviews,43.45603973,4.42896768,https://www.booking.com/hotel/fr/superbe-duplex-aux-saintes-terrasse-plein-sud-3.en-gb.html?aid=304142&label=gen173nr-1FCAEoggI46AdIM1gEaE2IAQGYAQm4AQrIAQXYAQHoAQH4AQOIAgGoAgO4Aravn6oGwAIB0gIkMjllM2ExYTQtNWUwNi00NjU5LWExODItZmVhNzY4ZGViYTgy2AIG4AIB&ucfs=1&arphpl=1&group_adults=2&req_adults=2&no_rooms=1&group_children=0&req_children=0&hpos=1&hapos=26&sr_order=bayesian_review_score&srpvid=2f2d7e5b43340d72&srepoch=1699207096&from=searchresults#hotelTmpl,"Featuring garden views, Superbe Duplex aux Saintes terrasse plein sud 3*** provides accommodation with a balcony and a coffee machine, around less than 1 km from Amphora Beach. The property features city and inner courtyard views, and is less than 1 km from Arenas Beach.

This air-conditioned apartment is equipped with 1 bedroom, a flat-screen TV, a dining area, a kitchen with a dishwasher, and a living room. For added convenience, the property can provide towels and linens for a supplement.

The apartment offers a terrace. Fishing can be enjoyed nearby.

Crin Blanc Beach is 1.2 km from Superbe Duplex aux Saintes terrasse plein sud 3***, while Arles Amphitheatre is 39 km away. The nearest airport is Nimes-Ales-Camargue-Cevennes Airport, 41 km from the accommodation."
Mas de la Grenouillère Hôtel et Centre équestre en pleine nature,8.3,259 reviews,43.47145266,4.40182686,https://www.booking.com/hotel/fr/ha-tel-mas-de-la-grenouilla-re.en-gb.html?aid=304142&label=gen173nr-1FCAEoggI46AdIM1gEaE2IAQGYAQm4AQrIAQXYAQHoAQH4AQOIAgGoAgO4Aravn6oGwAIB0gIkMjllM2ExYTQtNWUwNi00NjU5LWExODItZmVhNzY4ZGViYTgy2AIG4AIB&ucfs=1&arphpl=1&group_adults=2&req_adults=2&no_rooms=1&group_children=0&req_children=0&hpos=3&hapos=28&sr_order=bayesian_review_score&srpvid=2f2d7e5b43340d72&srepoch=1699207096&from_sustainable_property_sr=1&from=searchresults#hotelTmpl,"This hotel and horse riding centre is set in a Provencal farm house in Saintes-Maries-de-la-Mer in the Camargue Regional Nature Park. It has a garden and an outdoor pool lined with a sun terrace.

Each air-conditioned room offers free Wi-Fi and opens up to a terrace with views of the garden. All rooms include flat-screen TVs with satellite channels and have facilities for making hot drinks.

Breakfast can be enjoyed every morning on guests’ own private terraces. Mas de la Grenouillère Hôtel et Centre équestre en pleine nature organises horseback riding lessons and tours of the surrounding area.

Free parking for cars and bikes is available on site and the banks of the Petit Rhône River are just 1 km away. The hotel is 36 km from the city of Arles and the Arles Train Station."
Studio des Saintes,9.0,40 reviews,43.45582205,4.42966030,https://www.booking.com/hotel/fr/studio-des-saintes.en-gb.html?aid=304142&label=gen173nr-1FCAEoggI46AdIM1gEaE2IAQGYAQm4AQrIAQXYAQHoAQH4AQOIAgGoAgO4Aravn6oGwAIB0gIkMjllM2ExYTQtNWUwNi00NjU5LWExODItZmVhNzY4ZGViYTgy2AIG4AIB&ucfs=1&arphpl=1&group_adults=2&req_adults=2&no_rooms=1&group_children=0&req_children=0&hpos=5&hapos=30&sr_order=bayesian_review_score&srpvid=2f2d7e5b43340d72&srepoch=1699207096&from=searchresults#hotelTmpl,"Featuring air-conditioned accommodation with a balcony, Studio des Saintes is located in Saintes-Maries-de-la-Mer. This property offers access to a terrace and free private parking.

The apartment is fitted with a flat-screen TV. The kitchenette comes with a dishwasher, a microwave and a fridge, as well as coffee machine and kettle.

Popular points of interest near the apartment include Amphora Beach, Arenas Beach and Est Beach. The nearest airport is Nimes-Ales-Camargue-Cevennes Airport, 41 km from Studio des Saintes."
Mas De Calabrun,8.4,744 reviews,43.50225830,4.42575753,https://www.booking.com/hotel/fr/mas-de-calabrun.en-gb.html?aid=304142&label=gen173nr-1FCAEoggI46AdIM1gEaE2IAQGYAQm4AQrIAQXYAQHoAQH4AQOIAgGoAgO4Aravn6oGwAIB0gIkMjllM2ExYTQtNWUwNi00NjU5LWExODItZmVhNzY4ZGViYTgy2AIG4AIB&ucfs=1&arphpl=1&group_adults=2&req_adults=2&no_rooms=1&group_children=0&req_children=0&hpos=4&hapos=29&sr_order=bayesian_review_score&srpvid=2f2d7e5b43340d72&srepoch=1699207096&from=searchresults#hotelTmpl,"Featuring an outdoor pool, boules pitch and table tennis table, Mas de Calabrun is a hotel located on a private estate in Saintes-Maries-de-la-Mer in the Camargue Regional Park. The beach is 8 minutes' drive away. It offers free WiFi.

The air-conditioned guest rooms feature traditional Camargue décor, a flat-screen TV and a view of the garden or pool. There is a private bathroom with a shower and hairdryer.

The Calabrun can also organise horse riding and jeep tours.

Free private parking is available on site and the hotel is an hour’s drive south of Nimes."
"La Villa Vaihéré en Camargue, l'Hibiscus et le Magnolia",9.6,39 reviews,43.51729854,4.37449975,https://www.booking.com/hotel/fr/la-villa-vaihere-en-camargue-l-hibiscus.en-gb.html?aid=304142&label=gen173nr-1FCAEoggI46AdIM1gEaE2IAQGYAQm4AQrIAQXYAQHoAQH4AQOIAgGoAgO4Aravn6oGwAIB0gIkMjllM2ExYTQtNWUwNi00NjU5LWExODItZmVhNzY4ZGViYTgy2AIG4AIB&ucfs=1&arphpl=1&group_adults=2&req_adults=2&no_rooms=1&group_children=0&req_children=0&hpos=7&hapos=32&sr_order=bayesian_review_score&srpvid=2f2d7e5b43340d72&srepoch=1699207096&from_sustainable_property_sr=1&from=searchresults#hotelTmpl,"Situated in Saintes-Maries-de-la-Mer, 35 km from Arles Amphitheatre and 44 km from Montpellier Arena, La Villa Vaihéré en Camargue, l'Hibiscus et le Magnolia features accommodation with air conditioning and access to a garden. Complimentary WiFi is featuredthroughout the property.

Each unit has a terrace, a kitchen with a dishwasher, a dining area and a seating area with a flat-screen TV, while the private bathroom includes a shower and a hair dryer. An oven, a microwave and toaster are also available, as well as a coffee machine and a kettle.

Cycling can be enjoyed nearby.

Parc des Expositions de Montpellier is 44 km from the apartment, while Zenith Sud Montpellier is 48 km from the property. The nearest airport is Nimes-Ales-Camargue-Cevennes Airport, 37 km from La Villa Vaihéré en Camargue, l'Hibiscus et le Magnolia."
la farigoulette,8.9,53 reviews,43.45560120,4.43015760,https://www.booking.com/hotel/fr/la-farigoulette-saintes-maries-de-la-mer.en-gb.html?aid=304142&label=gen173nr-1FCAEoggI46AdIM1gEaE2IAQGYAQm4AQrIAQXYAQHoAQH4AQOIAgGoAgO4Aravn6oGwAIB0gIkMjllM2ExYTQtNWUwNi00NjU5LWExODItZmVhNzY4ZGViYTgy2AIG4AIB&ucfs=1&arphpl=1&group_adults=2&req_adults=2&no_rooms=1&group_children=0&req_children=0&hpos=2&hapos=27&sr_order=bayesian_review_score&srpvid=2f2d7e5b43340d72&srepoch=1699207096&from=searchresults#hotelTmpl,"Located in Saintes-Maries-de-la-Mer, 800 metres from Amphora Beach and less than 1 km from Arenas Beach, la farigoulette offers air conditioning. This property offers access to a balcony, free private parking and free WiFi.

The apartment with a terrace and garden views features 1 bedroom, a living room, a flat-screen TV, an equipped kitchen with a dishwasher and a microwave, and 1 bathroom with a bath. For added convenience, the property can provide towels and linens for a supplement.

Est Beach is 1 km from the apartment, while Arles Amphitheatre is 39 km away. The nearest airport is Nimes-Ales-Camargue-Cevennes Airport, 41 km from la farigoulette."
maison en Camargue,9.4,46 reviews,43.46825893,4.41530266,https://www.booking.com/hotel/fr/maison-en-camargue.en-gb.html?aid=304142&label=gen173nr-1FCAEoggI46AdIM1gEaE2IAQGYAQm4AQrIAQXYAQHoAQH4AQOIAgGoAgO4Aravn6oGwAIB0gIkMjllM2ExYTQtNWUwNi00NjU5LWExODItZmVhNzY4ZGViYTgy2AIG4AIB&ucfs=1&arphpl=1&group_adults=2&req_adults=2&no_rooms=1&group_children=0&req_children=0&hpos=6&hapos=31&sr_order=bayesian_review_score&srpvid=2f2d7e5b43340d72&srepoch=1699207096&from=searchresults#hotelTmpl,"Boasting inner courtyard views, maison en Camargue features accommodation with a balcony and a coffee machine, around 2.6 km from Arenas Beach. This apartment offers air-conditioned accommodation with a patio.

The apartment features 2 bedrooms, 2 bathrooms, bed linen, towels, a flat-screen TV, a dining area, a fully equipped kitchen, and a terrace with garden views.

Guests can also relax in the garden.

Arles Amphitheatre is 37 km from the apartment, while Montpellier Arena is 50 km from the property. The nearest airport is Nimes-Ales-Camargue-Cevennes Airport, 39 km from maison en Camargue."
Hotel Lou Marquès,9.0,159 reviews,43.45512494,4.42874014,https://www.booking.com/hotel/fr/lou-marques.en-gb.html?aid=304142&label=gen173nr-1FCAEoggI46AdIM1gEaE2IAQGYAQm4AQrIAQXYAQHoAQH4AQOIAgGoAgO4Aravn6oGwAIB0gIkMjllM2ExYTQtNWUwNi00NjU5LWExODItZmVhNzY4ZGViYTgy2AIG4AIB&ucfs=1&arphpl=1&group_adults=2&req_adults=2&no_rooms=1&group_children=0&req_children=0&hpos=8&hapos=33&sr_order=bayesian_review_score&srpvid=2f2d7e5b43340d72&srepoch=1699207096&from_sustainable_property_sr=1&from=searchresults#hotelTmpl,"Lou Marquès is located in Les Saintes Maries De La Mer, in Camargue Regional Nature Park.  It offers free WiFi and a sunny terrace and it is just 400 metres from the beaches.

All the air-conditioned rooms at Lou Marquès come with an LCD TV and a telephone. They all have a private bathroom with a shower and some of them also include a private terrace.

You may have your breakfast served in the communal lounge or take it on the terrace. You can ask the reception about the nearest restaurants.

Free public parking is available on site and the hotel is a 5-minute drive from Pont de Gau Ornithological Park. Arles is a 30-minute drive away."
Bellevue,8.9,65 reviews,43.45223270,4.42723700,https://www.booking.com/hotel/fr/appartement-plein-centre-des-saintes-maries-de-la-mer-vue-sur-le-clocher.en-gb.html?aid=304142&label=gen173nr-1FCAEoggI46AdIM1gEaE2IAQGYAQm4AQrIAQXYAQHoAQH4AQOIAgGoAgO4Aravn6oGwAIB0gIkMjllM2ExYTQtNWUwNi00NjU5LWExODItZmVhNzY4ZGViYTgy2AIG4AIB&ucfs=1&arphpl=1&group_adults=2&req_adults=2&no_rooms=1&group_children=0&req_children=0&hpos=10&hapos=35&sr_order=bayesian_review_score&srpvid=2f2d7e5b43340d72&srepoch=1699207096&from=searchresults#hotelTmpl,"Set in Saintes-Maries-de-la-Mer, 400 metres from Amphora Beach and 400 metres from Arenas Beach, Bellevue offers air conditioning. The property features city views and is 800 metres from Crin Blanc Beach and 39 km from Arles Amphitheatre.

The 1-bedroom apartment is fitted with a living room with a flat-screen TV with streaming services, a fully equipped kitchen with a dishwasher and oven, and 2 bathrooms with walk-in shower.

The nearest airport is Nimes-Ales-Camargue-Cevennes Airport, 41 km from the apartment."
Mas Albert Espelly,8.9,48 reviews,43.48273366,4.39518571,https://www.booking.com/hotel/fr/mas-albert-espelly.en-gb.html?aid=304142&label=gen173nr-1FCAEoggI46AdIM1gEaE2IAQGYAQm4AQrIAQXYAQHoAQH4AQOIAgGoAgO4Aravn6oGwAIB0gIkMjllM2ExYTQtNWUwNi00NjU5LWExODItZmVhNzY4ZGViYTgy2AIG4AIB&ucfs=1&arphpl=1&group_adults=2&req_adults=2&no_rooms=1&group_children=0&req_children=0&hpos=9&hapos=34&sr_order=bayesian_review_score&srpvid=2f2d7e5b43340d72&srepoch=1699207096&from=searchresults#hotelTmpl,"Set in Saintes-Maries-de-la-Mer in the Provence-Alpes-Côte d'Azur region, Mas Albert Espelly offers accommodation with free WiFi and free private parking, as well as access to a hot tub. The accommodation is air conditioned and is fitted with a hot tub.

A microwave, a toaster and fridge are also featured in the kitchen, as well as a coffee machine.

The holiday home offers a picnic area.

Mas Albert Espelly features a barbecue, garden and sun terrace.

Arles Amphitheatre is 36 km from the accommodation, while Montpellier Arena is 48 km away. The nearest airport is Nimes-Ales-Camargue-Cevennes Airport, 37 km from Mas Albert Espelly."
Appartement Duplex 4pers Climatisé - Location Valadié Camargue,9.1,23 reviews,43.45600810,4.42931620,https://www.booking.com/hotel/fr/appartement-duplex-4pers-climatise.en-gb.html?aid=304142&label=gen173nr-1FCAEoggI46AdIM1gEaE2IAQGYAQm4AQrIAQXYAQHoAQH4AQOIAgGoAgO4Aravn6oGwAIB0gIkMjllM2ExYTQtNWUwNi00NjU5LWExODItZmVhNzY4ZGViYTgy2AIG4AIB&ucfs=1&arphpl=1&group_adults=2&req_adults=2&no_rooms=1&group_children=0&req_children=0&hpos=11&hapos=36&sr_order=bayesian_review_score&srpvid=2f2d7e5b43340d72&srepoch=1699207096&from=searchresults#hotelTmpl,"Offering a terrace and quiet street view, Appartement Duplex 4pers Climatisé - Location Valadié Camargue is situated in Saintes-Maries-de-la-Mer, less than 1 km from Arenas Beach and a 13-minute walk from Est Beach. The air-conditioned accommodation is less than 1 km from Amphora Beach, and guests benefit from private parking available on site and free WiFi.

The apartment with a balcony and city views has 1 bedroom, a living room, a flat-screen TV, an equipped kitchen with a dishwasher and a microwave, and 1 bathroom with a walk-in shower.

If you would like to discover the area, cycling, hiking and walking tours are possible in the surroundings.

Arles Amphitheatre is 39 km from the apartment. The nearest airport is Nimes-Ales-Camargue-Cevennes Airport, 41 km from Appartement Duplex 4pers Climatisé - Location Valadié Camargue."
Abrivado,8.6,870 reviews,43.45033695,4.42622423,https://www.booking.com/hotel/fr/abrivado.en-gb.html?aid=304142&label=gen173nr-1FCAEoggI46AdIM1gEaE2IAQGYAQm4AQrIAQXYAQHoAQH4AQOIAgGoAgO4Aravn6oGwAIB0gIkMjllM2ExYTQtNWUwNi00NjU5LWExODItZmVhNzY4ZGViYTgy2AIG4AIB&ucfs=1&arphpl=1&group_adults=2&req_adults=2&no_rooms=1&group_children=0&req_children=0&hpos=12&hapos=37&sr_order=bayesian_review_score&srpvid=2f2d7e5b43340d72&srepoch=1699207096&from=searchresults#hotelTmpl,"Set in the Camargue Regional Park, Abrivado is an air-conditioned hotel located beside the harbour in the town of Saintes-Maries-de-la-Mer. It is 50 metres from the beach and the surrounding shops. Free WiFi access is provided in the guest rooms.

A TV is included in the rooms, which feature a simple décor. 12 of the rooms offer a sea view and 6 of them also feature a private furnished terrace. The private bathrooms include a hairdryer.

A continental breakfast is offered every morning at the hotel Abrivado for an extra charge.

Low-cost public parking is available nearby, and you can visit Arles, located 40 km away. Montpellier Airport is 52 km from the hotel. Public parking is available nearby."
Cabanon de Camille,8.3,140 reviews,43.45208660,4.42584240,https://www.booking.com/hotel/fr/cabanon-de-camille.en-gb.html?aid=304142&label=gen173nr-1FCAEoggI46AdIM1gEaE2IAQGYAQm4AQrIAQXYAQHoAQH4AQOIAgGoAgO4Aravn6oGwAIB0gIkMjllM2ExYTQtNWUwNi00NjU5LWExODItZmVhNzY4ZGViYTgy2AIG4AIB&ucfs=1&arphpl=1&group_adults=2&req_adults=2&no_rooms=1&group_children=0&req_children=0&hpos=14&hapos=39&sr_order=bayesian_review_score&srpvid=2f2d7e5b43340d72&srepoch=1699207096&from_sustainable_property_sr=1&from=searchresults#hotelTmpl,"Situated in Saintes-Maries-de-la-Mer, 400 metres from Arenas Beach and 400 metres from Amphora Beach, Cabanon de Camille features air-conditioned accommodation with a terrace and free WiFi. The property has garden and inner courtyard views, and is 600 metres from Crin Blanc Beach.

The bed and breakfast has a flat-screen TV. Towels and bed linen are offered in the bed and breakfast.

The bed and breakfast offers a picnic area. Guests can also relax in the garden.

Arles Amphitheatre is 39 km from Cabanon de Camille. The nearest airport is Nimes-Ales-Camargue-Cevennes Airport, 41 km from the accommodation."
Appt calme ensoleillé fonctionnel,8.8,96 reviews,43.45752751,4.42831819,https://www.booking.com/hotel/fr/appartement-calme-et-ensoleille-saintes-maries-de-la-mer.en-gb.html?aid=304142&label=gen173nr-1FCAEoggI46AdIM1gEaE2IAQGYAQm4AQrIAQXYAQHoAQH4AQOIAgGoAgO4Aravn6oGwAIB0gIkMjllM2ExYTQtNWUwNi00NjU5LWExODItZmVhNzY4ZGViYTgy2AIG4AIB&ucfs=1&arphpl=1&group_adults=2&req_adults=2&no_rooms=1&group_children=0&req_children=0&hpos=13&hapos=38&sr_order=bayesian_review_score&srpvid=2f2d7e5b43340d72&srepoch=1699207096&from=searchresults#hotelTmpl,"Appt calme ensoleillé fonctionnel is situated in Saintes-Maries-de-la-Mer, 1.1 km from Amphora Beach, 1.1 km from Arenas Beach, and 1.3 km from Est Beach. This property offers access to a terrace and free private parking.

The air-conditioned apartment consists of 1 bedroom, a living room, a fully equipped kitchen with an oven and a coffee machine, and 1 bathroom with a shower and a hair dryer. Towels and bed linen are available in the apartment.

Arles Amphitheatre is 39 km from the apartment. The nearest airport is Nimes-Ales-Camargue-Cevennes Airport, 41 km from Appt calme ensoleillé fonctionnel."
Mas du Menage en Camargue Manade Clauzel,8.9,177 reviews,43.55206478,4.41881329,https://www.booking.com/hotel/fr/mas-du-menage-en-camargue-manade-clauzel.en-gb.html?aid=304142&label=gen173nr-1FCAEoggI46AdIM1gEaE2IAQGYAQm4AQrIAQXYAQHoAQH4AQOIAgGoAgO4Aravn6oGwAIB0gIkMjllM2ExYTQtNWUwNi00NjU5LWExODItZmVhNzY4ZGViYTgy2AIG4AIB&ucfs=1&arphpl=1&group_adults=2&req_adults=2&no_rooms=1&group_children=0&req_children=0&hpos=16&hapos=41&sr_order=bayesian_review_score&srpvid=2f2d7e5b43340d72&srepoch=1699207096&from=searchresults#hotelTmpl,"Offering free WiFi, Mas du Menage en Camargue Manade Clauzel is located in Saintes-Maries-de-la-Mer.  The property is 13 km from Saintes-Maries-de-la-Mer beaches.

Each room here will provide you with a TV and air conditioning. Extras include an electric kettle and a coffee machine. Featuring a shower or a bath, the private bathrooms also comes with a hairdryer. You can enjoy garden views from the rooms.

At Mas du Menage en Camargue Manade Clauzel you will find a garden. Other facilities available at the property include meeting facilities and a children's playground. Take-away meals including seafood dishes can be provided if you reserve in advance.

Guest can enjoy a visit of the Regional Nature Park of the Camargue where bulls, Camargue horses and flamingo can be seen.

Offering free parking, this bed and breakfast is 45 km from Montpellier - Méditerranée Airport."
