hotel_name,hotel_score,hotel_reviews,hotel_lat,hotel_lon,hotel_url,hotel_description
Mas Fandelou,9.5,429 reviews,43.52335152,4.41032385,https://www.booking.com/hotel/fr/mas-fandelou.en-gb.html?aid=304142&label=gen173nr-1FCAEoggI46AdIM1gEaE2IAQGYAQm4AQrIAQXYAQHoAQH4AQOIAgGoAgO4Au2tn6oGwAIB0gIkMDlkOGFkZmUtNGQyZS00ZGM2LWEyZDAtYzBhMjcxODkzY2Vj2AIG4AIB&ucfs=1&arphpl=1&group_adults=2&req_adults=2&no_rooms=1&group_children=0&req_children=0&hpos=1&hapos=1&sr_order=bayesian_review_score&srpvid=9b817df7c94b0003&srepoch=1699206896&from_sustainable_property_sr=1&from=searchresults#hotelTmpl,"Mas Fandelou has lake views, free WiFi and free private parking, situated in Saintes-Maries-de-la-Mer, 32 km from Arles Amphitheatre.

Every unit features a private bathroom and shower, air conditioning, a flat-screen TV and a minibar.

Guests at the bed and breakfast can enjoy a continental breakfast.

Mas Fandelou offers a seasonal outdoor pool.

Guests at the accommodation can enjoy cycling and hiking nearby, or make the most of the sun terrace.

Montpellier Arena is 47 km from Mas Fandelou, while Parc des Expositions de Montpellier is 47 km from the property. The nearest airport is Nimes-Ales-Camargue-Cevennes Airport, 34 km from the bed and breakfast."
Résidence L’Oiseau des Sables,9.8,97 reviews,43.45205240,4.43109130,https://www.booking.com/hotel/fr/residence-l-oiseau-des-sables.en-gb.html?aid=304142&label=gen173nr-1FCAEoggI46AdIM1gEaE2IAQGYAQm4AQrIAQXYAQHoAQH4AQOIAgGoAgO4Au2tn6oGwAIB0gIkMDlkOGFkZmUtNGQyZS00ZGM2LWEyZDAtYzBhMjcxODkzY2Vj2AIG4AIB&ucfs=1&arphpl=1&group_adults=2&req_adults=2&no_rooms=1&group_children=0&req_children=0&hpos=3&hapos=3&sr_order=bayesian_review_score&srpvid=9b817df7c94b0003&srepoch=1699206896&from=searchresults#hotelTmpl,"Located in Saintes-Maries-de-la-Mer in the Provence-Alpes-Côte d'Azur region, with Amphora Beach and Arenas Beach nearby, Résidence L’Oiseau des Sables provides accommodation with free WiFi and free private parking.

Each unit comes with a terrace, a fully equipped kitchen with a dishwasher, a seating area, a flat-screen TV, a washing machine, and a private bathroom with shower and a hair dryer. An oven, a microwave and fridge are also featured, as well as a coffee machine and a kettle.

The apartment offers a barbecue.

Crin Blanc Beach is 1 km from Résidence L’Oiseau des Sables, while Arles Amphitheatre is 39 km away. The nearest airport is Nimes-Ales-Camargue-Cevennes Airport, 41 km from the accommodation."
Mas des Cabidoules,9.7,159 reviews,43.46610858,4.41409260,https://www.booking.com/hotel/fr/mas-des-cabidoules.en-gb.html?aid=304142&label=gen173nr-1FCAEoggI46AdIM1gEaE2IAQGYAQm4AQrIAQXYAQHoAQH4AQOIAgGoAgO4Au2tn6oGwAIB0gIkMDlkOGFkZmUtNGQyZS00ZGM2LWEyZDAtYzBhMjcxODkzY2Vj2AIG4AIB&ucfs=1&arphpl=1&group_adults=2&req_adults=2&no_rooms=1&group_children=0&req_children=0&hpos=2&hapos=2&sr_order=bayesian_review_score&srpvid=9b817df7c94b0003&srepoch=1699206896&from=searchresults#hotelTmpl,"Featuring free WiFi, Mas des Cabidoules offers accommodation in Saintes-Maries-de-la-Mer, 1.9 km from Eglise des Stes Maries. The bed and breakfast has an outdoor pool and views of the lake. Free private parking is available on site.

Every room is fitted with a flat-screen TV. Certain rooms include views of the pool or garden. You will find a shared lounge at the property. Every room comes with a private bathroom equipped with a bath or shower.

Guests can enjoy a home-cooked dinner prepared by the host for an additionnal fee.

Bike hire is available at this bed and breakfast and the area is popular for horse riding and cycling. Nimes-Ales-Camargue-Cevennes Airport is 32 km away."
Hôtel du Pont Blanc,9.0,320 reviews,43.45705076,4.42464903,https://www.booking.com/hotel/fr/hotellerie-du-pont-blanc.en-gb.html?aid=304142&label=gen173nr-1FCAEoggI46AdIM1gEaE2IAQGYAQm4AQrIAQXYAQHoAQH4AQOIAgGoAgO4Au2tn6oGwAIB0gIkMDlkOGFkZmUtNGQyZS00ZGM2LWEyZDAtYzBhMjcxODkzY2Vj2AIG4AIB&ucfs=1&arphpl=1&group_adults=2&req_adults=2&no_rooms=1&group_children=0&req_children=0&hpos=6&hapos=6&sr_order=bayesian_review_score&srpvid=9b817df7c94b0003&srepoch=1699206896&from_sustainable_property_sr=1&from=searchresults#hotelTmpl,"Set in Saintes-Marie- de-la-Mer, Hôtel du Pont Blanc sits in a flowery garden with terrace and swimming pool, just an 8-minute walk from the beach. Free Wi-Fi and free private parking are provided.

The hotel’s rooms feature a terrace with garden views and a flat-screen TV. They all have an en suite bathroom with free toiletries, hairdryer and bathtub.

Every morning, a continental breakfast is served at the hotel at an extra cost. Throughout the day, you can find your little quiet corner in our garden. A little reading break? A little nap in the shade of our pines? Let yourself be tempted. A range of restaurants are to be found a 5-minute walk away.

Saintes-Marie- de-la-Mer city centre is just a 5-minute walk away. Guests can drive 25 km to Aigues-Mortes or 34 km to Le-Grau-du-Roi.  Arles Train Station is 35 km away."
"Mas du Couvin, maison d'hôtes en Camargue",9.6,100 reviews,43.50038852,4.42724100,https://www.booking.com/hotel/fr/mas-du-couvin.en-gb.html?aid=304142&label=gen173nr-1FCAEoggI46AdIM1gEaE2IAQGYAQm4AQrIAQXYAQHoAQH4AQOIAgGoAgO4Au2tn6oGwAIB0gIkMDlkOGFkZmUtNGQyZS00ZGM2LWEyZDAtYzBhMjcxODkzY2Vj2AIG4AIB&ucfs=1&arphpl=1&group_adults=2&req_adults=2&no_rooms=1&group_children=0&req_children=0&hpos=5&hapos=5&sr_order=bayesian_review_score&srpvid=9b817df7c94b0003&srepoch=1699206896&from_sustainable_property_sr=1&from=searchresults#hotelTmpl,"Located in Saintes-Maries-de-la-Mer in the Provence-Alpes-Côte d'Azur region, Mas du Couvin, maison d'hôtes en Camargue provides accommodation with free WiFi and free private parking, as well as access to a hot tub.

There is a private bathroom with walk-in shower in all units, along with a hair dryer and free toiletries.

Breakfast is available daily, and includes buffet, à la carte and continental options.

The bed and breakfast offers 5-star accommodation with a spa facilities and sun terrace.

Guests can also relax in the garden or in the shared lounge area.

Arles Amphitheatre is 34 km from Mas du Couvin, maison d'hôtes en Camargue, while Montpellier Arena is 49 km away. The nearest airport is Nimes-Ales-Camargue-Cevennes, 36 km from the accommodation, and the property offers a paid airport shuttle service."
Mangio Fango Hotel et Spa,8.8,353 reviews,43.45978795,4.42328453,https://www.booking.com/hotel/fr/mangio-fango.en-gb.html?aid=304142&label=gen173nr-1FCAEoggI46AdIM1gEaE2IAQGYAQm4AQrIAQXYAQHoAQH4AQOIAgGoAgO4Au2tn6oGwAIB0gIkMDlkOGFkZmUtNGQyZS00ZGM2LWEyZDAtYzBhMjcxODkzY2Vj2AIG4AIB&ucfs=1&arphpl=1&group_adults=2&req_adults=2&no_rooms=1&group_children=0&req_children=0&hpos=7&hapos=7&sr_order=bayesian_review_score&srpvid=9b817df7c94b0003&srepoch=1699206896&from_sustainable_property_sr=1&from=searchresults#hotelTmpl,"Mangio Fango Hotel et Spa in Saintes-Maries-de-la-Mer has 4-star accommodation with a garden, a terrace and a bar. Boasting an outdoor swimming pool, this property is located near attractions such as Eglise des Stes Maries. There is a restaurant.

Guest rooms in the hotel are fitted with a kettle and a private bathroom with a hair dryer. All guest rooms at Mangio Fango Hotel et Spa have a flat-screen TV and air conditioning, and certain rooms come with a balcony.

The accommodation offers a buffet breakfast. The restaurant is open every day except on Tuesday and Wednesday.

The nearest airport is Nimes-Ales-Camargue-Cevennes Airport, 33 km from Mangio Fango Hotel et Spa."
Maison l'Etrier,9.2,256 reviews,43.46729600,4.41386700,https://www.booking.com/hotel/fr/l-39-etrier.en-gb.html?aid=304142&label=gen173nr-1FCAEoggI46AdIM1gEaE2IAQGYAQm4AQrIAQXYAQHoAQH4AQOIAgGoAgO4Au2tn6oGwAIB0gIkMDlkOGFkZmUtNGQyZS00ZGM2LWEyZDAtYzBhMjcxODkzY2Vj2AIG4AIB&ucfs=1&arphpl=1&group_adults=2&req_adults=2&no_rooms=1&group_children=0&req_children=0&hpos=4&hapos=4&sr_order=bayesian_review_score&srpvid=9b817df7c94b0003&srepoch=1699206896&from=searchresults#hotelTmpl,"Boasting a seasonal outdoor pool, Maison l'Etrier in Saintes-Maries-de-la-Mer offers accommodation with free WiFi and free private parking for guests who drive.

Fitted with a terrace, the units offer air conditioning and feature a flat-screen TV and a private bathroom with walk-in shower and a hair dryer.

The bed and breakfast offers an à la carte or continental breakfast.

A bicycle rental service is available at Maison l'Etrier.

Arenas Beach is 2.7 km from the accommodation, while Arles Amphitheatre is 37 km from the property. The nearest airport is Nimes-Ales-Camargue-Cevennes Airport, 39 km from Maison l'Etrier."
Hôtel Casa Marina,8.9,"1,373 reviews",43.45113300,4.43095300,https://www.booking.com/hotel/fr/casa-marina-saintes-maries-de-la-mer.en-gb.html?aid=304142&label=gen173nr-1FCAEoggI46AdIM1gEaE2IAQGYAQm4AQrIAQXYAQHoAQH4AQOIAgGoAgO4Au2tn6oGwAIB0gIkMDlkOGFkZmUtNGQyZS00ZGM2LWEyZDAtYzBhMjcxODkzY2Vj2AIG4AIB&ucfs=1&arphpl=1&group_adults=2&req_adults=2&no_rooms=1&group_children=0&req_children=0&hpos=8&hapos=8&sr_order=bayesian_review_score&srpvid=9b817df7c94b0003&srepoch=1699206896&from=searchresults#hotelTmpl,"Hôtel Casa Marina is situated on the beachfront in Saintes-Maries-de-la-Mer, 400 metres from Arenas Beach and less than 1 km from Crin Blanc Beach. With a garden, the 3-star hotel has air-conditioned rooms with free WiFi, each with a private bathroom. The property is non-smoking and is set 90 metres from Amphora Beach.

At the hotel, every room is equipped with a desk and a flat-screen TV. All rooms are fitted with a safety deposit box, while some rooms also offer a terrace and others also have sea views. At Hôtel Casa Marina the rooms include bed linen and towels.

The accommodation offers a continental or gluten-free breakfast.

Arles Amphitheatre is 39 km from Hôtel Casa Marina. The nearest airport is Nimes-Ales-Camargue-Cevennes Airport, 41 km from the hotel."
Le Maset,9.0,258 reviews,43.45656073,4.42670293,https://www.booking.com/hotel/fr/mazet-de-la-grenouilla-re.en-gb.html?aid=304142&label=gen173nr-1FCAEoggI46AdIM1gEaE2IAQGYAQm4AQrIAQXYAQHoAQH4AQOIAgGoAgO4Au2tn6oGwAIB0gIkMDlkOGFkZmUtNGQyZS00ZGM2LWEyZDAtYzBhMjcxODkzY2Vj2AIG4AIB&ucfs=1&arphpl=1&group_adults=2&req_adults=2&no_rooms=1&group_children=0&req_children=0&hpos=9&hapos=9&sr_order=bayesian_review_score&srpvid=9b817df7c94b0003&srepoch=1699206896&from=searchresults#hotelTmpl,"Located just 400 metres from the sandy beach in Saintes-Maries-de-La-Mer, Le Maset is an air-conditioned hotel offering a swimming pool surrounded by sun loungers. Free WiFi is provided in the guest rooms.

Featuring a classic décor with tiled flooring, each of the rooms features a terrace and an LCD TV. The en suite bathrooms include a walk-in shower.

A buffet breakfast is prepared every morning at Le Maset, and breakfast can also be taken in your room.

Many restaurants and shops can be found within a 10-minute walk.

Leisure activities include horse riding, cycling and hiking in the surrounding area and Arles is located 35 km away. Free private parking is available on site."
Appartements calmes LE MAS DE LAURIANE,8.8,71 reviews,43.53058854,4.36845785,https://www.booking.com/hotel/fr/le-mas-de-lauriane.en-gb.html?aid=304142&label=gen173nr-1FCAEoggI46AdIM1gEaE2IAQGYAQm4AQrIAQXYAQHoAQH4AQOIAgGoAgO4Au2tn6oGwAIB0gIkMDlkOGFkZmUtNGQyZS00ZGM2LWEyZDAtYzBhMjcxODkzY2Vj2AIG4AIB&ucfs=1&arphpl=1&group_adults=2&req_adults=2&no_rooms=1&group_children=0&req_children=0&hpos=15&hapos=15&sr_order=bayesian_review_score&srpvid=9b817df7c94b0003&srepoch=1699206896&from=searchresults#hotelTmpl,"Located in Saintes-Maries-de-la-Mer in the Provence-Alpes-Côte d'Azur region, Appartements calmes LE MAS DE LAURIANE provides accommodation with free private parking.

Fitted with a terrace, the units offer air conditioning and feature a flat-screen TV and a private bathroom with walk-in shower and a hair dryer. An oven, a microwave and toaster are also provided in the kitchen, as well as a coffee machine.

Guests at the holiday home can enjoy fishing and hiking nearby, or make the most of the garden.

Arles Amphitheatre is 34 km from Appartements calmes LE MAS DE LAURIANE, while Montpellier Arena is 42 km away. The nearest airport is Nimes-Ales-Camargue-Cevennes Airport, 35 km from the accommodation."
Appartement de l'olivier,9.1,108 reviews,43.45384869,4.42492882,https://www.booking.com/hotel/fr/appartement-de-l-39-olivier.en-gb.html?aid=304142&label=gen173nr-1FCAEoggI46AdIM1gEaE2IAQGYAQm4AQrIAQXYAQHoAQH4AQOIAgGoAgO4Au2tn6oGwAIB0gIkMDlkOGFkZmUtNGQyZS00ZGM2LWEyZDAtYzBhMjcxODkzY2Vj2AIG4AIB&ucfs=1&arphpl=1&group_adults=2&req_adults=2&no_rooms=1&group_children=0&req_children=0&hpos=12&hapos=12&sr_order=bayesian_review_score&srpvid=9b817df7c94b0003&srepoch=1699206896&from=searchresults#hotelTmpl,"Located in Saintes-Maries-de-la-Mer, within less than 1 km of Amphora Beach and a 10-minute walk of Arenas Beach, Appartement de l'olivier offers accommodation with free WiFi, air conditioning and a garden.

The apartment with a terrace and garden views features 1 bedroom, a living room, a flat-screen TV, an equipped kitchen with an oven and a microwave, and 1 bathroom with a shower. For added convenience, the property can provide towels and linens for a supplement.

Crin Blanc Beach is 1.1 km from the apartment, while Arles Amphitheatre is 39 km away. The nearest airport is Nimes-Ales-Camargue-Cevennes Airport, 41 km from Appartement de l'olivier."
Logis Le Nid du Pont de Gau,8.8,277 reviews,43.48931180,4.40394696,https://www.booking.com/hotel/fr/l-39-hostellerie-du-pont-de-gau.en-gb.html?aid=304142&label=gen173nr-1FCAEoggI46AdIM1gEaE2IAQGYAQm4AQrIAQXYAQHoAQH4AQOIAgGoAgO4Au2tn6oGwAIB0gIkMDlkOGFkZmUtNGQyZS00ZGM2LWEyZDAtYzBhMjcxODkzY2Vj2AIG4AIB&ucfs=1&arphpl=1&group_adults=2&req_adults=2&no_rooms=1&group_children=0&req_children=0&hpos=11&hapos=11&sr_order=bayesian_review_score&srpvid=9b817df7c94b0003&srepoch=1699206896&from_sustainable_property_sr=1&from=searchresults#hotelTmpl,"In this unspoiled natural setting of the Camargue, Le Nid du Pont de Gau offers you a warm welcome in its cozy accommodation.
Located 4 km from the village of Saintes Maries de la Mer and just 2 steps from the ornithological park, our family and friendly establishment is located in the middle of birds and ponds.

Just like at home, you will appreciate the comfort of our fully equipped apartments with a natural and relaxing atmosphere.
For an unusual and unforgettable stay, our Gypsy Caravan ""Ginès"" offers an atypical and colorful space with all mod cons where you will feel like a traveler.

You can enjoy our landscaped garden during the day in the shade of the fig trees and in the evening while admiring the flight of pink flamingos.
After your getaways, you will be delighted to refresh yourself on the terrace of our café around a local drink, a snack or an ice cream in a friendly atmosphere.

During your stay, we invite you to rest and relax as well as to explore our beautiful Camargue.
We love our region and our traditions. We are present and available if you want advice, we will be happy to share our good addresses and tips."
Gîtes Equestres Lou Caloun - Les Saintes Maries de la Mer,9.1,78 reviews,43.51843096,4.37782645,https://www.booking.com/hotel/fr/gites-equestres-les-cabanes-de-cambon-saintes-maries-de-la-mer.en-gb.html?aid=304142&label=gen173nr-1FCAEoggI46AdIM1gEaE2IAQGYAQm4AQrIAQXYAQHoAQH4AQOIAgGoAgO4Au2tn6oGwAIB0gIkMDlkOGFkZmUtNGQyZS00ZGM2LWEyZDAtYzBhMjcxODkzY2Vj2AIG4AIB&ucfs=1&arphpl=1&group_adults=2&req_adults=2&no_rooms=1&group_children=0&req_children=0&hpos=13&hapos=13&sr_order=bayesian_review_score&srpvid=9b817df7c94b0003&srepoch=1699206896&from_sustainable_property_sr=1&from=searchresults#hotelTmpl,"Offering a heated outdoor pool, Gîtes Equestres Lou Caloun - Les Saintes Maries de la Mer is located in Saintes-Maries-de-la-Mer. Free WiFi access is provided in this holiday home. This property organises horse rides along the marshes, the beach and the Petit Rhône River.

This holiday home offers a terrace, a dining area and a sofa. There is a full kitchenette with a microwave and an oven. Featuring a bath or shower, the private bathroom also comes with a hairdryer and free toiletries. You can enjoy garden views.

At Gîtes Equestres Lou Caloun - Les Saintes Maries de la Mer you will find a garden and barbecue facilities. Other facilities offered at the property include free bikes. An array of activities can be enjoyed on site or in the surroundings, including cycling and hiking.

This holiday home is 50 km from Montpellier Méditerranée Airport. The property offers free parking."
L'appartement de l'église,8.9,109 reviews,43.45155631,4.42827750,https://www.booking.com/hotel/fr/l-39-appartement-de-l-39-eglise.en-gb.html?aid=304142&label=gen173nr-1FCAEoggI46AdIM1gEaE2IAQGYAQm4AQrIAQXYAQHoAQH4AQOIAgGoAgO4Au2tn6oGwAIB0gIkMDlkOGFkZmUtNGQyZS00ZGM2LWEyZDAtYzBhMjcxODkzY2Vj2AIG4AIB&ucfs=1&arphpl=1&group_adults=2&req_adults=2&no_rooms=1&group_children=0&req_children=0&hpos=14&hapos=14&sr_order=bayesian_review_score&srpvid=9b817df7c94b0003&srepoch=1699206896&from=searchresults#hotelTmpl,"Offering free WiFi and free private parking, L'appartement de l'église is set in Saintes-Maries-de-la-Mer, just 200 metres from Amphora Beach. The air-conditioned accommodation is 300 metres from Arenas Beach.

The apartment features 1 bedroom, a flat-screen TV, an equipped kitchen with a microwave and a toaster, a washing machine, and 1 bathroom with a shower.

Crin Blanc Beach is 700 metres from the apartment, while Arles Amphitheatre is 39 km away. The nearest airport is Nimes-Ales-Camargue-Cevennes Airport, 41 km from L'appartement de l'église."
Gite Armieux,9.3,172 reviews,43.47279015,4.40106511,https://www.booking.com/hotel/fr/gite-armieux.en-gb.html?aid=304142&label=gen173nr-1FCAEoggI46AdIM1gEaE2IAQGYAQm4AQrIAQXYAQHoAQH4AQOIAgGoAgO4Au2tn6oGwAIB0gIkMDlkOGFkZmUtNGQyZS00ZGM2LWEyZDAtYzBhMjcxODkzY2Vj2AIG4AIB&ucfs=1&arphpl=1&group_adults=2&req_adults=2&no_rooms=1&group_children=0&req_children=0&hpos=17&hapos=17&sr_order=bayesian_review_score&srpvid=9b817df7c94b0003&srepoch=1699206896&from=searchresults#hotelTmpl,"Set in Saintes-Maries-de-la-Mer, 39 km from Arles Amphitheatre and 49 km from Montpellier Arena, Gite Armieux offers free bikes and air conditioning. This holiday home offers free private parking, a 24-hour front desk and free WiFi.

The holiday home with a terrace and garden views features 1 bedroom, a living room, a flat-screen TV, an equipped kitchenette with an oven and a microwave, and 1 bathroom with a bath. Towels and bed linen are featured in the holiday home.

The holiday home offers a picnic area. A a children's playground is also available at Gite Armieux, while guests can also relax in the garden.

Parc des Expositions de Montpellier is 49 km from the accommodation. The nearest airport is Nimes-Ales-Camargue-Cevennes Airport, 40 km from Gite Armieux."
La Tramontane,9.0,"1,432 reviews",43.47260109,4.41012025,https://www.booking.com/hotel/fr/la-tramontane.en-gb.html?aid=304142&label=gen173nr-1FCAEoggI46AdIM1gEaE2IAQGYAQm4AQrIAQXYAQHoAQH4AQOIAgGoAgO4Au2tn6oGwAIB0gIkMDlkOGFkZmUtNGQyZS00ZGM2LWEyZDAtYzBhMjcxODkzY2Vj2AIG4AIB&ucfs=1&arphpl=1&group_adults=2&req_adults=2&no_rooms=1&group_children=0&req_children=0&hpos=10&hapos=10&sr_order=bayesian_review_score&srpvid=9b817df7c94b0003&srepoch=1699206896&from_sustainable_property_sr=1&from=searchresults#hotelTmpl,"La Tramontane welcomes you in Saintes-Maries-de-la-Mer, in the heart of the Camargues area. It offers individually-decorated rooms leading to the outdoor swimming pool, the garden and the private pond.

Soundproofed and air-conditioned, the guest rooms all feature a television and Wi-Fi access. They are decorated in a typical Provencal style and feature a private terrace overlooking the garden and the swimming pool.

We will have the pleasure to serve you on your terrace, at sunset, an aperitif accompanied by tapas to satisfy your gluttony or your appetite.  You can enjoy musical shows, such as the themed evening every Saturday night.

Free private secured parking is available on site."
Dolce Notte,9.2,32 reviews,43.45359222,4.42505292,https://www.booking.com/hotel/fr/lotissement-les-launes-du-couchant.en-gb.html?aid=304142&label=gen173nr-1FCAEoggI46AdIM1gEaE2IAQGYAQm4AQrIAQXYAQHoAQH4AQOIAgGoAgO4Au2tn6oGwAIB0gIkMDlkOGFkZmUtNGQyZS00ZGM2LWEyZDAtYzBhMjcxODkzY2Vj2AIG4AIB&ucfs=1&arphpl=1&group_adults=2&req_adults=2&no_rooms=1&group_children=0&req_children=0&hpos=25&hapos=25&sr_order=bayesian_review_score&srpvid=9b817df7c94b0003&srepoch=1699206896&from=searchresults#hotelTmpl,"Dolce Notte is set in Saintes-Maries-de-la-Mer, 600 metres from Arenas Beach and 600 metres from Amphora Beach, in an area where hiking can be enjoyed. This property offers access to a terrace, free private parking and free WiFi.

The air-conditioned apartment consists of 1 bedroom, a living room, a fully equipped kitchen with a microwave and a coffee machine, and 1 bathroom with a shower and a hair dryer. A flat-screen TV with cable channels is featured.

If you would like to discover the area, snorkelling, cycling and fishing are possible in the surroundings.

Crin Blanc Beach is 700 metres from the apartment, while Arles Amphitheatre is 39 km away. The nearest airport is Nimes-Ales-Camargue-Cevennes Airport, 41 km from Dolce Notte."
Hôtel L' Estelle en Camargue,8.9,125 reviews,43.47030030,4.39530373,https://www.booking.com/hotel/fr/l-estelle-en-camargue-les-saintes.en-gb.html?aid=304142&label=gen173nr-1FCAEoggI46AdIM1gEaE2IAQGYAQm4AQrIAQXYAQHoAQH4AQOIAgGoAgO4Au2tn6oGwAIB0gIkMDlkOGFkZmUtNGQyZS00ZGM2LWEyZDAtYzBhMjcxODkzY2Vj2AIG4AIB&ucfs=1&arphpl=1&group_adults=2&req_adults=2&no_rooms=1&group_children=0&req_children=0&hpos=23&hapos=23&sr_order=bayesian_review_score&srpvid=9b817df7c94b0003&srepoch=1699206896&from_sustainable_property_sr=1&from=searchresults#hotelTmpl,"Featuring an outdoor pool, Hotel L' Estelle en Camargue offers stylish accommodations in Les Saintes-Maries-de-la-Mer, just 3 km from the sea. Charging stations for electric cars are available on site.

All rooms are air-conditioned and have heating, a bathroom with shower and bathtub, satellite TV and Internet access.

The restaurant at L'Estelle en Camargue serves gourmet cuisine. You can also enjoy an aperitif at the piano bar (except during the summer) or on the terrace. For lunch, you can choose between a meal, a drink or a light snack.

There are many sites of cultural and traditional interest in the area."
Appartement LE BOIS FLOTTE,9.0,55 reviews,43.45064690,4.42469990,https://www.booking.com/hotel/fr/appartement-le-bois-flotte.en-gb.html?aid=304142&label=gen173nr-1FCAEoggI46AdIM1gEaE2IAQGYAQm4AQrIAQXYAQHoAQH4AQOIAgGoAgO4Au2tn6oGwAIB0gIkMDlkOGFkZmUtNGQyZS00ZGM2LWEyZDAtYzBhMjcxODkzY2Vj2AIG4AIB&ucfs=1&arphpl=1&group_adults=2&req_adults=2&no_rooms=1&group_children=0&req_children=0&hpos=24&hapos=24&sr_order=bayesian_review_score&srpvid=9b817df7c94b0003&srepoch=1699206896&from=searchresults#hotelTmpl,"Situated in Saintes-Maries-de-la-Mer, 400 metres from Crin Blanc Beach and 500 metres from Amphora Beach, Appartement LE BOIS FLOTTE offers air conditioning. The accommodation is 80 metres from the Arenas Beach and has free WiFithroughout the property.

The apartment features 2 bedrooms, 1 bathroom, bed linen, towels, a flat-screen TV, a fully equipped kitchen, and a terrace with garden views.

Arles Amphitheatre is 39 km from the apartment. The nearest airport is Nimes-Ales-Camargue-Cevennes Airport, 41 km from Appartement LE BOIS FLOTTE."
Appartement Domaine du soleil couchant,9.5,23 reviews,43.47128408,4.40963372,https://www.booking.com/hotel/fr/appartement-domaine-du-soleil-couchant.en-gb.html?aid=304142&label=gen173nr-1FCAEoggI46AdIM1gEaE2IAQGYAQm4AQrIAQXYAQHoAQH4AQOIAgGoAgO4Au2tn6oGwAIB0gIkMDlkOGFkZmUtNGQyZS00ZGM2LWEyZDAtYzBhMjcxODkzY2Vj2AIG4AIB&ucfs=1&arphpl=1&group_adults=2&req_adults=2&no_rooms=1&group_children=0&req_children=0&hpos=22&hapos=22&sr_order=bayesian_review_score&srpvid=9b817df7c94b0003&srepoch=1699206896&from=searchresults#hotelTmpl,"Boasting garden views, Appartement Domaine du soleil couchant provides accommodation with a terrace and a coffee machine, around 38 km from Arles Amphitheatre. Featuring free private parking, the apartment is in an area where guests can engage in activities such as snorkelling, cycling and fishing.

This apartment comes with 2 bedrooms, a kitchen with a microwave and a toaster, a flat-screen TV, a seating area and 1 bathroom equipped with a shower.

There is a garden with a barbecue at this property and guests can go hiking and walking tours nearby.

The nearest airport is Nimes-Ales-Camargue-Cevennes Airport, 40 km from the apartment."
