hotel_name,hotel_score,hotel_reviews,hotel_lat,hotel_lon,hotel_url,hotel_description
Sublime appartement avec balneo,,,43.65187500,1.43870100,https://www.booking.com/hotel/fr/appart-cosy-avec-balneo.en-gb.html?aid=304142&label=gen173nr-1FCAEoggI46AdIM1gEaE2IAQGYAQm4AQrIAQXYAQHoAQH4AQOIAgGoAgO4Aqasn6oGwAIB0gIkOTI3MWQzNjMtZWRjNy00MjcwLThkYjEtNTJjNmIzMjU3ODQ32AIG4AIB&ucfs=1&arphpl=1&group_adults=2&req_adults=2&no_rooms=1&group_children=0&req_children=0&hpos=22&hapos=47&sr_order=bayesian_review_score&srpvid=17627d9305d1000b&srepoch=1699206697&from=searchresults#hotelTmpl,"Set in the Toulouse North district of Toulouse, Sublime appartement avec balneo offers accommodation with a private pool and full-day security. This property offers access to a balcony, tennis at the tennis court, free private parking and free WiFi.

The air-conditioned apartment consists of 1 bedroom, a living room, a fully equipped kitchen with a microwave and a coffee machine, and 1 bathroom with a hot tub and free toiletries. Towels and bed linen are offered in the apartment.

The apartment offers a range of wellness facilities including a hot tub and a fitness room.

Amphitheatre Purpan-Ancely is 8.1 km from Sublime appartement avec balneo, while Toulouse Stadium is 10 km from the property. The nearest airport is Toulouse-Blagnac Airport, 8 km from the accommodation."
Mama Shelter Toulouse,8.6,"1,449 reviews",43.60541400,1.44993400,https://www.booking.com/hotel/fr/mama-shelter-toulouse.en-gb.html?aid=304142&label=gen173nr-1FCAEoggI46AdIM1gEaE2IAQGYAQm4AQrIAQXYAQHoAQH4AQOIAgGoAgO4Aqasn6oGwAIB0gIkOTI3MWQzNjMtZWRjNy00MjcwLThkYjEtNTJjNmIzMjU3ODQ32AIG4AIB&ucfs=1&arphpl=1&group_adults=2&req_adults=2&no_rooms=1&group_children=0&req_children=0&hpos=24&hapos=49&sr_order=bayesian_review_score&srpvid=17627d9305d1000b&srepoch=1699206697&from=searchresults#hotelTmpl,"Mama Shelter Toulouse provides rooms in Toulouse, 2.2 km from Toulouse Expo, 2.8 km from Toulouse Stadium and 3.3 km from Zénith de Toulouse.

The air-conditioned rooms feature free WiFi, a desk and a flat-screen TV with cable channels and streaming services. They also have a private bathroom with a shower, a hairdryer and free toiletries. All rooms are serviced by a lift.

Mama Shelter Toulouse offers a 45-seat cinema and a large rooftop terrace, where guests can enjoy a glass of local wine and fresh pizzas from the brick oven. The on-site restaurant features a BBQ and Argentine grill, and also serves local and homemade cuisine.

Staff at the 24-hour front desk can provide tips on the area.

Basilica St.-Sernin is a 12-minute walk away and Amphitheatre Purpan-Ancely is 4.4 km from Mama Shelter Toulouse, while Place du Capitole is 500 metres away. Toulouse-Blagnac Airport is 7 km from the property."
Appartement T2 40 m2 - Tout équipé et calme,9.3,18 reviews,43.59563430,1.45744600,https://www.booking.com/hotel/fr/appartement-t2-40-m2-tout-equipe-et-calme.en-gb.html?aid=304142&label=gen173nr-1FCAEoggI46AdIM1gEaE2IAQGYAQm4AQrIAQXYAQHoAQH4AQOIAgGoAgO4Aqasn6oGwAIB0gIkOTI3MWQzNjMtZWRjNy00MjcwLThkYjEtNTJjNmIzMjU3ODQ32AIG4AIB&ucfs=1&arphpl=1&group_adults=2&req_adults=2&no_rooms=1&group_children=0&req_children=0&hpos=20&hapos=45&sr_order=bayesian_review_score&srpvid=17627d9305d1000b&srepoch=1699206697&from_sustainable_property_sr=1&from=searchresults#hotelTmpl,"In the Toulouse East district of Toulouse, close to Jardin Royal, Appartement T2 40 m2 - Tout équipé et calme features free bikes and a washing machine. The accommodation is 4.1 km from Toulouse Stadium, and guests benefit from complimentary WiFi and private parking available on site.

The apartment is fitted with 1 bedroom, 1 bathroom, bed linen, towels, a flat-screen TV with streaming services, a dining area, a fully equipped kitchen, and a balcony with garden views.

The apartment has a garden and sun terrace.

Popular points of interest near Appartement T2 40 m2 - Tout équipé et calme include Esquirol Metro Station, Carmes Metro Station and Jean-Jaures Metro Station. The nearest airport is Toulouse-Blagnac Airport, 9 km from the accommodation."
Hotel Arena Toulouse,8.8,"1,307 reviews",43.58433770,1.49191968,https://www.booking.com/hotel/fr/arena-toulouse.en-gb.html?aid=304142&label=gen173nr-1FCAEoggI46AdIM1gEaE2IAQGYAQm4AQrIAQXYAQHoAQH4AQOIAgGoAgO4Aqasn6oGwAIB0gIkOTI3MWQzNjMtZWRjNy00MjcwLThkYjEtNTJjNmIzMjU3ODQ32AIG4AIB&ucfs=1&arphpl=1&group_adults=2&req_adults=2&no_rooms=1&group_children=0&req_children=0&hpos=18&hapos=43&sr_order=bayesian_review_score&srpvid=17627d9305d1000b&srepoch=1699206697&from_sustainable_property_sr=1&from=searchresults#hotelTmpl,"Situated conveniently in the Toulouse South-East district of Toulouse, Hotel Arena Toulouse is situated 7.3 km from Toulouse Stadium, 9.3 km from Zénith de Toulouse and 18 km from Amphitheatre Purpan-Ancely. With a garden, the 3-star hotel has air-conditioned rooms with free WiFi, each with a private bathroom. The property is non-smoking and is set 6.7 km from Diagora Convention Centre.

The units come with a flat-screen TV with satellite channels, a kettle, a shower, free toiletries and a desk. The rooms feature a wardrobe.

A continental breakfast is available every morning at the hotel.

Cité de l'Espace is 600 metres from Hotel Arena Toulouse, while Jardin Royal is 5.4 km away. The nearest airport is Toulouse-Blagnac Airport, 18 km from the accommodation."
Hypercentre Toulouse 6 joli appartement climatisé et équipé,8.0,21 reviews,43.60275790,1.44348250,https://www.booking.com/hotel/fr/hypercentre-toulouse-6-joli-appartement-meuble.en-gb.html?aid=304142&label=gen173nr-1FCAEoggI46AdIM1gEaE2IAQGYAQm4AQrIAQXYAQHoAQH4AQOIAgGoAgO4Aqasn6oGwAIB0gIkOTI3MWQzNjMtZWRjNy00MjcwLThkYjEtNTJjNmIzMjU3ODQ32AIG4AIB&ucfs=1&arphpl=1&group_adults=2&req_adults=2&no_rooms=1&group_children=0&req_children=0&hpos=17&hapos=42&sr_order=bayesian_review_score&srpvid=17627d9305d1000b&srepoch=1699206697&from_sustainable_property_sr=1&from=searchresults#hotelTmpl,"Situated in the centre of Toulouse, 3.2 km from Zénith de Toulouse and 3.2 km from Toulouse Stadium, Hypercentre Toulouse 6 joli appartement climatisé et équipé offers free WiFi. This apartment is 6.1 km from Amphitheatre Purpan-Ancely and 13 km from Diagora Convention Centre.

This air-conditioned apartment has 1 bedroom, a flat-screen TV, a dining area, a kitchen with a microwave, and a living room. Towels and bed linen are available in the apartment.

Popular points of interest near the apartment include Le Pont Neuf, Carmes Metro Station and Esquirol Metro Station. The nearest airport is Toulouse-Blagnac Airport, 8 km from Hypercentre Toulouse 6 joli appartement climatisé et équipé."
hotel_name,hotel_score,hotel_reviews,hotel_lat,hotel_lon,hotel_url,hotel_description
Le Clos des Salins,9.6,377 reviews,43.59441362,1.44607276,https://www.booking.com/hotel/fr/le-clos-des-salins.en-gb.html?aid=304142&label=gen173nr-1FCAEoggI46AdIM1gEaE2IAQGYAQm4AQrIAQXYAQHoAQH4AQOIAgGoAgO4Aoeun6oGwAIB0gIkNDQxN2JjZmMtNTFhOC00ZTE4LTk2MDQtZjBlMjBmZmM4Mjgz2AIG4AIB&ucfs=1&arphpl=1&group_adults=2&req_adults=2&no_rooms=1&group_children=0&req_children=0&hpos=1&hapos=1&sr_order=bayesian_review_score&srpvid=cd2e7e0419fc05d9&srepoch=1699206922&from=searchresults#hotelTmpl,"In the heart of Toulouse historic city centre, 450 metres from Carmes metro station, a 5-minute walk from tramway T2 which goes to the airport, and a 10-minute walk from Capitole Square, Le Clos des Salins is a modern building with free Wi-Fi.

Each apartment has air conditioning, a washing machine, a private bathroom with shower and hairdryer, and private toilets. There is also a seating area with flat-screen TV, a fully equipped kitchen and ironing facilities. The studios have access to a shared washing machine.

Set 16 km from Toulouse-Blagnac Airport, Le Clos des Salins is also just 3 km from the A620 Motorway."
La Bulle dans le Palmier,9.5,165 reviews,43.58511580,1.42518030,https://www.booking.com/hotel/fr/la-bulle-dans-le-palmier.en-gb.html?aid=304142&label=gen173nr-1FCAEoggI46AdIM1gEaE2IAQGYAQm4AQrIAQXYAQHoAQH4AQOIAgGoAgO4Aoeun6oGwAIB0gIkNDQxN2JjZmMtNTFhOC00ZTE4LTk2MDQtZjBlMjBmZmM4Mjgz2AIG4AIB&ucfs=1&arphpl=1&group_adults=2&req_adults=2&no_rooms=1&group_children=0&req_children=0&hpos=5&hapos=5&sr_order=bayesian_review_score&srpvid=cd2e7e0419fc05d9&srepoch=1699206922&from_sustainable_property_sr=1&from=searchresults#hotelTmpl,"Situated in Toulouse, 1 km from Toulouse Stadium, La Bulle dans le Palmier provides air-conditioned accommodation and a garden. Boasting family rooms, this property also provides guests with a sun terrace. The accommodation features a shared kitchen, full-day security and luggage storage for guests.

At the guest house, rooms include a wardrobe. Featuring a private bathroom with a shower and free toiletries, rooms at La Bulle dans le Palmier also boast free WiFi. At the accommodation rooms have bed linen and towels.

A continental breakfast is available each morning at La Bulle dans le Palmier.

The guest house offers a picnic area. Guests at La Bulle dans le Palmier will be able to enjoy activities in and around Toulouse, like walking tours.

Zénith de Toulouse is 3.1 km from the accommodation, while Amphitheatre Purpan-Ancely is 6 km from the property. The nearest airport is Toulouse-Blagnac Airport, 7 km from La Bulle dans le Palmier."
La Closerie aux Violettes - Maison d'hôtes,9.3,126 reviews,43.55458200,1.46719000,https://www.booking.com/hotel/fr/la-closerie-aux-violettes.en-gb.html?aid=304142&label=gen173nr-1FCAEoggI46AdIM1gEaE2IAQGYAQm4AQrIAQXYAQHoAQH4AQOIAgGoAgO4Aoeun6oGwAIB0gIkNDQxN2JjZmMtNTFhOC00ZTE4LTk2MDQtZjBlMjBmZmM4Mjgz2AIG4AIB&ucfs=1&arphpl=1&group_adults=2&req_adults=2&no_rooms=1&group_children=0&req_children=0&hpos=7&hapos=7&sr_order=bayesian_review_score&srpvid=cd2e7e0419fc05d9&srepoch=1699206922&from_sustainable_property_sr=1&from=searchresults#hotelTmpl,"Set 5.6 km from Diagora Convention Centre, La Closerie aux Violettes - Maison d'hôtes offers accommodation with free WiFi and free private parking.

All units come with a seating area, a flat-screen TV with cable channels and a private bathroom with a hair dryer and walk-in shower.

The bed and breakfast offers a picnic area.

La Closerie aux Violettes - Maison d'hôtes features a garden and sun terrace.

Toulouse Stadium is 5.7 km from the accommodation, while Zénith de Toulouse is 11 km away. The nearest airport is Toulouse-Blagnac Airport, 14 km from La Closerie aux Violettes - Maison d'hôtes."
Amido Zen,9.5,156 reviews,43.60800470,1.41740940,https://www.booking.com/hotel/fr/amido-zen.en-gb.html?aid=304142&label=gen173nr-1FCAEoggI46AdIM1gEaE2IAQGYAQm4AQrIAQXYAQHoAQH4AQOIAgGoAgO4Aoeun6oGwAIB0gIkNDQxN2JjZmMtNTFhOC00ZTE4LTk2MDQtZjBlMjBmZmM4Mjgz2AIG4AIB&ucfs=1&arphpl=1&group_adults=2&req_adults=2&no_rooms=1&group_children=0&req_children=0&hpos=6&hapos=6&sr_order=bayesian_review_score&srpvid=cd2e7e0419fc05d9&srepoch=1699206922&from_sustainable_property_sr=1&from=searchresults#hotelTmpl,"Set in Toulouse, AMIDO ZEN offers accommodation with a garden. Well situated in the Compans district, the property is situated 1.2 km from Zénith de Toulouse and 1.8 km from Amphitheatre Purpan-Ancely. The property is 2.7 km from Toulouse Expo.

The room in this bed and breakfast is equipped with a coffee machine. It has a private bathroom and offers views of the garden.

Ingredients for a continental breakfast are provided daily so that guests can help themselves.

A bus and city bike station can be found 300 metres away. Toulouse Stadium is 3.1 km from the accommodation, while Jardin Japonais is 1.3 km away. Ernest Wallon stadium is 800 metres away. Airbus industrial site is 3 km away. Toulouse-Blagnac Airport is 4 km from the property. Subject to availability, guests can park their cars free of charge in the streets nearby."
Aparthotel Adagio Original Toulouse Centre La Grave,9.2,219 reviews,43.59971338,1.43289982,https://www.booking.com/hotel/fr/aparthotel-adagio-original-toulouse-centre-la-grave.en-gb.html?aid=304142&label=gen173nr-1FCAEoggI46AdIM1gEaE2IAQGYAQm4AQrIAQXYAQHoAQH4AQOIAgGoAgO4Aoeun6oGwAIB0gIkNDQxN2JjZmMtNTFhOC00ZTE4LTk2MDQtZjBlMjBmZmM4Mjgz2AIG4AIB&ucfs=1&arphpl=1&group_adults=2&req_adults=2&no_rooms=1&group_children=0&req_children=0&hpos=9&hapos=9&sr_order=bayesian_review_score&srpvid=cd2e7e0419fc05d9&srepoch=1699206922&from_sustainable_property_sr=1&from=searchresults#hotelTmpl,"Aparthotel Adagio Original Toulouse Centre La Grave is set in the Toulouse Left Bank district of Toulouse, 2.2 km from Zénith de Toulouse and 2.9 km from Toulouse Stadium. Complimentary WiFi is featured throughout the property and private parking is available on site.

Accommodation is fitted with air conditioning, a fully equipped kitchen with a dining area, a flat-screen TV and a private bathroom with a bath or shower, a hair dryer and free toiletries. A dishwasher, a microwave and fridge are also offered, as well as a coffee machine and a kettle.

Buffet and continental breakfast options are available every morning at the aparthotel.

Popular points of interest near Aparthotel Adagio Original Toulouse Centre La Grave include Saint-Cyprien Republique Metro Station, Le Pont Neuf and Carmes Metro Station. The nearest airport is Toulouse-Blagnac Airport, 7 km from the accommodation."
La Mélanotte,9.3,454 reviews,43.56690800,1.37499800,https://www.booking.com/hotel/fr/la-melanotte.en-gb.html?aid=304142&label=gen173nr-1FCAEoggI46AdIM1gEaE2IAQGYAQm4AQrIAQXYAQHoAQH4AQOIAgGoAgO4Aoeun6oGwAIB0gIkNDQxN2JjZmMtNTFhOC00ZTE4LTk2MDQtZjBlMjBmZmM4Mjgz2AIG4AIB&ucfs=1&arphpl=1&group_adults=2&req_adults=2&no_rooms=1&group_children=0&req_children=0&hpos=4&hapos=4&sr_order=bayesian_review_score&srpvid=cd2e7e0419fc05d9&srepoch=1699206922&from=searchresults#hotelTmpl,"Set in Toulouse, 6 km from Zénith de Toulouse and 7 km from Toulouse Stadium, La Mélanotte offers accommodation with free WiFi, air conditioning, a seasonal outdoor swimming pool and a garden.

The bed and breakfast offers a flat-screen TV and a private bathroom with a hairdryer, free toiletries and shower.

Guests at La Mélanotte can enjoy a continental breakfast.

A barbecue and a sun terrace are available for guests at the accommodation to use.

MEET (MEET is 15 km from La Mélanotte), while Amphitheatre Purpan-Ancely is 10 km from the property. The nearest airport is Toulouse-Blagnac Airport, 12 km from the bed and breakfast."
Boutique Hotel SOCLO,9.5,369 reviews,43.60536000,1.43826100,https://www.booking.com/hotel/fr/soclo.en-gb.html?aid=304142&label=gen173nr-1FCAEoggI46AdIM1gEaE2IAQGYAQm4AQrIAQXYAQHoAQH4AQOIAgGoAgO4Aoeun6oGwAIB0gIkNDQxN2JjZmMtNTFhOC00ZTE4LTk2MDQtZjBlMjBmZmM4Mjgz2AIG4AIB&ucfs=1&arphpl=1&group_adults=2&req_adults=2&no_rooms=1&group_children=0&req_children=0&hpos=2&hapos=2&sr_order=bayesian_review_score&srpvid=cd2e7e0419fc05d9&srepoch=1699206922&from=searchresults#hotelTmpl,"Boutique Hotel SOCLO has a seasonal outdoor swimming pool, garden, a shared lounge and terrace in Toulouse. Among the facilities of this property are a restaurant, room service and a 24-hour front desk, along with free WiFi throughout the property. The property is 3.9 km from Toulouse Stadium, and within 500 metres of the city centre.

Popular points of interest near the hotel include Compans Caffarelli Metro Station, Le Pont Neuf and Jeanne d'Arc Metro Station. The nearest airport is Toulouse-Blagnac Airport, 7 km from Boutique Hotel SOCLO."
COSY LODGE TOULOUSE,9.5,118 reviews,43.64613600,1.43618700,https://www.booking.com/hotel/fr/cosy-lodge-toulouse.en-gb.html?aid=304142&label=gen173nr-1FCAEoggI46AdIM1gEaE2IAQGYAQm4AQrIAQXYAQHoAQH4AQOIAgGoAgO4Aoeun6oGwAIB0gIkNDQxN2JjZmMtNTFhOC00ZTE4LTk2MDQtZjBlMjBmZmM4Mjgz2AIG4AIB&ucfs=1&arphpl=1&group_adults=2&req_adults=2&no_rooms=1&group_children=0&req_children=0&hpos=3&hapos=3&sr_order=bayesian_review_score&srpvid=cd2e7e0419fc05d9&srepoch=1699206922&from_sustainable_property_sr=1&from=searchresults#hotelTmpl,"Situated 6.7 km from Amphitheatre Purpan-Ancely and 8.8 km from Zénith de Toulouse, COSY LODGE TOULOUSE in Toulouse features air-conditioned accommodation with views of the garden and free WiFi.

The units come with tiled floors and feature a fully equipped kitchen with a dishwasher, a dining area, a flat-screen TV with satellite channels, and a private bathroom with shower and a hair dryer. A microwave, a toaster and fridge are also available, as well as a coffee machine and a kettle.

Guests at the bed and breakfast can enjoy a continental breakfast.

COSY LODGE TOULOUSE has a barbecue, garden and sun terrace.

Toulouse Stadium is 8.9 km from the accommodation, while Diagora Convention Centre is 17 km from the property. The nearest airport is Toulouse-Blagnac, 7 km from COSY LODGE TOULOUSE, and the property offers a paid airport shuttle service."
"L'Insolite Spa Privatif ''Suite Luxueuse-Jacuzzi""",9.2,179 reviews,43.64778680,1.44806290,https://www.booking.com/hotel/fr/l-39-insolite-spa-privatif.en-gb.html?aid=304142&label=gen173nr-1FCAEoggI46AdIM1gEaE2IAQGYAQm4AQrIAQXYAQHoAQH4AQOIAgGoAgO4Aoeun6oGwAIB0gIkNDQxN2JjZmMtNTFhOC00ZTE4LTk2MDQtZjBlMjBmZmM4Mjgz2AIG4AIB&ucfs=1&arphpl=1&group_adults=2&req_adults=2&no_rooms=1&group_children=0&req_children=0&hpos=10&hapos=10&sr_order=bayesian_review_score&srpvid=cd2e7e0419fc05d9&srepoch=1699206922&from=searchresults#hotelTmpl,"Boasting a spa bath, L'Insolite Spa Privatif ''Suite Luxueuse-Jacuzzi"" is situated in Toulouse. The air-conditioned accommodation is 10 km from Amphitheatre Purpan-Ancely, and guests benefit from private parking available on site and free WiFi.

The apartment has 1 bedroom, 1 bathroom, bed linen, towels, a flat-screen TV with satellite channels, a dining area, a fully equipped kitchen, and a terrace with garden views.

At the apartment guests are welcome to take advantage of a hot tub and spa facilities.

Toulouse Stadium is 10 km from L'Insolite Spa Privatif ''Suite Luxueuse-Jacuzzi"", while Zénith de Toulouse is 12 km from the property. The nearest airport is Toulouse-Blagnac Airport, 10 km from the accommodation."
Gite La Chartreuse du Canal du Midi,9.3,135 reviews,43.59225640,1.46041545,https://www.booking.com/hotel/fr/la-chartreuse-du-canal-du-midi.en-gb.html?aid=304142&label=gen173nr-1FCAEoggI46AdIM1gEaE2IAQGYAQm4AQrIAQXYAQHoAQH4AQOIAgGoAgO4Aoeun6oGwAIB0gIkNDQxN2JjZmMtNTFhOC00ZTE4LTk2MDQtZjBlMjBmZmM4Mjgz2AIG4AIB&ucfs=1&arphpl=1&group_adults=2&req_adults=2&no_rooms=1&group_children=0&req_children=0&hpos=8&hapos=8&sr_order=bayesian_review_score&srpvid=cd2e7e0419fc05d9&srepoch=1699206922&from_sustainable_property_sr=1&from=searchresults#hotelTmpl,"Located 3.4 km from Toulouse Stadium, Gite La Chartreuse du Canal du Midi offers accommodation with a terrace, as well as a garden. Complimentary WiFi is offeredthroughout the property.

Featuring a kitchen with an oven and a microwave, each unit also comes with a safety deposit box, a satellite flat-screen TV, ironing facilities, desk and a seating area with a sofa. A toaster, a fridge and stovetop are also provided, as well as a coffee machine and a kettle.

Skiing, cycling and hiking are possible within the area, and a water park is available on site.

Popular points of interest near the holiday home include Jardin Royal, Carmes Metro Station and Jean-Jaures Metro Station. The nearest airport is Toulouse-Blagnac Airport, 10 km from Gite La Chartreuse du Canal du Midi."
"L’Insolite, Spa Privatif (Appartement Jacuzzi)",9.2,215 reviews,43.63468675,1.44813585,https://www.booking.com/hotel/fr/40-rue-paul-valery.en-gb.html?aid=304142&label=gen173nr-1FCAEoggI46AdIM1gEaE2IAQGYAQm4AQrIAQXYAQHoAQH4AQOIAgGoAgO4Aoeun6oGwAIB0gIkNDQxN2JjZmMtNTFhOC00ZTE4LTk2MDQtZjBlMjBmZmM4Mjgz2AIG4AIB&ucfs=1&arphpl=1&group_adults=2&req_adults=2&no_rooms=1&group_children=0&req_children=0&hpos=11&hapos=11&sr_order=bayesian_review_score&srpvid=cd2e7e0419fc05d9&srepoch=1699206922&from=searchresults#hotelTmpl,"L’Insolite, Spa Privatif (Appartement Jacuzzi), a property with a spa and wellness centre, is situated in Toulouse, 8.2 km from Toulouse Stadium, 8.7 km from Zénith de Toulouse, as well as 17 km from Diagora Convention Centre. The accommodation is 6.6 km from the Amphitheatre Purpan-Ancely and has free WiFithroughout the property.

Featuring a balcony, this apartment also includes a flat-screen TV, a well-equipped kitchen with a dishwasher, an oven and a microwave, as well as 1 bathroom with a hot tub and bathrobes.

The apartment offers 4-star accommodation with a hot tub and sun terrace.

Toulouse-Matabiau Station is 3.5 km from L’Insolite, Spa Privatif (Appartement Jacuzzi), while Jeanne d'Arc Metro Station is 3.9 km from the property. The nearest airport is Toulouse-Blagnac Airport, 7 km from the accommodation."
Secret Night,9.2,53 reviews,43.58525880,1.44080730,https://www.booking.com/hotel/fr/secret-room.en-gb.html?aid=304142&label=gen173nr-1FCAEoggI46AdIM1gEaE2IAQGYAQm4AQrIAQXYAQHoAQH4AQOIAgGoAgO4Aoeun6oGwAIB0gIkNDQxN2JjZmMtNTFhOC00ZTE4LTk2MDQtZjBlMjBmZmM4Mjgz2AIG4AIB&ucfs=1&arphpl=1&group_adults=2&req_adults=2&no_rooms=1&group_children=0&req_children=0&hpos=14&hapos=14&sr_order=bayesian_review_score&srpvid=cd2e7e0419fc05d9&srepoch=1699206922&from=searchresults#hotelTmpl,"Secret Night features a terrace and is set in Toulouse, within just 800 metres of Toulouse Stadium and 1.6 km of Carmes Metro Station. Situated 4.6 km from Zénith de Toulouse, the property offers a casino.

The apartment is located on the ground floor and is fitted with 1 bedroom, a flat-screen TV and a fully equipped kitchen that provides guests with a microwave and a fridge. Towels and bed linen are featured in the apartment.

The apartment also has a wellness area, where guests can make the most of facilities like a hot tub.

Popular points of interest near Secret Night include Jardin Royal, Le Pont Neuf and Esquirol Metro Station. The nearest airport is Toulouse-Blagnac Airport, 8 km from the accommodation."
☆ 16ème ciel ☆ Proche gare ☆ Vue panoramique ☆ Clim.,9.2,61 reviews,43.61584130,1.44131700,https://www.booking.com/hotel/fr/16eme-ciel-proche-gare-vue-panoramique-clim.en-gb.html?aid=304142&label=gen173nr-1FCAEoggI46AdIM1gEaE2IAQGYAQm4AQrIAQXYAQHoAQH4AQOIAgGoAgO4Aoeun6oGwAIB0gIkNDQxN2JjZmMtNTFhOC00ZTE4LTk2MDQtZjBlMjBmZmM4Mjgz2AIG4AIB&ucfs=1&arphpl=1&group_adults=2&req_adults=2&no_rooms=1&group_children=0&req_children=0&hpos=15&hapos=15&sr_order=bayesian_review_score&srpvid=cd2e7e0419fc05d9&srepoch=1699206922&from=searchresults#hotelTmpl,"Located in Toulouse, 6 km from Toulouse Stadium and 6.5 km from Amphitheatre Purpan-Ancely, ☆ 16ème ciel ☆ Proche gare ☆ Vue panoramique ☆ Clim. Provides air-conditioned accommodation with a balcony and free WiFi. It is situated 7 km from Zénith de Toulouse and features a lift.

This apartment is equipped with 1 bedroom, a kitchenette with a microwave and a toaster, a flat-screen TV, a seating area and 1 bathroom equipped with a shower. Towels and bed linen are provided in the apartment.

The apartment offers a sun terrace.

Popular points of interest near ☆ 16ème ciel ☆ Proche gare ☆ Vue panoramique ☆ Clim. Include Toulouse-Matabiau Station, Jeanne d'Arc Metro Station and Jean-Jaures Metro Station. The nearest airport is Toulouse-Blagnac Airport, 7 km from the accommodation."
La Villa des Violettes,9.3,106 reviews,43.65550901,1.43188991,https://www.booking.com/hotel/fr/la-villa-des-violettes.en-gb.html?aid=304142&label=gen173nr-1FCAEoggI46AdIM1gEaE2IAQGYAQm4AQrIAQXYAQHoAQH4AQOIAgGoAgO4Aoeun6oGwAIB0gIkNDQxN2JjZmMtNTFhOC00ZTE4LTk2MDQtZjBlMjBmZmM4Mjgz2AIG4AIB&ucfs=1&arphpl=1&group_adults=2&req_adults=2&no_rooms=1&group_children=0&req_children=0&hpos=12&hapos=12&sr_order=bayesian_review_score&srpvid=cd2e7e0419fc05d9&srepoch=1699206922&from=searchresults#hotelTmpl,"Located in Toulouse, La Villa des Violettes offers an outdoor swimming pool, garden and terrace with BBQ facilities. Place du Capitole is a 10-minute drive away.

Accessed by a private entrance, all rooms are air-conditioned and feature a view of the garden, wooden flooring and a wardrobe. The en suite bathroom is complete with a hairdryer and free toiletries.

A breakfast serving hot drinks, fruit juice, pastries, cereal and eggs is provided each morning. It can be eaten on the terrace during summer or in the large dining area during winter.

Blagnac Airport is ideally located a 15-minute drive away and Jardin du Grand-Rond is 7.5 km from the property. Additional features include bicycle rental, free Wi-Fi access and free private parking on site."
Le typique - coeur de ville,9.2,102 reviews,43.60264340,1.44347490,https://www.booking.com/hotel/fr/le-typique-coeur-de-ville.en-gb.html?aid=304142&label=gen173nr-1FCAEoggI46AdIM1gEaE2IAQGYAQm4AQrIAQXYAQHoAQH4AQOIAgGoAgO4Aoeun6oGwAIB0gIkNDQxN2JjZmMtNTFhOC00ZTE4LTk2MDQtZjBlMjBmZmM4Mjgz2AIG4AIB&ucfs=1&arphpl=1&group_adults=2&req_adults=2&no_rooms=1&group_children=0&req_children=0&hpos=17&hapos=17&sr_order=bayesian_review_score&srpvid=cd2e7e0419fc05d9&srepoch=1699206922&from=searchresults#hotelTmpl,"Located in the centre of Toulouse, 3.2 km from Zénith de Toulouse and 3.2 km from Toulouse Stadium, Le typique - coeur de ville offers free WiFi. The 1-star apartment is 6.1 km from Amphitheatre Purpan-Ancely.

This apartment is equipped with 1 bedroom, a kitchen with a dishwasher and a microwave, a flat-screen TV, a seating area and 1 bathroom. Towels and bed linen are provided in the apartment.

Popular points of interest near the apartment include Le Pont Neuf, Carmes Metro Station and Esquirol Metro Station. The nearest airport is Toulouse-Blagnac Airport, 8 km from Le typique - coeur de ville."
