hotel_name,hotel_score,hotel_reviews,hotel_lat,hotel_lon,hotel_url,hotel_description
Les Loges des Chalets,9.2,142 reviews,43.61405143,1.44794021,https://www.booking.com/hotel/fr/les-loges-des-chalets.en-gb.html?aid=304142&label=gen173nr-1FCAEoggI46AdIM1gEaE2IAQGYAQm4AQrIAQXYAQHoAQH4AQOIAgGoAgO4Aoeun6oGwAIB0gIkNDQxN2JjZmMtNTFhOC00ZTE4LTk2MDQtZjBlMjBmZmM4Mjgz2AIG4AIB&ucfs=1&arphpl=1&group_adults=2&req_adults=2&no_rooms=1&group_children=0&req_children=0&hpos=13&hapos=13&sr_order=bayesian_review_score&srpvid=cd2e7e0419fc05d9&srepoch=1699206922&from_sustainable_property_sr=1&from=searchresults#hotelTmpl,"Located in Toulouse centre, 5.1 km from Toulouse Stadium and 6.1 km from Zénith de Toulouse, Les Loges des Chalets provides accommodation with free WiFi and a balcony.

The apartment provides guests with a terrace, garden views, a seating area, a flat-screen TV, a fully equipped kitchen with a dishwasher and an oven, and a private bathroom with shower and a hair dryer. A microwave, a toaster and fridge are also provided, as well as a coffee machine and a kettle.

Les Loges des Chalets offers a picnic area.

Guests at the accommodation can enjoy hiking nearby, or make the most of the garden.

Popular points of interest near Les Loges des Chalets include Toulouse-Matabiau Station, Jeanne d'Arc Metro Station and Jean-Jaures Metro Station. The nearest airport is Toulouse-Blagnac Airport, 7 km from the apartment."
La Galerie,9.4,139 reviews,43.62902661,1.47511922,https://www.booking.com/hotel/fr/la-galerie-toulouse.en-gb.html?aid=304142&label=gen173nr-1FCAEoggI46AdIM1gEaE2IAQGYAQm4AQrIAQXYAQHoAQH4AQOIAgGoAgO4Aoeun6oGwAIB0gIkNDQxN2JjZmMtNTFhOC00ZTE4LTk2MDQtZjBlMjBmZmM4Mjgz2AIG4AIB&ucfs=1&arphpl=1&group_adults=2&req_adults=2&no_rooms=1&group_children=0&req_children=0&hpos=25&hapos=25&sr_order=bayesian_review_score&srpvid=cd2e7e0419fc05d9&srepoch=1699206922&from=searchresults#hotelTmpl,"Offering a seasonal outdoor pool, a garden and large terraces, La Galerie is a charming guest house situated in Toulouse in the Midi-Pyrénées Region, 6 km from Toulouse Expo. Toulouse town centre can be reached in 10 minutes by metro.

The spacious bedrooms have a seating area, a flat-screen TV, as well as an iPod docking station and a coffee machine. They also have a balcony or terrace and for your comfort, you will find free toiletries and a hairdryer. La Galerie features free WiFi throughout the property. The three rooms feature an air conditioning.

You will find a large guest lounge at the property, as well as a fitness room.

Toulouse Stadium is 6 km from La Galerie, while Zénith de Toulouse is 6 km away. Toulouse-Blagnac Airport and Airbus are located 10 minutes' drive away."
"Suite jacuzzi ""spa privatif """,8.9,147 reviews,43.63630390,1.44785533,https://www.booking.com/hotel/fr/suite-jacuzzi.en-gb.html?aid=304142&label=gen173nr-1FCAEoggI46AdIM1gEaE2IAQGYAQm4AQrIAQXYAQHoAQH4AQOIAgGoAgO4Aoeun6oGwAIB0gIkNDQxN2JjZmMtNTFhOC00ZTE4LTk2MDQtZjBlMjBmZmM4Mjgz2AIG4AIB&ucfs=1&arphpl=1&group_adults=2&req_adults=2&no_rooms=1&group_children=0&req_children=0&hpos=24&hapos=24&sr_order=bayesian_review_score&srpvid=cd2e7e0419fc05d9&srepoch=1699206922&from_sustainable_property_sr=1&from=searchresults#hotelTmpl,"Located in Toulouse, 6.5 km from Amphitheatre Purpan-Ancely and 8.4 km from Toulouse Stadium, Suite jacuzzi ""spa privatif "" offers a spa and wellness centre and air conditioning. This property offers access to a balcony, free private parking and free WiFi.

The apartment comes with 1 bedroom, 1 bathroom, bed linen, towels, a flat-screen TV with streaming services, a dining area, a fully equipped kitchen, and a terrace with garden views.

The apartment can conveniently provide information at the reception to help guests to get around the area.

Suite jacuzzi ""spa privatif "" offers a hot tub. Guests can also relax in the garden.

Zénith de Toulouse is 8.7 km from the accommodation, while Diagora Convention Centre is 17 km away. The nearest airport is Toulouse-Blagnac Airport, 7 km from Suite jacuzzi ""spa privatif ""."
Residhome Toulouse Ponts Jumeaux,8.9,"2,295 reviews",43.61177000,1.42182500,https://www.booking.com/hotel/fr/residhome-toulouse-ponts-jumeaux.en-gb.html?aid=304142&label=gen173nr-1FCAEoggI46AdIM1gEaE2IAQGYAQm4AQrIAQXYAQHoAQH4AQOIAgGoAgO4Aoeun6oGwAIB0gIkNDQxN2JjZmMtNTFhOC00ZTE4LTk2MDQtZjBlMjBmZmM4Mjgz2AIG4AIB&ucfs=1&arphpl=1&group_adults=2&req_adults=2&no_rooms=1&group_children=0&req_children=0&hpos=23&hapos=23&sr_order=bayesian_review_score&srpvid=cd2e7e0419fc05d9&srepoch=1699206922&from_sustainable_property_sr=1&from=searchresults#hotelTmpl,"Residhome Toulouse Ponts Jumeaux is set in the Minimes - Barriere de Paris district of Toulouse, 3.6 km from Zénith de Toulouse and 3.7 km from Toulouse Expo. Free WiFi is offered throughout the property and private parking is available on site, (depending on the availability).

A fully organic breakfast is served every morning with fresh juices, seasonal fruits, breads, pastries, muesli and cereals, cheese and ham. Food allergies and intolerances can also be accommodated. The property works with eco-friendly suppliers.

Amphitheatre Purpan-Ancely is 5 km from Residhome Toulouse Ponts Jumeaux, while Toulouse Stadium is 6 km from the property. The nearest airport is Toulouse-Blagnac Airport, 8 km from the accommodation."
Le Bivouac - Toulouse,9.0,240 reviews,43.60422368,1.46223396,https://www.booking.com/hotel/fr/le-bivouac-toulouse-suite-ouest.en-gb.html?aid=304142&label=gen173nr-1FCAEoggI46AdIM1gEaE2IAQGYAQm4AQrIAQXYAQHoAQH4AQOIAgGoAgO4Aoeun6oGwAIB0gIkNDQxN2JjZmMtNTFhOC00ZTE4LTk2MDQtZjBlMjBmZmM4Mjgz2AIG4AIB&ucfs=1&arphpl=1&group_adults=2&req_adults=2&no_rooms=1&group_children=0&req_children=0&hpos=19&hapos=19&sr_order=bayesian_review_score&srpvid=cd2e7e0419fc05d9&srepoch=1699206922&from_sustainable_property_sr=1&from=searchresults#hotelTmpl,"Set in Toulouse, Le Bivouac - Toulouse offers inner courtyard views and free WiFi, 4.6 km from Toulouse Stadium and 5.9 km from Zénith de Toulouse.

The units have a fully equipped kitchenette with dining area, a microwave, kettle, and a toaster. There is a private bathroom with shower and a hair dryer in each unit, along with free toiletries.

A continental breakfast is available every morning at the bed and breakfast.

Popular points of interest near Le Bivouac - Toulouse include Jean-Jaures Metro Station, Marengo-SNCF Metro Station and Jardin Royal. The nearest airport is Toulouse-Blagnac Airport, 8 km from the accommodation."
Appart&Spa,9.4,82 reviews,43.65537749,1.43107591,https://www.booking.com/hotel/fr/appart-amp-spa.en-gb.html?aid=304142&label=gen173nr-1FCAEoggI46AdIM1gEaE2IAQGYAQm4AQrIAQXYAQHoAQH4AQOIAgGoAgO4Aoeun6oGwAIB0gIkNDQxN2JjZmMtNTFhOC00ZTE4LTk2MDQtZjBlMjBmZmM4Mjgz2AIG4AIB&ucfs=1&arphpl=1&group_adults=2&req_adults=2&no_rooms=1&group_children=0&req_children=0&hpos=18&hapos=18&sr_order=bayesian_review_score&srpvid=cd2e7e0419fc05d9&srepoch=1699206922&from=searchresults#hotelTmpl,"Appart&Spa is located in Toulouse a 15-minute drive from Toulouse-Blagnac Airport and offers apart hotel accommodation with a private hot tub and free WiFi access.

Appart&Spa apartment includes a terrace and a seating area with a flat-screen TV as well as a bathroom with a hairdryer and free toiletries.

There is also a fully equipped kitchenette with kitchenware, a microwave, a coffee machine and a refrigerator.

Toulouse Expo is a 20-minute drive from the property and Matabiau Train Station is located 7 km away. Free parking is available on site."
Concorde - Sublime T3 - Terrasse,8.9,50 reviews,43.61227650,1.44448840,https://www.booking.com/hotel/fr/concorde-sublime-t3-terrasse.en-gb.html?aid=304142&label=gen173nr-1FCAEoggI46AdIM1gEaE2IAQGYAQm4AQrIAQXYAQHoAQH4AQOIAgGoAgO4Aoeun6oGwAIB0gIkNDQxN2JjZmMtNTFhOC00ZTE4LTk2MDQtZjBlMjBmZmM4Mjgz2AIG4AIB&ucfs=1&arphpl=1&group_adults=2&req_adults=2&no_rooms=1&group_children=0&req_children=0&hpos=20&hapos=20&sr_order=bayesian_review_score&srpvid=cd2e7e0419fc05d9&srepoch=1699206922&from=searchresults#hotelTmpl,"Offering free WiFi, Concorde - Sublime T3 - Terrasse is situated in the centre of Toulouse within 4.6 km of Zénith de Toulouse and 4.9 km from Toulouse Stadium. This apartment is 5.9 km from Amphitheatre Purpan-Ancely and 12 km from Diagora Convention Centre.

The apartment with a balcony and inner courtyard views has 2 bedrooms, a living room, a flat-screen TV, an equipped kitchen with a dishwasher and an oven, and 1 bathroom with a shower.

The apartment offers a terrace.

Popular points of interest near Concorde - Sublime T3 - Terrasse include Jeanne d'Arc Metro Station, Jean-Jaures Metro Station and Compans Caffarelli Metro Station. The nearest airport is Toulouse-Blagnac Airport, 6 km from the accommodation."
La Tour Croix Baragnon,9.2,137 reviews,43.59964500,1.44675900,https://www.booking.com/hotel/fr/les-cocons-croix-baragnon-toulouse.en-gb.html?aid=304142&label=gen173nr-1FCAEoggI46AdIM1gEaE2IAQGYAQm4AQrIAQXYAQHoAQH4AQOIAgGoAgO4Aoeun6oGwAIB0gIkNDQxN2JjZmMtNTFhOC00ZTE4LTk2MDQtZjBlMjBmZmM4Mjgz2AIG4AIB&ucfs=1&arphpl=1&group_adults=2&req_adults=2&no_rooms=1&group_children=0&req_children=0&hpos=22&hapos=22&sr_order=bayesian_review_score&srpvid=cd2e7e0419fc05d9&srepoch=1699206922&from=searchresults#hotelTmpl,"Set within a 19-minute walk of Toulouse Expo and 2.1 km of Toulouse Stadium in the centre of Toulouse, LA TOUR CROIX BARAGNON provides accommodation with a kitchen. Free WiFi is provided.

A microwave and toaster are also offered, as well as a coffee machine.

Zénith de Toulouse is 3 km from the apartment, while Amphitheatre Purpan-Ancely is 4.3 km away. The nearest airport is Toulouse-Blagnac Airport, 7 km from the property."
Canal du Midi,9.4,111 reviews,43.61321738,1.42422512,https://www.booking.com/hotel/fr/canal-du-midi-toulouse21.en-gb.html?aid=304142&label=gen173nr-1FCAEoggI46AdIM1gEaE2IAQGYAQm4AQrIAQXYAQHoAQH4AQOIAgGoAgO4Aoeun6oGwAIB0gIkNDQxN2JjZmMtNTFhOC00ZTE4LTk2MDQtZjBlMjBmZmM4Mjgz2AIG4AIB&ucfs=1&arphpl=1&group_adults=2&req_adults=2&no_rooms=1&group_children=0&req_children=0&hpos=21&hapos=21&sr_order=bayesian_review_score&srpvid=cd2e7e0419fc05d9&srepoch=1699206922&from=searchresults#hotelTmpl,"Canal du Midi offers accommodation in Toulouse, 1.9 km from Zénith de Toulouse. The property is 2.2 km from Amphitheatre Purpan-Ancely.

There is a dining area and a kitchen complete with a microwave, a toaster and refrigerator. A flat-screen TV is featured. Canal du Midi features free WiFi.

Toulouse Expo is 3 km from Canal du Midi, while Jardin Japonais is 700 metres from the property. Blagnac Airport is 5 km away."
"Les jardins de Rangueil, Parking, Métro, Piscine",9.5,67 reviews,43.56426917,1.45581600,https://www.booking.com/hotel/fr/piscine-parking-metro-hopital-et-centre.en-gb.html?aid=304142&label=gen173nr-1FCAEoggI46AdIM1gEaE2IAQGYAQm4AQrIAQXYAQHoAQH4AQOIAgGoAgO4Aoeun6oGwAIB0gIkNDQxN2JjZmMtNTFhOC00ZTE4LTk2MDQtZjBlMjBmZmM4Mjgz2AIG4AIB&ucfs=1&arphpl=1&group_adults=2&req_adults=2&no_rooms=1&group_children=0&req_children=0&hpos=16&hapos=16&sr_order=bayesian_review_score&srpvid=cd2e7e0419fc05d9&srepoch=1699206922&from_sustainable_property_sr=1&from=searchresults#hotelTmpl,"Offering a garden and garden view, Les jardins de Rangueil, Parking, Métro, Piscine is situated in Toulouse, 4 km from Toulouse Stadium and 8.7 km from Diagora Convention Centre. This property offers a private pool, free WiFi and free private parking.

The apartment has 1 bedroom, 1 bathroom, bed linen, towels, a flat-screen TV with streaming services, a dining area, a fully equipped kitchen, and a balcony with pool views.

The apartment offers a picnic area. A a children's playground is also available at Les jardins de Rangueil, Parking, Métro, Piscine, while guests can also relax on the sun terrace.

Zénith de Toulouse is 10 km from the accommodation, while Amphitheatre Purpan-Ancely is 12 km from the property. The nearest airport is Toulouse-Blagnac Airport, 13 km from Les jardins de Rangueil, Parking, Métro, Piscine."
