hotel_name,hotel_score,hotel_reviews,hotel_lat,hotel_lon,hotel_url,hotel_description
CHAMBRE SPACIEUSE DANS MAISON ART DECO au CENTRE DE TOULOUSE,9.3,136 reviews,43.60114600,1.46270900,https://www.booking.com/hotel/fr/chambre-spacieuse-centre-toulouse.en-gb.html?aid=304142&label=gen173nr-1FCAEoggI46AdIM1gEaE2IAQGYAQm4AQrIAQXYAQHoAQH4AQOIAgGoAgO4Aqasn6oGwAIB0gIkOTI3MWQzNjMtZWRjNy00MjcwLThkYjEtNTJjNmIzMjU3ODQ32AIG4AIB&ucfs=1&arphpl=1&group_adults=2&req_adults=2&no_rooms=1&group_children=0&req_children=0&hpos=1&hapos=26&sr_order=bayesian_review_score&srpvid=17627d9305d1000b&srepoch=1699206697&from_sustainable_property_sr=1&from=searchresults#hotelTmpl,"CHAMBRE SPACIEUSE DANS MAISON ART DECO au CENTRE DE TOULOUSE is set in the Toulouse East district of Toulouse, 4.2 km from Toulouse Stadium, 5.5 km from Zénith de Toulouse and 8.3 km from Amphitheatre Purpan-Ancely. It has a terrace, city views and free WiFithroughout the property.

Towels and bed linen are offered in the homestay.

Guests at the homestay can enjoy a continental breakfast.

CHAMBRE SPACIEUSE DANS MAISON ART DECO au CENTRE DE TOULOUSE offers a picnic area.

Popular points of interest near the accommodation include Jardin Royal, Carmes Metro Station and Jean-Jaures Metro Station. The nearest airport is Toulouse-Blagnac Airport, 9 km from CHAMBRE SPACIEUSE DANS MAISON ART DECO au CENTRE DE TOULOUSE."
"Bel Appartement T3 de 60m2 avec Parking, Terrasse, proche du Métro et du Périph",8.7,37 reviews,43.62617280,1.47635980,https://www.booking.com/hotel/fr/mon-petit-cocon-60m2-avec-parking-au-pied-du-metro.en-gb.html?aid=304142&label=gen173nr-1FCAEoggI46AdIM1gEaE2IAQGYAQm4AQrIAQXYAQHoAQH4AQOIAgGoAgO4Aqasn6oGwAIB0gIkOTI3MWQzNjMtZWRjNy00MjcwLThkYjEtNTJjNmIzMjU3ODQ32AIG4AIB&ucfs=1&arphpl=1&group_adults=2&req_adults=2&no_rooms=1&group_children=0&req_children=0&hpos=3&hapos=28&sr_order=bayesian_review_score&srpvid=17627d9305d1000b&srepoch=1699206697&from=searchresults#hotelTmpl,"Situated in Toulouse in the Midi-Pyrénées region, Bel Appartement T3 de 60m2 avec Parking, Terrasse, proche du Métro et du Périph has a balcony. This property offers access to a terrace, free private parking and free WiFi.

The 2-bedroom apartment features a living room with a TV, a fully equipped kitchen with dishwasher and oven, and 1 bathroom with a hair dryer. Towels and bed linen are available in the apartment.

Toulouse Stadium is 7.3 km from the apartment, while Zénith de Toulouse is 8.5 km from the property. The nearest airport is Toulouse-Blagnac Airport, 13 km from Bel Appartement T3 de 60m2 avec Parking, Terrasse, proche du Métro et du Périph."
T2 Lounge & Design - Toulouse Centre Ramblas,8.9,91 reviews,43.60907361,1.45293283,https://www.booking.com/hotel/fr/ramblas-t2-cosy-3-personnes-a-proximite-des-centres-d-39-interets.en-gb.html?aid=304142&label=gen173nr-1FCAEoggI46AdIM1gEaE2IAQGYAQm4AQrIAQXYAQHoAQH4AQOIAgGoAgO4Aqasn6oGwAIB0gIkOTI3MWQzNjMtZWRjNy00MjcwLThkYjEtNTJjNmIzMjU3ODQ32AIG4AIB&ucfs=1&arphpl=1&group_adults=2&req_adults=2&no_rooms=1&group_children=0&req_children=0&hpos=7&hapos=32&sr_order=bayesian_review_score&srpvid=17627d9305d1000b&srepoch=1699206697&from=searchresults#hotelTmpl,"Offering free WiFi, T2 Lounge & Design - Toulouse Centre Ramblas is set in the centre of Toulouse within 4.6 km of Toulouse Stadium and 6.7 km from Zénith de Toulouse. It is situated 6.7 km from Amphitheatre Purpan-Ancely and offers a 24-hour front desk.

The 1-bedroom apartment is fitted with a living room with a flat-screen TV with streaming services, a fully equipped kitchenette with a microwave and toaster, and 1 bathroom with walk-in shower.

Popular points of interest near the apartment include Jean-Jaures Metro Station, Toulouse-Matabiau Station and Capitole Metro Station. The nearest airport is Toulouse-Blagnac Airport, 7 km from T2 Lounge & Design - Toulouse Centre Ramblas."
Appartement de prestige – rue des Arts,9.4,40 reviews,43.59999610,1.44726360,https://www.booking.com/hotel/fr/appartement-de-prestige-rue-des-arts-toulouse.en-gb.html?aid=304142&label=gen173nr-1FCAEoggI46AdIM1gEaE2IAQGYAQm4AQrIAQXYAQHoAQH4AQOIAgGoAgO4Aqasn6oGwAIB0gIkOTI3MWQzNjMtZWRjNy00MjcwLThkYjEtNTJjNmIzMjU3ODQ32AIG4AIB&ucfs=1&arphpl=1&group_adults=2&req_adults=2&no_rooms=1&group_children=0&req_children=0&hpos=8&hapos=33&sr_order=bayesian_review_score&srpvid=17627d9305d1000b&srepoch=1699206697&from_sustainable_property_sr=1&from=searchresults#hotelTmpl,"In the heart of Toulouse, set within a short distance of Esquirol Metro Station and Carmes Metro Station, Appartement de prestige – rue des Arts offers free WiFi, air conditioning and household amenities such as a microwave and coffee machine. The property features inner courtyard and quiet street views, and is 3.6 km from Zénith de Toulouse.

The 1-bedroom apartment is fitted with a living room with a flat-screen TV with streaming services, a fully equipped kitchen with dishwasher and oven, and 1 bathroom with a hair dryer. Towels and bed linen are featured in the apartment.

Popular points of interest near the apartment include Jean-Jaures Metro Station, Jardin Royal and Capitole Metro Station. The nearest airport is Toulouse-Blagnac Airport, 8 km from Appartement de prestige – rue des Arts."
TOULOUSE DUPLEX PLACE DU CAPITOLE,9.4,65 reviews,43.60387050,1.44404200,https://www.booking.com/hotel/fr/toulouse-duplex-place-du-capitole-toulouse1.en-gb.html?aid=304142&label=gen173nr-1FCAEoggI46AdIM1gEaE2IAQGYAQm4AQrIAQXYAQHoAQH4AQOIAgGoAgO4Aqasn6oGwAIB0gIkOTI3MWQzNjMtZWRjNy00MjcwLThkYjEtNTJjNmIzMjU3ODQ32AIG4AIB&ucfs=1&arphpl=1&group_adults=2&req_adults=2&no_rooms=1&group_children=0&req_children=0&hpos=4&hapos=29&sr_order=bayesian_review_score&srpvid=17627d9305d1000b&srepoch=1699206697&from=searchresults#hotelTmpl,"Situated in the centre of Toulouse, just 3.7 km from Zénith de Toulouse and 3.7 km from Toulouse Stadium, TOULOUSE DUPLEX PLACE DU CAPITOLE features accommodation with city views and free WiFi. It is located 6.6 km from Amphitheatre Purpan-Ancely and provides a lift.

The 1-bedroom apartment has a living room with a flat-screen TV with satellite channels, a fully equipped kitchen with a dishwasher and oven, and 1 bathroom with walk-in shower. Towels and bed linen are offered in the apartment.

Popular points of interest near the apartment include Place du Capitole, Le Pont Neuf and Esquirol Metro Station. The nearest airport is Toulouse-Blagnac Airport, 8 km from TOULOUSE DUPLEX PLACE DU CAPITOLE."
Villa Lea,9.1,225 reviews,43.58800317,1.38086474,https://www.booking.com/hotel/fr/maison-lea.en-gb.html?aid=304142&label=gen173nr-1FCAEoggI46AdIM1gEaE2IAQGYAQm4AQrIAQXYAQHoAQH4AQOIAgGoAgO4Aqasn6oGwAIB0gIkOTI3MWQzNjMtZWRjNy00MjcwLThkYjEtNTJjNmIzMjU3ODQ32AIG4AIB&ucfs=1&arphpl=1&group_adults=2&req_adults=2&no_rooms=1&group_children=0&req_children=0&hpos=2&hapos=27&sr_order=bayesian_review_score&srpvid=17627d9305d1000b&srepoch=1699206697&from=searchresults#hotelTmpl,"Offering a sun terrace and views of the garden, Maison Lea is situated in Toulouse.

Each room comes with a flat-screen TV. All rooms include a private bathroom. For your comfort, you will find free toiletries and a hair dryer.

Toulouse is 5 km from Maison Lea, while Montauban is 48 km from the property. The nearest airport is Toulouse-Blagnac Airport, 5 km from the property."
Appart Hôtel Clément Ader,8.8,"1,146 reviews",43.60944452,1.44867584,https://www.booking.com/hotel/fr/privilege-appart-clement-ader.en-gb.html?aid=304142&label=gen173nr-1FCAEoggI46AdIM1gEaE2IAQGYAQm4AQrIAQXYAQHoAQH4AQOIAgGoAgO4Aqasn6oGwAIB0gIkOTI3MWQzNjMtZWRjNy00MjcwLThkYjEtNTJjNmIzMjU3ODQ32AIG4AIB&ucfs=1&arphpl=1&group_adults=2&req_adults=2&no_rooms=1&group_children=0&req_children=0&hpos=6&hapos=31&sr_order=bayesian_review_score&srpvid=17627d9305d1000b&srepoch=1699206697&from_sustainable_property_sr=1&from=searchresults#hotelTmpl,"Located in Toulouse city centre, this 4-star residence features a heated outdoor swimming pool, a fitness centre and a sauna. The design apartments offer a wide-screen LCD TV and some have a furnished balcony.

All air-conditioned apartments have a fully-equipped open-plan kitchen with a dishwasher, microwave and a coffee maker. Each contemporary apartment includes free Wi-Fi access.

A buffet breakfast is served every morning in the breakfast room at this Privilège Appart-Hôtel. Guests can enjoy a drink in the lounge bar, Hall 23.

Matabiau Train Station is just 450 metres from Privilège Appart-Hôtel Clément Ader. The historic Place du Capitole is an 8-minute walk away and Toulouse Stadium is a 15-minute drive away. Private parking is available on site."
Le Grand Balcon Hotel,8.8,"2,904 reviews",43.60487367,1.44249469,https://www.booking.com/hotel/fr/le-grand-balcon-toulouse.en-gb.html?aid=304142&label=gen173nr-1FCAEoggI46AdIM1gEaE2IAQGYAQm4AQrIAQXYAQHoAQH4AQOIAgGoAgO4Aqasn6oGwAIB0gIkOTI3MWQzNjMtZWRjNy00MjcwLThkYjEtNTJjNmIzMjU3ODQ32AIG4AIB&ucfs=1&arphpl=1&group_adults=2&req_adults=2&no_rooms=1&group_children=0&req_children=0&hpos=5&hapos=30&sr_order=bayesian_review_score&srpvid=17627d9305d1000b&srepoch=1699206697&from=searchresults#hotelTmpl,"Set in central Toulouse, Grand Balcon Hotel is a 4-star hotel featuring a 1930s décor and a 24-hour reception. The property is 4 km from Toulouse Stadium and offers air-conditioned guest rooms with free WiFi access.

A flat-screen TV, a minibar and a Nespresso coffee machine are standard in each soundproofed room. Some rooms have a seating area. All of the contemporary bathrooms.

A buffet breakfast is served every morning at Le Grand Balcon Hotel. Enjoy a drink in the contemporary bar while reading the newspapers provided.

Place du Capitole is just 100 metres from the hotel and Capitole Metro Station is a 3-minute walk away. Galeries Lafayette is a 5-minute walk away."
6 Rue d'Aubuisson,9.4,57 reviews,43.60374139,1.45132891,https://www.booking.com/hotel/fr/6-rue-d-39-aubuisson.en-gb.html?aid=304142&label=gen173nr-1FCAEoggI46AdIM1gEaE2IAQGYAQm4AQrIAQXYAQHoAQH4AQOIAgGoAgO4Aqasn6oGwAIB0gIkOTI3MWQzNjMtZWRjNy00MjcwLThkYjEtNTJjNmIzMjU3ODQ32AIG4AIB&ucfs=1&arphpl=1&group_adults=2&req_adults=2&no_rooms=1&group_children=0&req_children=0&hpos=12&hapos=37&sr_order=bayesian_review_score&srpvid=17627d9305d1000b&srepoch=1699206697&from_sustainable_property_sr=1&from=searchresults#hotelTmpl,"Offering free WiFi and city views, 6 Rue d'Aubuisson is an accommodation situated right in the heart of Toulouse, just 600 metres from Capitole Metro Station and 800 metres from Jeanne d'Arc Metro Station. The 3-star apartment has inner courtyard views and is 3.7 km from Toulouse Stadium.

This apartment includes 2 bedrooms, a living room and a flat-screen TV, an equipped kitchen with a dining area, and 1 bathroom with a walk-in shower and a washing machine. Towels and bed linen are available in the apartment.

Both a bicycle rental service and a car rental service are available at the apartment.

Popular points of interest near 6 Rue d'Aubuisson include Place du Capitole, Esquirol Metro Station and Jean-Jaures Metro Station. The nearest airport is Toulouse-Blagnac, 7 km from the accommodation, and the property offers a paid airport shuttle service."
Sablotin SPA,9.6,49 reviews,43.63239489,1.44789798,https://www.booking.com/hotel/fr/sablotin-spa.en-gb.html?aid=304142&label=gen173nr-1FCAEoggI46AdIM1gEaE2IAQGYAQm4AQrIAQXYAQHoAQH4AQOIAgGoAgO4Aqasn6oGwAIB0gIkOTI3MWQzNjMtZWRjNy00MjcwLThkYjEtNTJjNmIzMjU3ODQ32AIG4AIB&ucfs=1&arphpl=1&group_adults=2&req_adults=2&no_rooms=1&group_children=0&req_children=0&hpos=10&hapos=35&sr_order=bayesian_review_score&srpvid=17627d9305d1000b&srepoch=1699206697&from=searchresults#hotelTmpl,"Boasting a hot tub, Sablotin SPA is situated in Toulouse. The air-conditioned accommodation is 6.3 km from Amphitheatre Purpan-Ancely, and guests benefit from complimentary WiFi and private parking available on site.

The apartment with a terrace and garden views has 1 bedroom, a living room, a flat-screen TV, an equipped kitchenette with a dishwasher and an oven, and 1 bathroom with a walk-in shower. Towels and bed linen are available in the apartment.

Guests at the apartment can enjoy a continental breakfast.

Guests can relax in the spa and wellness centre, including a hot tub, or in the garden.

Toulouse Stadium is 8 km from Sablotin SPA, while Zénith de Toulouse is 8.4 km from the property. The nearest airport is Toulouse-Blagnac Airport, 7 km from the accommodation."
B&B Garonnella,,,43.55371515,1.44085318,https://www.booking.com/hotel/fr/b-amp-b-garonella.en-gb.html?aid=304142&label=gen173nr-1FCAEoggI46AdIM1gEaE2IAQGYAQm4AQrIAQXYAQHoAQH4AQOIAgGoAgO4Aqasn6oGwAIB0gIkOTI3MWQzNjMtZWRjNy00MjcwLThkYjEtNTJjNmIzMjU3ODQ32AIG4AIB&ucfs=1&arphpl=1&group_adults=2&req_adults=2&no_rooms=1&group_children=0&req_children=0&hpos=13&hapos=38&sr_order=bayesian_review_score&srpvid=17627d9305d1000b&srepoch=1699206697&from=searchresults#hotelTmpl,"Located in Toulouse, B&B Garonella sits in a garden just by the Garonne River and offers an outdoor swimming pool with terrace furnished with sun loungers and a fitness room. Free Wi-Fi is provided.

The bungalow features wooden-walls and a large bedroom window overlooking the garden and the river. There is a private bathroom is fitted with a shower, free toiletries and hairdryer.

At your disposal, a kettle with tea bags, a NESPRESSO coffee machine with its capsules and a refrigerator.

Metro Station Université Paul-Sabatier is located 4.6 km away and Toulouse Zénith is 7.5 km away. Cité de L’Espace Theme Park is located 12.7 km away and Golf Club de Toulouse is just 2.8 km away."
T1 BIS COSY- Hypercentre - Clim - Métro - Wifi,8.5,34 reviews,43.60192160,1.44419420,https://www.booking.com/hotel/fr/t1-bis-cosy-hypercentre-comfort-tv-wifi.en-gb.html?aid=304142&label=gen173nr-1FCAEoggI46AdIM1gEaE2IAQGYAQm4AQrIAQXYAQHoAQH4AQOIAgGoAgO4Aqasn6oGwAIB0gIkOTI3MWQzNjMtZWRjNy00MjcwLThkYjEtNTJjNmIzMjU3ODQ32AIG4AIB&ucfs=1&arphpl=1&group_adults=2&req_adults=2&no_rooms=1&group_children=0&req_children=0&hpos=16&hapos=41&sr_order=bayesian_review_score&srpvid=17627d9305d1000b&srepoch=1699206697&from=searchresults#hotelTmpl,"Situated in the centre of Toulouse, within 3.3 km of Zénith de Toulouse and 3.3 km of Toulouse Stadium, T1 BIS COSY- Hypercentre - Clim - Métro - Wifi is an accommodation offering city views. This apartment is 6.2 km from Amphitheatre Purpan-Ancely and 11 km from Diagora Convention Centre.

With free WiFi, this 1-bedroom apartment features a satellite flat-screen TV and a kitchen with an oven and microwave. Towels and bed linen are available in the apartment.

Popular points of interest near the apartment include Esquirol Metro Station, Carmes Metro Station and Le Pont Neuf. The nearest airport is Toulouse-Blagnac Airport, 8 km from T1 BIS COSY- Hypercentre - Clim - Métro - Wifi."
L'authentique - Coeur de ville,9.1,94 reviews,43.60264300,1.44347500,https://www.booking.com/hotel/fr/le-cocoon-rvtoulouse-toulouse1234567891011121314.en-gb.html?aid=304142&label=gen173nr-1FCAEoggI46AdIM1gEaE2IAQGYAQm4AQrIAQXYAQHoAQH4AQOIAgGoAgO4Aqasn6oGwAIB0gIkOTI3MWQzNjMtZWRjNy00MjcwLThkYjEtNTJjNmIzMjU3ODQ32AIG4AIB&ucfs=1&arphpl=1&group_adults=2&req_adults=2&no_rooms=1&group_children=0&req_children=0&hpos=11&hapos=36&sr_order=bayesian_review_score&srpvid=17627d9305d1000b&srepoch=1699206697&from=searchresults#hotelTmpl,"Located in the centre of Toulouse, just 3.2 km from Zénith de Toulouse and 3.2 km from Toulouse Stadium, L'authentique - Coeur de ville provides accommodation with inner courtyard views and free WiFi. The 1-star apartment is 6.1 km from Amphitheatre Purpan-Ancely.

The 1-bedroom apartment is equipped with a living room with a flat-screen TV with satellite channels, a fully equipped kitchen with dishwasher and oven, and 1 bathroom with a hair dryer. Towels and bed linen are provided in the apartment.

Walking tours can be enjoyed nearby.

Popular points of interest near the apartment include Le Pont Neuf, Carmes Metro Station and Esquirol Metro Station. The nearest airport is Toulouse-Blagnac Airport, 8 km from L'authentique - Coeur de ville."
"La loge du Minotaure, parking et bureaux",9.6,57 reviews,43.57515409,1.47372821,https://www.booking.com/hotel/fr/59m2-parking-bureaux-au-hall-de-la-machine-cosy-et-rare.en-gb.html?aid=304142&label=gen173nr-1FCAEoggI46AdIM1gEaE2IAQGYAQm4AQrIAQXYAQHoAQH4AQOIAgGoAgO4Aqasn6oGwAIB0gIkOTI3MWQzNjMtZWRjNy00MjcwLThkYjEtNTJjNmIzMjU3ODQ32AIG4AIB&ucfs=1&arphpl=1&group_adults=2&req_adults=2&no_rooms=1&group_children=0&req_children=0&hpos=9&hapos=34&sr_order=bayesian_review_score&srpvid=17627d9305d1000b&srepoch=1699206697&from_sustainable_property_sr=1&from=searchresults#hotelTmpl,"Featuring garden views, La loge du Minotaure, parking et bureaux offers accommodation with a balcony and a coffee machine, around 5.7 km from Toulouse Stadium. It is set 6.2 km from Diagora Convention Centre and features a lift.

The 2-bedroom apartment is fitted with a living room with a flat-screen TV with streaming services, a fully equipped kitchen with dishwasher and oven, and 1 bathroom with bathrobes. Offering free private parking, this 3-star apartment also features free WiFithroughout the property.

A outdoor play equipment is also available at the apartment, while guests can also relax on the sun terrace.

Zénith de Toulouse is 11 km from La loge du Minotaure, parking et bureaux, while Amphitheatre Purpan-Ancely is 13 km away. The nearest airport is Toulouse-Blagnac Airport, 14 km from the accommodation."
Appart duplex 87m2 près d’Airbus,8.9,22 reviews,43.60361240,1.35280100,https://www.booking.com/hotel/fr/appart-duplex-87m2-pres-d-airbus.en-gb.html?aid=304142&label=gen173nr-1FCAEoggI46AdIM1gEaE2IAQGYAQm4AQrIAQXYAQHoAQH4AQOIAgGoAgO4Aqasn6oGwAIB0gIkOTI3MWQzNjMtZWRjNy00MjcwLThkYjEtNTJjNmIzMjU3ODQ32AIG4AIB&ucfs=1&arphpl=1&group_adults=2&req_adults=2&no_rooms=1&group_children=0&req_children=0&hpos=14&hapos=39&sr_order=bayesian_review_score&srpvid=17627d9305d1000b&srepoch=1699206697&from=searchresults#hotelTmpl,"Appart duplex 87m2 près d’Airbus is located in the Toulouse West district of Toulouse, 6.5 km from Amphitheatre Purpan-Ancely, 6.5 km from Zénith de Toulouse and 10 km from Toulouse Stadium. This property offers access to a balcony, free private parking and free WiFi.

The 2-bedroom apartment comes with a living room with a flat-screen TV, a fully equipped kitchen with dishwasher and oven, and 2 bathrooms with a hair dryer. Towels and bed linen are featured in the apartment.

Diagora Convention Centre is 20 km from the apartment, while Pierre Baudis Japanese Garden is 7.5 km away. The nearest airport is Toulouse-Blagnac Airport, 3 km from Appart duplex 87m2 près d’Airbus."
expat renting - Le Mosaïque - Patte d'Oie - Parking,9.5,39 reviews,43.59128560,1.42155960,https://www.booking.com/hotel/fr/new-le-mosaique-expatrenting-parking-prive.en-gb.html?aid=304142&label=gen173nr-1FCAEoggI46AdIM1gEaE2IAQGYAQm4AQrIAQXYAQHoAQH4AQOIAgGoAgO4Aqasn6oGwAIB0gIkOTI3MWQzNjMtZWRjNy00MjcwLThkYjEtNTJjNmIzMjU3ODQ32AIG4AIB&ucfs=1&arphpl=1&group_adults=2&req_adults=2&no_rooms=1&group_children=0&req_children=0&hpos=15&hapos=40&sr_order=bayesian_review_score&srpvid=17627d9305d1000b&srepoch=1699206697&from=searchresults#hotelTmpl,"Offering inner courtyard views, expat renting - Le Mosaïque - Patte d'Oie - Parking is an accommodation set in Toulouse, 2 km from Zénith de Toulouse and 1.8 km from Toulouse Stadium. This apartment offers free private parking, a 24-hour front desk and free WiFi.

The apartment with a terrace and city views has 3 bedrooms, a living room, a flat-screen TV, an equipped kitchen with a dishwasher and an oven, and 2 bathrooms with a shower.

Amphitheatre Purpan-Ancely is 4.9 km from the apartment, while Diagora Convention Centre is 12 km from the property. The nearest airport is Toulouse-Blagnac Airport, 6 km from expat renting - Le Mosaïque - Patte d'Oie - Parking."
LOVE HOTEL TOULOUSE : SUITE PLAYROOM,9.2,14 reviews,43.58734200,1.41816150,https://www.booking.com/hotel/fr/love-toulouse-suite-playroom.en-gb.html?aid=304142&label=gen173nr-1FCAEoggI46AdIM1gEaE2IAQGYAQm4AQrIAQXYAQHoAQH4AQOIAgGoAgO4Aqasn6oGwAIB0gIkOTI3MWQzNjMtZWRjNy00MjcwLThkYjEtNTJjNmIzMjU3ODQ32AIG4AIB&ucfs=1&arphpl=1&group_adults=2&req_adults=2&no_rooms=1&group_children=0&req_children=0&hpos=21&hapos=46&sr_order=bayesian_review_score&srpvid=17627d9305d1000b&srepoch=1699206697&from=searchresults#hotelTmpl,"LOVE HOTEL TOULOUSE: SUITE PLAYROOM in Toulouse offers accommodation with free WiFi, 2.2 km from Zénith de Toulouse, 1.9 km from Toulouse Stadium and 5.2 km from Amphitheatre Purpan-Ancely. This apartment is 3 km from Carmes Metro Station and 3.1 km from Jardin Royal.

This apartment will provide guests with 1 bedroom, a flat-screen TV, air conditioning and a DVD player.

Diagora Convention Centre is 12 km from the apartment, while Saint-Cyprien Republique Metro Station is 1.8 km from the property. The nearest airport is Toulouse-Blagnac Airport, 6 km from LOVE HOTEL TOULOUSE: SUITE PLAYROOM."
L'estival Champêtre - Métro et tramway a côté,7.9,32 reviews,43.59188490,1.44496040,https://www.booking.com/hotel/fr/estival-champetre-metro-et-tramway-a-cote-toulouse.en-gb.html?aid=304142&label=gen173nr-1FCAEoggI46AdIM1gEaE2IAQGYAQm4AQrIAQXYAQHoAQH4AQOIAgGoAgO4Aqasn6oGwAIB0gIkOTI3MWQzNjMtZWRjNy00MjcwLThkYjEtNTJjNmIzMjU3ODQ32AIG4AIB&ucfs=1&arphpl=1&group_adults=2&req_adults=2&no_rooms=1&group_children=0&req_children=0&hpos=25&hapos=50&sr_order=bayesian_review_score&srpvid=17627d9305d1000b&srepoch=1699206697&from=searchresults#hotelTmpl,"Situated in Toulouse, 3.5 km from Zénith de Toulouse and 6.4 km from Amphitheatre Purpan-Ancely, L'estival Champêtre - Métro et tramway a côté offers air conditioning. The accommodation is 1.8 km from the Toulouse Stadium and has free WiFithroughout the property.

This apartment has 1 bedroom, a kitchen with a microwave and a fridge, a flat-screen TV, a seating area and 1 bathroom fitted with a shower. Towels and bed linen are available in the apartment.

Popular points of interest near the apartment include Carmes Metro Station, Jardin Royal and Esquirol Metro Station. The nearest airport is Toulouse-Blagnac Airport, 8 km from L'estival Champêtre - Métro et tramway a côté."
Villa du Canal,9.3,159 reviews,43.58608662,1.45977176,https://www.booking.com/hotel/fr/villa-du-canal.en-gb.html?aid=304142&label=gen173nr-1FCAEoggI46AdIM1gEaE2IAQGYAQm4AQrIAQXYAQHoAQH4AQOIAgGoAgO4Aqasn6oGwAIB0gIkOTI3MWQzNjMtZWRjNy00MjcwLThkYjEtNTJjNmIzMjU3ODQ32AIG4AIB&ucfs=1&arphpl=1&group_adults=2&req_adults=2&no_rooms=1&group_children=0&req_children=0&hpos=23&hapos=48&sr_order=bayesian_review_score&srpvid=17627d9305d1000b&srepoch=1699206697&from=searchresults#hotelTmpl,"Situated in Toulouse and only 2.7 km from Toulouse Stadium, Villa du Canal features accommodation with garden views, free WiFi and free private parking. This property offers access to ping-pong.

This bed and breakfast will provide guests with a satellite flat-screen TV, a seating area and a CD player.

Guests at the bed and breakfast can enjoy a continental breakfast.

Villa du Canal offers an outdoor pool. Guests at the accommodation can enjoy cycling and hiking nearby, or make the most of the sun terrace.

Zénith de Toulouse is 5.6 km from Villa du Canal, while Amphitheatre Purpan-Ancely is 8.5 km from the property. The nearest airport is Toulouse-Blagnac, 10 km from the bed and breakfast, and the property offers a paid airport shuttle service."
Appartement au centre de Toulouse,9.0,48 reviews,43.61122940,1.44277060,https://www.booking.com/hotel/fr/studio-de-charme-quartier-des-chalets-a-toulouse.en-gb.html?aid=304142&label=gen173nr-1FCAEoggI46AdIM1gEaE2IAQGYAQm4AQrIAQXYAQHoAQH4AQOIAgGoAgO4Aqasn6oGwAIB0gIkOTI3MWQzNjMtZWRjNy00MjcwLThkYjEtNTJjNmIzMjU3ODQ32AIG4AIB&ucfs=1&arphpl=1&group_adults=2&req_adults=2&no_rooms=1&group_children=0&req_children=0&hpos=19&hapos=44&sr_order=bayesian_review_score&srpvid=17627d9305d1000b&srepoch=1699206697&from=searchresults#hotelTmpl,"Offering free WiFi, Appartement au centre de Toulouse is located in the centre of Toulouse within 4.5 km of Zénith de Toulouse and 5.1 km from Toulouse Stadium. This apartment is 5.8 km from Amphitheatre Purpan-Ancely and 12 km from Diagora Convention Centre.

The 1-bedroom apartment comes with a living room with a flat-screen TV, a fully equipped kitchen with dishwasher and oven, and 1 bathroom with a hair dryer. Towels and bed linen are featured in the apartment.

Popular points of interest near the apartment include Jeanne d'Arc Metro Station, Compans Caffarelli Metro Station and Jean-Jaures Metro Station. The nearest airport is Toulouse-Blagnac Airport, 6 km from Appartement au centre de Toulouse."
